tweet_url,author_url,avatar_url,avatar_binary,topic,author_name,content,tweet_type,tweet_language,comment_count,retweet_count,quote_count,praise_count,publish_time,fetch_time,tweet_id,screen_id,screen_name,tourist_crawl_status,video_urls,original_author,tweet_img_url,tweet_img_binary
https://twitter.com/14244412/status/863115853843320832,https://twitter.com/roblemos,https://pbs.twimg.com/profile_images/491959336675966976/MA08Oxgt_normal.jpeg,,,Rob Lemos,"RT @darienhuss: #WannaCry propagation payload contains previously unregistered domain, execution fails now that domain has been sinkholed h…",转发,en,0,1116,0,0,2017-05-12 19:37:10,2024-04-16 16:05:10,863115853843320832,14244412,roblemos,0,[],https://twitter.com/darienhuss,,
https://twitter.com/14244412/status/851784841146314753,https://twitter.com/roblemos,https://pbs.twimg.com/profile_images/491959336675966976/MA08Oxgt_normal.jpeg,,,Rob Lemos,RT @martinstabe: An updated version the @ftdata Visual Vocabulary #dataviz poster is now available from https://t.co/Ugp2h9Qywq #ddj https:…,转发,en,0,196,0,0,2017-04-11 13:11:46,2024-04-16 16:05:10,851784841146314753,14244412,roblemos,0,[],https://twitter.com/martinstabe,,
https://twitter.com/14244412/status/836946949379084289,https://twitter.com/roblemos,https://pbs.twimg.com/profile_images/491959336675966976/MA08Oxgt_normal.jpeg,,,Rob Lemos,"Fact-based journalism has an uphill battle, as people tend to believe what their candidate says, an MIT study finds. https://t.co/UT8y5wSZDh",原创,en,0,2,0,2,2017-03-01 14:31:17,2024-04-16 16:05:10,836946949379084289,14244412,roblemos,0,[],,,
https://twitter.com/14244412/status/834413958928928770,https://twitter.com/roblemos,https://pbs.twimg.com/profile_images/491959336675966976/MA08Oxgt_normal.jpeg,,,Rob Lemos,"A doc that tackles a sig issue for journalists: ""'Alternative Facts': how do you cover powerful people who lie?” https://t.co/MyXINUQdBe",原创,en,0,1,1,2,2017-02-22 14:46:05,2024-04-16 16:05:10,834413958928928770,14244412,roblemos,0,[],,,
https://twitter.com/14244412/status/829860394747453442,https://twitter.com/roblemos,https://pbs.twimg.com/profile_images/491959336675966976/MA08Oxgt_normal.jpeg,,,Rob Lemos,"Tonight’s must-read: State of Wash. v. President Trump et al. Court orders aren’t usually page-turners, but this is. https://t.co/LrmlstH4S6",原创,en,0,1,0,1,2017-02-10 01:11:50,2024-04-16 16:05:10,829860394747453442,14244412,roblemos,0,[],,,
https://twitter.com/14244412/status/827505888319647744,https://twitter.com/roblemos,https://pbs.twimg.com/profile_images/491959336675966976/MA08Oxgt_normal.jpeg,,,Rob Lemos,"RT @halvarflake: If you are trying to improve security, and you do so by adding code instead of removing code, odds are that you are doing…",转发,en,0,83,0,0,2017-02-03 13:15:52,2024-04-16 16:05:10,827505888319647744,14244412,roblemos,0,[],https://twitter.com/halvarflake,,
https://twitter.com/14244412/status/827200180915171330,https://twitter.com/roblemos,https://pbs.twimg.com/profile_images/491959336675966976/MA08Oxgt_normal.jpeg,,,Rob Lemos,"… so, if being done, would be on the backend, not on a client, making evidence hard to find. https://t.co/ECOMfsBsR4",引用,en,0,0,0,0,2017-02-02 17:01:06,2024-04-16 16:05:10,827200180915171330,14244412,roblemos,0,[],https://twitter.com/veorq,,
https://twitter.com/14244412/status/827199955244871681,https://twitter.com/roblemos,https://pbs.twimg.com/profile_images/491959336675966976/MA08Oxgt_normal.jpeg,,,Rob Lemos,"@veorq @thegrugq We know they are using automation and decision trees, because OS targeting requires it. But ML/AI are compute intensive ...",回复,en,0,0,0,0,2017-02-02 17:00:12,2024-04-16 16:05:22,827199955244871681,14244412,roblemos,0,[],https://twitter.com/veorq,,
https://twitter.com/14244412/status/827195730204975104,https://twitter.com/roblemos,https://pbs.twimg.com/profile_images/491959336675966976/MA08Oxgt_normal.jpeg,,,Rob Lemos,"They will all escape to Mars, so keep your eye out for some nice real estate. Or build a wall, depending on your political programming... https://t.co/WUmnQRTALT",引用,en,0,0,0,0,2017-02-02 16:43:25,2024-04-16 16:05:22,827195730204975104,14244412,roblemos,0,[],https://twitter.com/SarcasticRover,,
https://twitter.com/14244412/status/827165448072527874,https://twitter.com/roblemos,https://pbs.twimg.com/profile_images/491959336675966976/MA08Oxgt_normal.jpeg,,,Rob Lemos,"Apparently a trend. 11 of 26 justices appointed since 1937 became more liberal, while 7 became more conservative.  https://t.co/BsEn26KjkE https://t.co/CBx0hi2wMA",引用,en,0,0,0,0,2017-02-02 14:43:05,2024-04-16 16:05:22,827165448072527874,14244412,roblemos,0,[],https://twitter.com/roblemos,,
https://twitter.com/14244412/status/827162677755703296,https://twitter.com/roblemos,https://pbs.twimg.com/profile_images/491959336675966976/MA08Oxgt_normal.jpeg,,,Rob Lemos,Voting patterns of the U.S. Supreme Court. Is average justice’s move to the left over time an artifact of the M-Q index or an actual trend? https://t.co/7OxKDmAngD,引用,en,0,0,1,0,2017-02-02 14:32:04,2024-04-16 16:05:22,827162677755703296,14244412,roblemos,0,[],https://twitter.com/TheEconomist,,
https://twitter.com/14244412/status/827146177263042560,https://twitter.com/roblemos,https://pbs.twimg.com/profile_images/491959336675966976/MA08Oxgt_normal.jpeg,,,Rob Lemos,RT @SchoolOfData: #ddj @SchoolOfData is planning a course on R for journalists. Are you a data journalist? Help us fill this form! https://…,转发,en,0,20,0,0,2017-02-02 13:26:30,2024-04-16 16:05:22,827146177263042560,14244412,roblemos,0,[],https://twitter.com/SchoolOfData,,
https://twitter.com/14244412/status/827144238982914049,https://twitter.com/roblemos,https://pbs.twimg.com/profile_images/491959336675966976/MA08Oxgt_normal.jpeg,,,Rob Lemos,"Reuters statement on importance of journalism in nations where ""media is unwelcome and frequently under attack”  --https://t.co/69TD6RFH83",原创,en,0,0,0,0,2017-02-02 13:18:48,2024-04-16 16:05:22,827144238982914049,14244412,roblemos,0,[],,,
https://twitter.com/14244412/status/827135452494835714,https://twitter.com/roblemos,https://pbs.twimg.com/profile_images/491959336675966976/MA08Oxgt_normal.jpeg,,,Rob Lemos,Two comparisons of EOs: By absolute numbers per year - https://t.co/D9EYy2kW3j and regulations implemented by EO - https://t.co/ONitCszLcp,原创,en,0,1,0,0,2017-02-02 12:43:53,2024-04-16 16:05:22,827135452494835714,14244412,roblemos,0,[],,,
https://twitter.com/14244412/status/827134678821908483,https://twitter.com/roblemos,https://pbs.twimg.com/profile_images/491959336675966976/MA08Oxgt_normal.jpeg,,,Rob Lemos,"For those who are counting, Pres. Trump has issued 20 executive orders in the first 10 days. Pres. Obama issued 18. https://t.co/ZR4pSLbm6r",原创,en,0,0,0,1,2017-02-02 12:40:49,2024-04-16 16:05:22,827134678821908483,14244412,roblemos,0,[],,,
https://twitter.com/14244412/status/826432960912031744,https://twitter.com/roblemos,https://pbs.twimg.com/profile_images/491959336675966976/MA08Oxgt_normal.jpeg,,,Rob Lemos,"RT @AndrewYNg: CMU just made history: AI beats top humans at Texas Hold'em poker. A stunning accomplishment, comparable to Deep Blue &amp; Alph…",转发,en,0,1265,0,0,2017-01-31 14:12:26,2024-04-16 16:05:22,826432960912031744,14244412,roblemos,0,[],https://twitter.com/AndrewYNg,,
https://twitter.com/14244412/status/826395270208430081,https://twitter.com/roblemos,https://pbs.twimg.com/profile_images/491959336675966976/MA08Oxgt_normal.jpeg,,,Rob Lemos,"RT @SteveD3: Interesting find by @andrewsmhay , lots of exposed Jupyter Notebooks out there. https://t.co/TJJ3D3AeAC",转发,en,0,3,0,0,2017-01-31 11:42:40,2024-04-16 16:05:22,826395270208430081,14244412,roblemos,0,[],https://twitter.com/SteveD3,,
https://twitter.com/14244412/status/826236819872370688,https://twitter.com/roblemos,https://pbs.twimg.com/profile_images/491959336675966976/MA08Oxgt_normal.jpeg,,,Rob Lemos,"Ironic, but not nefarious. Interesting that it took this level of vetting — journalists looking at voter rolls — to detect, however. https://t.co/Vyegiw1tOI",原创,en,0,0,0,0,2017-01-31 01:13:03,2024-04-16 16:05:22,826236819872370688,14244412,roblemos,0,[],,,
https://twitter.com/14244412/status/826080865809788928,https://twitter.com/roblemos,https://pbs.twimg.com/profile_images/491959336675966976/MA08Oxgt_normal.jpeg,,,Rob Lemos,Full paper for study can be found at The Equality of Opportunity Project.  https://t.co/cRZ1pirq0Q https://t.co/fHZ5ED5g6u,引用,en,0,0,0,0,2017-01-30 14:53:20,2024-04-16 16:05:22,826080865809788928,14244412,roblemos,0,[],https://twitter.com/roblemos,,
https://twitter.com/14244412/status/826078559680741377,https://twitter.com/roblemos,https://pbs.twimg.com/profile_images/491959336675966976/MA08Oxgt_normal.jpeg,,,Rob Lemos,"Nice analysis. Takes a few seconds to figure out the chart, tho. Probably a better way to visualize the data... https://t.co/Sen4ZfQTmV",引用,en,0,0,2,0,2017-01-30 14:44:11,2024-04-16 16:05:22,826078559680741377,14244412,roblemos,0,[],https://twitter.com/TheEconomist,,
https://twitter.com/14244412/status/826075641170759681,https://twitter.com/roblemos,https://pbs.twimg.com/profile_images/491959336675966976/MA08Oxgt_normal.jpeg,,,Rob Lemos,"RT @thegrugq: Well, I released my twitter security guide. I hope it doesn't scare people off and helps them operate more safely. https://t.…",引用,en,0,32,0,0,2017-01-30 14:32:35,2024-04-16 16:05:22,826075641170759681,14244412,roblemos,0,[],https://twitter.com/thegrugq,,
https://twitter.com/14244412/status/826074920228622336,https://twitter.com/roblemos,https://pbs.twimg.com/profile_images/491959336675966976/MA08Oxgt_normal.jpeg,,,Rob Lemos,"RT @DonAndrewBailey: This just in!
@defcon has been cancelled due to no one being able to travel to it.",转发,en,0,22,0,0,2017-01-30 14:29:43,2024-04-16 16:05:22,826074920228622336,14244412,roblemos,0,[],https://twitter.com/DonAndrewBailey,,
https://twitter.com/14244412/status/826071929509535744,https://twitter.com/roblemos,https://pbs.twimg.com/profile_images/491959336675966976/MA08Oxgt_normal.jpeg,,,Rob Lemos,RT @KirkDBorne: Genetic Algorithms for feature selection in Data Analytics: https://t.co/o5jANjsYg9 #DataScience #MachineLearning by @artel…,转发,en,0,45,0,0,2017-01-30 14:17:50,2024-04-16 16:05:22,826071929509535744,14244412,roblemos,0,[],https://twitter.com/KirkDBorne,,
https://twitter.com/14244412/status/826071658079326208,https://twitter.com/roblemos,https://pbs.twimg.com/profile_images/491959336675966976/MA08Oxgt_normal.jpeg,,,Rob Lemos,"RT @LaszloBock2718: That time I fled Communist Romania to a refugee camp in Austria, came to America, &amp; years later became an exec @Google…",引用,en,0,39909,0,0,2017-01-30 14:16:45,2024-04-16 16:05:22,826071658079326208,14244412,roblemos,0,[],https://twitter.com/TrumpHotels,,
https://twitter.com/14244412/status/825078659472097282,https://twitter.com/roblemos,https://pbs.twimg.com/profile_images/491959336675966976/MA08Oxgt_normal.jpeg,,,Rob Lemos,Crunching numbers shows no link between rubber turf crumb and cancers in Wash. soccer players. https://t.co/hzgjj60xu9 #datasciencefridays,原创,en,0,0,0,0,2017-01-27 20:30:56,2024-04-16 16:05:22,825078659472097282,14244412,roblemos,0,[],,,
https://twitter.com/14244412/status/824989856740814848,https://twitter.com/roblemos,https://pbs.twimg.com/profile_images/491959336675966976/MA08Oxgt_normal.jpeg,,,Rob Lemos,I wonder if @virustotal can add “Malachite” to its antivirus engine detection panel? (ht: @MalwareJake) https://t.co/qA0fxGqqV6,引用,en,1,0,0,3,2017-01-27 14:38:04,2024-04-16 16:05:22,824989856740814848,14244412,roblemos,0,[],https://twitter.com/oscaron,,
https://twitter.com/14244412/status/824630674208460801,https://twitter.com/roblemos,https://pbs.twimg.com/profile_images/491959336675966976/MA08Oxgt_normal.jpeg,,,Rob Lemos,@halvarflake And Twitter sucks for getting points like this across.,回复,en,0,0,0,0,2017-01-26 14:50:48,2024-04-16 16:05:22,824630674208460801,14244412,roblemos,0,[],https://twitter.com/roblemos,,
https://twitter.com/14244412/status/824630245479346176,https://twitter.com/roblemos,https://pbs.twimg.com/profile_images/491959336675966976/MA08Oxgt_normal.jpeg,,,Rob Lemos,"@halvarflake My point — and obvsly not as practioner for 20yrs -- the study has advanced predictably, but the big diff is the names changed.",回复,en,1,0,0,1,2017-01-26 14:49:06,2024-04-16 16:05:39,824630245479346176,14244412,roblemos,0,[],https://twitter.com/halvarflake,,
https://twitter.com/14244412/status/824629043161157632,https://twitter.com/roblemos,https://pbs.twimg.com/profile_images/491959336675966976/MA08Oxgt_normal.jpeg,,,Rob Lemos,"@halvarflake And self-org maps, which I used long ago, are good for dimensionality reduction. They are ess. all clustering algos, however.",回复,en,0,0,0,1,2017-01-26 14:44:19,2024-04-16 16:05:39,824629043161157632,14244412,roblemos,0,[],https://twitter.com/halvarflake,,
https://twitter.com/14244412/status/824628548254240773,https://twitter.com/roblemos,https://pbs.twimg.com/profile_images/491959336675966976/MA08Oxgt_normal.jpeg,,,Rob Lemos,"@halvarflake Currently taking data-science and ML classes, and PCA is very similar to feed-forward neural networks.",回复,en,0,0,0,1,2017-01-26 14:42:21,2024-04-16 16:05:39,824628548254240773,14244412,roblemos,0,[],https://twitter.com/halvarflake,,
https://twitter.com/14244412/status/824628088797552640,https://twitter.com/roblemos,https://pbs.twimg.com/profile_images/491959336675966976/MA08Oxgt_normal.jpeg,,,Rob Lemos,"@halvarflake I think if you are looking for what is new and cool, neural networks are obviously not it, but that is more of a semantic issue",回复,en,0,0,0,1,2017-01-26 14:40:31,2024-04-16 16:05:39,824628088797552640,14244412,roblemos,0,[],https://twitter.com/halvarflake,,
https://twitter.com/14244412/status/824599537604030465,https://twitter.com/roblemos,https://pbs.twimg.com/profile_images/491959336675966976/MA08Oxgt_normal.jpeg,,,Rob Lemos,"Trusted professions: Top - Nurses/doctors, bottom - congress and car sales. Journalists - 23% of ppl give high marks https://t.co/93bfm6Rdy4",原创,en,0,0,0,0,2017-01-26 12:47:04,2024-04-16 16:05:39,824599537604030465,14244412,roblemos,0,[],,,
https://twitter.com/14244412/status/824598119291768832,https://twitter.com/roblemos,https://pbs.twimg.com/profile_images/491959336675966976/MA08Oxgt_normal.jpeg,,,Rob Lemos,"“Journalist” is not the most trusted profession, but charging some for covering protests is not a good precedent. https://t.co/gHke6JRAVw",原创,en,0,0,0,1,2017-01-26 12:41:26,2024-04-16 16:05:39,824598119291768832,14244412,roblemos,0,[],,,
https://twitter.com/14244412/status/824596796743753728,https://twitter.com/roblemos,https://pbs.twimg.com/profile_images/491959336675966976/MA08Oxgt_normal.jpeg,,,Rob Lemos,"@halvarflake Not “discarded."" They morphed into a larger discipline of machine learning &amp; AI. An old paper of mine: https://t.co/4nTZEmLPl4",回复,en,1,0,0,3,2017-01-26 12:36:11,2024-04-16 16:05:39,824596796743753728,14244412,roblemos,0,[],https://twitter.com/halvarflake,,
https://twitter.com/14244412/status/824328509132853248,https://twitter.com/roblemos,https://pbs.twimg.com/profile_images/491959336675966976/MA08Oxgt_normal.jpeg,,,Rob Lemos,"RT @KennethGeers: Russia arrests top cyber security expert amid allegations of treason
https://t.co/PFdFghoJVO",转发,en,0,5,0,0,2017-01-25 18:50:06,2024-04-16 16:05:39,824328509132853248,14244412,roblemos,0,[],https://twitter.com/KennethGeers,,
https://twitter.com/14244412/status/824326428741271553,https://twitter.com/roblemos,https://pbs.twimg.com/profile_images/491959336675966976/MA08Oxgt_normal.jpeg,,,Rob Lemos,"Nice headline @CBS: ""Badlands National Park Twitter account goes rogue, starts tweeting scientific facts” https://t.co/LyI6dnEw7G",原创,en,0,0,0,2,2017-01-25 18:41:50,2024-04-16 16:05:39,824326428741271553,14244412,roblemos,0,[],,,
https://twitter.com/14244412/status/819551312111173632,https://twitter.com/roblemos,https://pbs.twimg.com/profile_images/491959336675966976/MA08Oxgt_normal.jpeg,,,Rob Lemos,"Best quote: ""If you want someone to love you and you’re in the media, get a dog.” (3/3) @forecasterenten, channelling President Truman.",原创,en,0,1,0,5,2017-01-12 14:27:13,2024-04-16 16:05:39,819551312111173632,14244412,roblemos,0,[],,,
https://twitter.com/14244412/status/819550405445189633,https://twitter.com/roblemos,https://pbs.twimg.com/profile_images/491959336675966976/MA08Oxgt_normal.jpeg,,,Rob Lemos,"Upshot: ""Press people gossip, yes. But they don’t publish their gossip all the time for good reason.” (2/3)",原创,en,0,0,0,0,2017-01-12 14:23:37,2024-04-16 16:05:39,819550405445189633,14244412,roblemos,0,[],,,
https://twitter.com/14244412/status/819550243402502144,https://twitter.com/roblemos,https://pbs.twimg.com/profile_images/491959336675966976/MA08Oxgt_normal.jpeg,,,Rob Lemos,Good debate over the pros and (mostly) cons of publishing the Trump opposition document. (1/3) @538politics https://t.co/cjby9v6O4d,原创,en,0,0,0,0,2017-01-12 14:22:59,2024-04-16 16:05:39,819550243402502144,14244412,roblemos,0,[],,,
https://twitter.com/14244412/status/819189080357556225,https://twitter.com/roblemos,https://pbs.twimg.com/profile_images/491959336675966976/MA08Oxgt_normal.jpeg,,,Rob Lemos,"Clare: ""My mother thought journalism frightfully low, like a trade. She didn’t believe anything journalists wrote…” https://t.co/dZpufTybFs",原创,en,0,0,0,0,2017-01-11 14:27:51,2024-04-16 16:05:39,819189080357556225,14244412,roblemos,0,[],,,
https://twitter.com/14244412/status/819188264573796352,https://twitter.com/roblemos,https://pbs.twimg.com/profile_images/491959336675966976/MA08Oxgt_normal.jpeg,,,Rob Lemos,"RIP: Clare Hollingworth at 105, a remarkable woman and journalist who broke the news of Germany’s invasion of Poland https://t.co/1XssZRXsxw",原创,en,0,0,0,2,2017-01-11 14:24:36,2024-04-16 16:05:39,819188264573796352,14244412,roblemos,0,[],,,
https://twitter.com/14244412/status/809017515175190528,https://twitter.com/roblemos,https://pbs.twimg.com/profile_images/491959336675966976/MA08Oxgt_normal.jpeg,,,Rob Lemos,And now Russian hackers are apparently focusing on Germany’s political establishment. https://t.co/M5uDGfNzjY,原创,en,0,2,0,0,2016-12-14 12:49:41,2024-04-16 16:05:39,809017515175190528,14244412,roblemos,0,[],,,
https://twitter.com/14244412/status/809016372504260608,https://twitter.com/roblemos,https://pbs.twimg.com/profile_images/491959336675966976/MA08Oxgt_normal.jpeg,,,Rob Lemos,Good narrative article from @nytimes on the evidence for Russia hacking to influence U.S. politics. https://t.co/lNLTIgFn2f,原创,en,0,3,0,3,2016-12-14 12:45:08,2024-04-16 16:05:39,809016372504260608,14244412,roblemos,0,[],,,
https://twitter.com/14244412/status/801472476647714819,https://twitter.com/roblemos,https://pbs.twimg.com/profile_images/491959336675966976/MA08Oxgt_normal.jpeg,,,Rob Lemos,"… but, given pre-election hacking and nation-state interest, auditing paper ballots should be SOP, argues @jhalderm: https://t.co/Z2HiqQyymK",原创,en,0,2,0,1,2016-11-23 17:08:23,2024-04-16 16:05:39,801472476647714819,14244412,roblemos,0,[],,,
https://twitter.com/14244412/status/801472435023450112,https://twitter.com/roblemos,https://pbs.twimg.com/profile_images/491959336675966976/MA08Oxgt_normal.jpeg,,,Rob Lemos,No evidence of hacking or shenanigans in the election https://t.co/bXFkMtftnZ …,引用,en,0,0,0,0,2016-11-23 17:08:13,2024-04-16 16:05:39,801472435023450112,14244412,roblemos,0,[],https://twitter.com/Nate_Cohn,,
https://twitter.com/14244412/status/789550444817383424,https://twitter.com/roblemos,https://pbs.twimg.com/profile_images/491959336675966976/MA08Oxgt_normal.jpeg,,,Rob Lemos,Hey Internet. You don’t get to fail until Bruce Schneier (@schneierblog) tells you you can fail. Oh wait… https://t.co/tbyJfEFKAS,原创,en,0,1,0,2,2016-10-21 19:34:29,2024-04-16 16:05:39,789550444817383424,14244412,roblemos,0,[],,,
https://twitter.com/14244412/status/788346593523236865,https://twitter.com/roblemos,https://pbs.twimg.com/profile_images/491959336675966976/MA08Oxgt_normal.jpeg,,,Rob Lemos,My 3-part feature on the use of cyber-insurance by government agencies (mainly local and state) for @govtechnews. https://t.co/nZIO1Hd8eH,原创,en,0,1,0,1,2016-10-18 11:50:49,2024-04-16 16:05:39,788346593523236865,14244412,roblemos,0,[],,,
https://twitter.com/14244412/status/788344175980847104,https://twitter.com/roblemos,https://pbs.twimg.com/profile_images/491959336675966976/MA08Oxgt_normal.jpeg,,,Rob Lemos,@azcentral speaks out about death threats targeting its journalists and staff. https://t.co/NE49UkwsD7,回复,en,0,0,0,0,2016-10-18 11:41:12,2024-04-16 16:05:55,788344175980847104,14244412,roblemos,0,[],https://twitter.com/azcentral,,
https://twitter.com/14244412/status/779398184179228672,https://twitter.com/roblemos,https://pbs.twimg.com/profile_images/491959336675966976/MA08Oxgt_normal.jpeg,,,Rob Lemos,@Akamai's decision to stop supporting @briankrebs site is understandable. It's also signaled to any bad actor what's needed for success.,回复,en,0,0,0,0,2016-09-23 19:13:02,2024-04-16 16:05:55,779398184179228672,14244412,roblemos,0,[],https://twitter.com/Akamai,,
https://twitter.com/14244412/status/722406894942482432,https://twitter.com/roblemos,https://pbs.twimg.com/profile_images/491959336675966976/MA08Oxgt_normal.jpeg,,,Rob Lemos,"First cheating in Iron Man events, https://t.co/6q8P8wHA3l, and now in cycling events via tiny motors, https://t.co/NM4iBggB22",原创,en,0,0,0,1,2016-04-19 12:50:00,2024-04-16 16:05:55,722406894942482432,14244412,roblemos,0,[],,,
https://twitter.com/14244412/status/697440079535566848,https://twitter.com/roblemos,https://pbs.twimg.com/profile_images/491959336675966976/MA08Oxgt_normal.jpeg,,,Rob Lemos,"BleepingComputer, a community tech support site, is being sued and is trying to raise $100k for legal defense. https://t.co/QP22nshDq9",原创,en,0,1,0,1,2016-02-10 15:20:47,2024-04-16 16:05:55,697440079535566848,14244412,roblemos,0,[],,,
https://twitter.com/14244412/status/682551102684934144,https://twitter.com/roblemos,https://pbs.twimg.com/profile_images/491959336675966976/MA08Oxgt_normal.jpeg,,,Rob Lemos,An open webcam in Taiwan showing real-time RSA keys for logging in. https://t.co/VUlEqJlycQ,原创,en,0,6,0,5,2015-12-31 13:17:18,2024-04-16 16:05:55,682551102684934144,14244412,roblemos,0,[],,,
https://twitter.com/14244412/status/674688117245349888,https://twitter.com/roblemos,https://pbs.twimg.com/profile_images/491959336675966976/MA08Oxgt_normal.jpeg,,,Rob Lemos,"@alexhutton @NateSilver538 Thanks, Alex.",回复,en,0,0,0,0,2015-12-09 20:32:36,2024-04-16 16:05:55,674688117245349888,14244412,roblemos,0,[],https://twitter.com/alexhutton,,
https://twitter.com/14244412/status/644231701430988800,https://twitter.com/roblemos,https://pbs.twimg.com/profile_images/491959336675966976/MA08Oxgt_normal.jpeg,,,Rob Lemos,Props to NASA JPL for #IStandWithAhmed support. Need to support hardware hackers and budding engineers. https://t.co/MIVS4WJ5dM,引用,en,0,3,0,1,2015-09-16 19:29:41,2024-04-16 16:05:55,644231701430988800,14244412,roblemos,0,[],https://twitter.com/Indian_stats,,
https://twitter.com/14244412/status/618081696592887808,https://twitter.com/roblemos,https://pbs.twimg.com/profile_images/491959336675966976/MA08Oxgt_normal.jpeg,,,Rob Lemos,"Interesting connection between previous hacks of FinFisher and current HT hack, if claims are reliable. https://t.co/IyFeB1CKIT",原创,en,0,0,0,1,2015-07-06 15:38:54,2024-04-16 16:05:55,618081696592887808,14244412,roblemos,0,[],,,
https://twitter.com/14244412/status/586239411093909504,https://twitter.com/roblemos,https://pbs.twimg.com/profile_images/491959336675966976/MA08Oxgt_normal.jpeg,,,Rob Lemos,"Good articles on journalism issues, esp. plagiarism and ethics -- http://t.co/J2AQLcbgPZ @mffisher and http://t.co/Rvbsz8vDA8 @moniguzman",原创,en,0,2,0,2,2015-04-09 18:49:02,2024-04-16 16:05:55,586239411093909504,14244412,roblemos,0,[],,,
https://twitter.com/14244412/status/556095833142464512,https://twitter.com/roblemos,https://pbs.twimg.com/profile_images/491959336675966976/MA08Oxgt_normal.jpeg,,,Rob Lemos,"RT @daveaitel: Thinks we are in ""Cyber Conflict"" not ""Cyber War”. &lt; I’ve always used the former term, never the latter.",原创,en,1,6,0,4,2015-01-16 14:29:13,2024-04-16 16:05:55,556095833142464512,14244412,roblemos,0,[],,,
https://twitter.com/14244412/status/543786946422898688,https://twitter.com/roblemos,https://pbs.twimg.com/profile_images/491959336675966976/MA08Oxgt_normal.jpeg,,,Rob Lemos,RT @the_intercept: Operation Socialist: The Inside Story of How British Spies Hacked Belgium’s Largest Telco: http://t.co/TVRGt3XDzn by @rj…,转发,en,0,97,0,0,2014-12-13 15:18:05,2024-04-16 16:05:55,543786946422898688,14244412,roblemos,0,[],https://twitter.com/the_intercept,,
https://twitter.com/14244412/status/543780991425593344,https://twitter.com/roblemos,https://pbs.twimg.com/profile_images/491959336675966976/MA08Oxgt_normal.jpeg,,,Rob Lemos,Two sides of the debate about looking at and reporting on the leaked Sony docs. - Pro: http://t.co/wjfN3dWwMK - Con: http://t.co/7UG61c6NzQ,原创,en,0,1,0,2,2014-12-13 14:54:25,2024-04-16 16:05:55,543780991425593344,14244412,roblemos,0,[],,,
https://twitter.com/14244412/status/542682616395476992,https://twitter.com/roblemos,https://pbs.twimg.com/profile_images/491959336675966976/MA08Oxgt_normal.jpeg,,,Rob Lemos,RT @DennisF: This is the best security advisory of the year. http://t.co/eSH4wcscaq,转发,en,0,150,0,0,2014-12-10 14:09:52,2024-04-16 16:05:55,542682616395476992,14244412,roblemos,0,[],https://twitter.com/DennisF,,
