tweet_url,author_url,avatar_url,avatar_binary,topic,author_name,content,tweet_type,tweet_language,comment_count,retweet_count,quote_count,praise_count,publish_time,fetch_time,tweet_id,screen_id,screen_name,tourist_crawl_status,video_urls,original_author,tweet_img_url,tweet_img_binary
https://twitter.com/14244412/status/244069069786066944,https://twitter.com/roblemos,https://pbs.twimg.com/profile_images/491959336675966976/MA08Oxgt_normal.jpeg,,,Rob Lemos,RT @joshcorman: TED talk ... how  your phone/carrier records your whole life... http://t.co/7Tl5Hw6k &lt; A solid talk on an interesting topic.,原创,en,0,0,0,0,2012-09-07 13:46:15,2024-04-16 16:07:23,244069069786066944,14244412,roblemos,0,[],,,
https://twitter.com/14244412/status/243419311597817856,https://twitter.com/roblemos,https://pbs.twimg.com/profile_images/491959336675966976/MA08Oxgt_normal.jpeg,,,Rob Lemos,@DarthNull @HappyNihilist @ErrataRob @jadedsecurity Trying to GTD this morning. Feel free to DM me with details of any interesting tidbits.,回复,en,0,0,0,0,2012-09-05 18:44:21,2024-04-16 16:07:23,243419311597817856,14244412,roblemos,0,[],https://twitter.com/DarthNull,,
https://twitter.com/14244412/status/243136731182936064,https://twitter.com/roblemos,https://pbs.twimg.com/profile_images/491959336675966976/MA08Oxgt_normal.jpeg,,,Rob Lemos,RT @AllClearID on UDID leak: AllClear ID NOT invovled in this incident.  Official info: http://t.co/KRkJZAYA,原创,en,0,0,0,0,2012-09-05 00:01:28,2024-04-16 16:07:24,243136731182936064,14244412,roblemos,0,[],,,
https://twitter.com/14244412/status/243135181001744384,https://twitter.com/roblemos,https://pbs.twimg.com/profile_images/491959336675966976/MA08Oxgt_normal.jpeg,,,Rob Lemos,"RT @j_zimms: The rare internet moment when everyone wins. Anon gets lulz, Gawker gets pageviews, @adrianchen proves he looks good in a tutu.",原创,en,0,0,0,0,2012-09-04 23:55:19,2024-04-16 16:07:24,243135181001744384,14244412,roblemos,0,[],,,
https://twitter.com/14244412/status/243135064035180545,https://twitter.com/roblemos,https://pbs.twimg.com/profile_images/491959336675966976/MA08Oxgt_normal.jpeg,,,Rob Lemos,"@maradydd @erratarob @mattblaze Yes, my current iPad's UDID is on the list. The name of the device as well.  Not an AllClearID user.",回复,en,1,0,0,0,2012-09-04 23:54:51,2024-04-16 16:07:36,243135064035180545,14244412,roblemos,0,[],https://twitter.com/maradydd,,
https://twitter.com/14244412/status/243076068595081216,https://twitter.com/roblemos,https://pbs.twimg.com/profile_images/491959336675966976/MA08Oxgt_normal.jpeg,,,Rob Lemos,"@bobmcmillan When a breach notification arrives in my inbox, I'll let you -- and everyone else -- know.",回复,en,1,1,0,0,2012-09-04 20:00:25,2024-04-16 16:07:36,243076068595081216,14244412,roblemos,0,[],https://twitter.com/bobmcmillan,,
https://twitter.com/14244412/status/243075786721083393,https://twitter.com/roblemos,https://pbs.twimg.com/profile_images/491959336675966976/MA08Oxgt_normal.jpeg,,,Rob Lemos,"@ErrataRob Find a better way to do it, listing all my apps seems a bit extreme. BTW, I'm still wondering where my breach notification is...",回复,en,0,0,0,0,2012-09-04 19:59:18,2024-04-16 16:07:36,243075786721083393,14244412,roblemos,0,[],https://twitter.com/ErrataRob,,
https://twitter.com/14244412/status/243074413115891712,https://twitter.com/roblemos,https://pbs.twimg.com/profile_images/491959336675966976/MA08Oxgt_normal.jpeg,,,Rob Lemos,RT @adamjodonnell: URL that has the full list? &lt; I'm referring to the 1m public list with links on Pastebin. No idea on the 12m list.,原创,en,0,0,0,0,2012-09-04 19:53:50,2024-04-16 16:07:36,243074413115891712,14244412,roblemos,0,[],,,
https://twitter.com/14244412/status/243073928904470528,https://twitter.com/roblemos,https://pbs.twimg.com/profile_images/491959336675966976/MA08Oxgt_normal.jpeg,,,Rob Lemos,"So, only my IPad is on the UDID list. There was a similar name,  but I got my old iPhone and confirmed it's not on the list. 1 of 5 devices.",原创,en,5,0,0,0,2012-09-04 19:51:55,2024-04-16 16:07:36,243073928904470528,14244412,roblemos,0,[],,,
https://twitter.com/14244412/status/243017839500480512,https://twitter.com/roblemos,https://pbs.twimg.com/profile_images/491959336675966976/MA08Oxgt_normal.jpeg,,,Rob Lemos,"RT @kylemaxwell: can you tell us whether you're a member of the NCFTA? &lt; No, I'm not. And I've gotten ""no comments"" from them too.",原创,en,0,0,0,0,2012-09-04 16:09:02,2024-04-16 16:07:36,243017839500480512,14244412,roblemos,0,[],,,
https://twitter.com/14244412/status/243016308923449344,https://twitter.com/roblemos,https://pbs.twimg.com/profile_images/491959336675966976/MA08Oxgt_normal.jpeg,,,Rob Lemos,"For the record, since I'm reporting this story, my iPad2 is definitely on the list and possibly my old iPhone. Otherwise, no comment.",原创,en,1,0,0,0,2012-09-04 16:02:57,2024-04-16 16:07:36,243016308923449344,14244412,roblemos,0,[],,,
https://twitter.com/14244412/status/243013619233730560,https://twitter.com/roblemos,https://pbs.twimg.com/profile_images/491959336675966976/MA08Oxgt_normal.jpeg,,,Rob Lemos,"@eljeffto More likely, the FBI doesn't want to fuel the speculation.",回复,en,0,0,0,0,2012-09-04 15:52:16,2024-04-16 16:07:36,243013619233730560,14244412,roblemos,0,[],https://twitter.com/eljeffto,,
https://twitter.com/14244412/status/243001804340736000,https://twitter.com/roblemos,https://pbs.twimg.com/profile_images/491959336675966976/MA08Oxgt_normal.jpeg,,,Rob Lemos,"RT @spacerog: When did 'spear phishing' become a 'targeted cyber attack' &lt; historically, it was a targeted attack before spearphishing.",原创,en,0,0,0,0,2012-09-04 15:05:19,2024-04-16 16:07:36,243001804340736000,14244412,roblemos,0,[],,,
https://twitter.com/14244412/status/243001409388290048,https://twitter.com/roblemos,https://pbs.twimg.com/profile_images/491959336675966976/MA08Oxgt_normal.jpeg,,,Rob Lemos,"FBI regarding possible UDID file leak: ""We are not commenting on that.""",原创,en,1,8,0,2,2012-09-04 15:03:45,2024-04-16 16:07:36,243001409388290048,14244412,roblemos,0,[],,,
https://twitter.com/14244412/status/242986339417595904,https://twitter.com/roblemos,https://pbs.twimg.com/profile_images/491959336675966976/MA08Oxgt_normal.jpeg,,,Rob Lemos,"@mikko Shouldn't that more honestly read ""the iPad of a person named 'Obama'""?",回复,en,0,0,0,0,2012-09-04 14:03:52,2024-04-16 16:07:36,242986339417595904,14244412,roblemos,0,[],https://twitter.com/mikko,,
https://twitter.com/14244412/status/239068425828306944,https://twitter.com/roblemos,https://pbs.twimg.com/profile_images/491959336675966976/MA08Oxgt_normal.jpeg,,,Rob Lemos,RT @dinodaizovi: Inspiring: I’ve made a conscious decision to live a life that is not driven by someone else’s priority http://t.co/4ZbAZc3T,原创,en,0,0,0,0,2012-08-24 18:35:29,2024-04-16 16:07:36,239068425828306944,14244412,roblemos,0,[],,,
https://twitter.com/14244412/status/235830509471690752,https://twitter.com/roblemos,https://pbs.twimg.com/profile_images/491959336675966976/MA08Oxgt_normal.jpeg,,,Rob Lemos,"RT @spacerog: We are better than Space X, and we're not afraid to show it, We are NASA and we know it http://t.co/JEhq60GT &lt;  Throw down!",原创,en,0,0,0,0,2012-08-15 20:09:09,2024-04-16 16:07:36,235830509471690752,14244412,roblemos,0,[],,,
https://twitter.com/14244412/status/235792397001428992,https://twitter.com/roblemos,https://pbs.twimg.com/profile_images/491959336675966976/MA08Oxgt_normal.jpeg,,,Rob Lemos,"RT @daveaitel: In a few short hours ... I'll be on CNBC talking about how awesome security companies are. &lt; Fueling the bubble, Dave?",原创,en,0,0,0,0,2012-08-15 17:37:42,2024-04-16 16:07:36,235792397001428992,14244412,roblemos,0,[],,,
https://twitter.com/14244412/status/235754754620420096,https://twitter.com/roblemos,https://pbs.twimg.com/profile_images/491959336675966976/MA08Oxgt_normal.jpeg,,,Rob Lemos,Vat-grown meat http://t.co/Yjl8FYJy Lets hope they don't confuse recipe for meat with their other product: tissue. #SoylentGreenIsPeople,原创,en,1,0,0,0,2012-08-15 15:08:08,2024-04-16 16:07:36,235754754620420096,14244412,roblemos,0,[],,,
https://twitter.com/14244412/status/235738036565069824,https://twitter.com/roblemos,https://pbs.twimg.com/profile_images/491959336675966976/MA08Oxgt_normal.jpeg,,,Rob Lemos,"RT @DarkReading: Researchers hunt down sources of viruses, memes: http://t.co/7JFrcWmR",原创,en,0,0,0,0,2012-08-15 14:01:42,2024-04-16 16:07:37,235738036565069824,14244412,roblemos,0,[],,,
https://twitter.com/14244412/status/235732439782281216,https://twitter.com/roblemos,https://pbs.twimg.com/profile_images/491959336675966976/MA08Oxgt_normal.jpeg,,,Rob Lemos,"@ryanaraine No monolithic ""worms"" or ""viruses"" these days. Malware spreads like a worm or virus. Anyways, FinFisher has no self-prop, AFAIK.",回复,en,0,0,0,0,2012-08-15 13:39:27,2024-04-16 16:07:37,235732439782281216,14244412,roblemos,0,[],https://twitter.com/ryanaraine,,
https://twitter.com/14244412/status/235731830979051520,https://twitter.com/roblemos,https://pbs.twimg.com/profile_images/491959336675966976/MA08Oxgt_normal.jpeg,,,Rob Lemos,"@ryanaraine With140 char couldn't include ""virus"". Also, any debate over labels is futile, as malware now has attributes, not identities.",回复,en,0,0,0,0,2012-08-15 13:37:02,2024-04-16 16:07:37,235731830979051520,14244412,roblemos,0,[],https://twitter.com/ryanaraine,,
https://twitter.com/14244412/status/235729021894270976,https://twitter.com/roblemos,https://pbs.twimg.com/profile_images/491959336675966976/MA08Oxgt_normal.jpeg,,,Rob Lemos,"RT @paperghost: Okay, so someone made an amazing webcomic about Space Invaders. http://t.co/hRsMmjUM &lt; Well done!",原创,en,0,0,0,1,2012-08-15 13:25:53,2024-04-16 16:07:37,235729021894270976,14244412,roblemos,0,[],,,
https://twitter.com/14244412/status/235728193779273729,https://twitter.com/roblemos,https://pbs.twimg.com/profile_images/491959336675966976/MA08Oxgt_normal.jpeg,,,Rob Lemos,"FinFisher government #spyware spreading across the globe -  http://t.co/5FBET4gv &lt; Not ""spreading"" since it's not a worm. #badheadline",原创,en,1,0,0,0,2012-08-15 13:22:35,2024-04-16 16:07:37,235728193779273729,14244412,roblemos,0,[],,,
https://twitter.com/14244412/status/235454775435591680,https://twitter.com/roblemos,https://pbs.twimg.com/profile_images/491959336675966976/MA08Oxgt_normal.jpeg,,,Rob Lemos,"If true, truly a low point for airlines: ""United Airlines Lost My Friend's 10 Year Old Daughter And Didn't Care"" http://t.co/vWZMnu3j",原创,en,0,1,0,0,2012-08-14 19:16:07,2024-04-16 16:07:50,235454775435591680,14244412,roblemos,0,[],,,
https://twitter.com/14244412/status/235377566893080576,https://twitter.com/roblemos,https://pbs.twimg.com/profile_images/491959336675966976/MA08Oxgt_normal.jpeg,,,Rob Lemos,The future of journalism accdg to Forbes: Let advertisers write the copy via a platform to publish their own content http://t.co/RebwTN2B,原创,en,0,0,0,0,2012-08-14 14:09:19,2024-04-16 16:07:50,235377566893080576,14244412,roblemos,0,[],,,
https://twitter.com/14244412/status/235072955955159041,https://twitter.com/roblemos,https://pbs.twimg.com/profile_images/491959336675966976/MA08Oxgt_normal.jpeg,,,Rob Lemos,"@adamjodonnell Hmmm, you could probably get some brogrammers. Oh, wait, you mean a different kind of ""offensive security""? #badumbump",回复,en,0,0,0,0,2012-08-13 17:58:54,2024-04-16 16:07:50,235072955955159041,14244412,roblemos,0,[],https://twitter.com/adamjodonnell,,
https://twitter.com/14244412/status/235056258414166017,https://twitter.com/roblemos,https://pbs.twimg.com/profile_images/491959336675966976/MA08Oxgt_normal.jpeg,,,Rob Lemos,"@markrussinovich As a writer, I reverse letters all the time. I almost always catch  it. That s.o. didn't is not a sign of being an amateur.",回复,en,0,0,0,0,2012-08-13 16:52:33,2024-04-16 16:07:50,235056258414166017,14244412,roblemos,0,[],https://twitter.com/markrussinovich,,
https://twitter.com/14244412/status/235008267804360705,https://twitter.com/roblemos,https://pbs.twimg.com/profile_images/491959336675966976/MA08Oxgt_normal.jpeg,,,Rob Lemos,@mikko Good to see that other countries' patent systems are also broken ...,回复,en,0,0,0,0,2012-08-13 13:41:51,2024-04-16 16:07:50,235008267804360705,14244412,roblemos,0,[],https://twitter.com/mikko,,
https://twitter.com/14244412/status/235002306909855744,https://twitter.com/roblemos,https://pbs.twimg.com/profile_images/491959336675966976/MA08Oxgt_normal.jpeg,,,Rob Lemos,RT @asronline: This is what’s really going down on Mars #curiosity http://t.co/OsCvNfmk,原创,en,0,0,0,0,2012-08-13 13:18:10,2024-04-16 16:07:50,235002306909855744,14244412,roblemos,0,[],,,
https://twitter.com/14244412/status/235000199595040768,https://twitter.com/roblemos,https://pbs.twimg.com/profile_images/491959336675966976/MA08Oxgt_normal.jpeg,,,Rob Lemos,"RT @brentweeks: Got an email from a ""fan"" outraged that novel (that took) two years, six days-a-week is $13 in ebook. Enjoy your $4 coffee.",原创,en,0,0,0,0,2012-08-13 13:09:48,2024-04-16 16:07:50,235000199595040768,14244412,roblemos,0,[],,,
https://twitter.com/14244412/status/234040874265358336,https://twitter.com/roblemos,https://pbs.twimg.com/profile_images/491959336675966976/MA08Oxgt_normal.jpeg,,,Rob Lemos,"@DavidGewirtz, ""An economic extinction-level event"" &lt; Really? Economies don't die. The rules just change and economies adapt as do people.",回复,en,0,0,0,0,2012-08-10 21:37:47,2024-04-16 16:07:50,234040874265358336,14244412,roblemos,0,[],https://twitter.com/DavidGewirtz,,
https://twitter.com/14244412/status/233920640820846592,https://twitter.com/roblemos,https://pbs.twimg.com/profile_images/491959336675966976/MA08Oxgt_normal.jpeg,,,Rob Lemos,"With all the navel gazing over tech journalism, this column from the Economist on balance in political reporting: http://t.co/9qwsgSEY",原创,en,0,0,0,0,2012-08-10 13:40:01,2024-04-16 16:07:50,233920640820846592,14244412,roblemos,0,[],,,
https://twitter.com/14244412/status/233635484193157120,https://twitter.com/roblemos,https://pbs.twimg.com/profile_images/491959336675966976/MA08Oxgt_normal.jpeg,,,Rob Lemos,"@bobmcmillan @raistolo Recognizing the agenda, and acknowledging it in what we write, is the best we can do sometimes.",回复,en,0,0,0,1,2012-08-09 18:46:54,2024-04-16 16:07:50,233635484193157120,14244412,roblemos,0,[],https://twitter.com/bobmcmillan,,
https://twitter.com/14244412/status/233634856339386369,https://twitter.com/roblemos,https://pbs.twimg.com/profile_images/491959336675966976/MA08Oxgt_normal.jpeg,,,Rob Lemos,"@bobmcmillan @raistolo Because we don't have the time/facilities/oppnty to get the best data, so we rely on others - all, who have agendas.",回复,en,0,0,0,1,2012-08-09 18:44:25,2024-04-16 16:07:50,233634856339386369,14244412,roblemos,0,[],https://twitter.com/bobmcmillan,,
https://twitter.com/14244412/status/233627461148094464,https://twitter.com/roblemos,https://pbs.twimg.com/profile_images/491959336675966976/MA08Oxgt_normal.jpeg,,,Rob Lemos,"@bobmcmillan Thanks for clarifying. Either way, tho, I would say the story is in the data. Really getting better, or really getting worse?",回复,en,0,0,0,0,2012-08-09 18:15:01,2024-04-16 16:07:50,233627461148094464,14244412,roblemos,0,[],https://twitter.com/bobmcmillan,,
https://twitter.com/14244412/status/233621731372302336,https://twitter.com/roblemos,https://pbs.twimg.com/profile_images/491959336675966976/MA08Oxgt_normal.jpeg,,,Rob Lemos,"@bobmcmillan And, clarifying that ""threat"" is a poor data point. Threats are psychological. Attacks are real. Give me data on attacks.",回复,en,0,0,0,0,2012-08-09 17:52:15,2024-04-16 16:07:50,233621731372302336,14244412,roblemos,0,[],https://twitter.com/bobmcmillan,,
https://twitter.com/14244412/status/233621363099828224,https://twitter.com/roblemos,https://pbs.twimg.com/profile_images/491959336675966976/MA08Oxgt_normal.jpeg,,,Rob Lemos,"@bobmcmillan Unless you are reading s.t. into my words that isn't there, I'm not saying things are getting worse. I'm asking for data.",回复,en,1,0,0,0,2012-08-09 17:50:48,2024-04-16 16:07:50,233621363099828224,14244412,roblemos,0,[],https://twitter.com/bobmcmillan,,
https://twitter.com/14244412/status/233619109638713344,https://twitter.com/roblemos,https://pbs.twimg.com/profile_images/491959336675966976/MA08Oxgt_normal.jpeg,,,Rob Lemos,"@bobmcmillan Perhaps. IMO, overall, we raised the bar somewhat, but only to reduce easy attacks. Targeted attacks seem to happen more often.",回复,en,1,0,0,0,2012-08-09 17:41:50,2024-04-16 16:07:50,233619109638713344,14244412,roblemos,0,[],https://twitter.com/bobmcmillan,,
https://twitter.com/14244412/status/233615739079241728,https://twitter.com/roblemos,https://pbs.twimg.com/profile_images/491959336675966976/MA08Oxgt_normal.jpeg,,,Rob Lemos,"@bobmcmillan Threats are not real, but perceived. Threats are good marketing, real is about good data.",回复,en,1,1,0,0,2012-08-09 17:28:27,2024-04-16 16:07:50,233615739079241728,14244412,roblemos,0,[],https://twitter.com/bobmcmillan,,
https://twitter.com/14244412/status/233615551363166208,https://twitter.com/roblemos,https://pbs.twimg.com/profile_images/491959336675966976/MA08Oxgt_normal.jpeg,,,Rob Lemos,"@bobmcmillan It's self-fulfilling: As long as we talk about the threat of cyberattack, we expose ourselves to the ""threat,"" but not attacks.",回复,en,0,0,0,0,2012-08-09 17:27:42,2024-04-16 16:07:50,233615551363166208,14244412,roblemos,0,[],https://twitter.com/bobmcmillan,,
https://twitter.com/14244412/status/233586453198827520,https://twitter.com/roblemos,https://pbs.twimg.com/profile_images/491959336675966976/MA08Oxgt_normal.jpeg,,,Rob Lemos,"RT @danchodanchev: Russia did not sponsor the dev of ZeuS, SpyEye, or Ice X ... Instead, it tolerated (it). &lt; And reaped the tax benefits.",原创,en,0,1,0,0,2012-08-09 15:32:04,2024-04-16 16:07:50,233586453198827520,14244412,roblemos,0,[],,,
https://twitter.com/14244412/status/233585976176435201,https://twitter.com/roblemos,https://pbs.twimg.com/profile_images/491959336675966976/MA08Oxgt_normal.jpeg,,,Rob Lemos,"RT @joshcorman: I keep realizing how good reporters are at Social Engineering &lt; Josh, I'm a reporter stuck in Nigeria. Plz send $1.2 m.",原创,en,0,0,0,0,2012-08-09 15:30:11,2024-04-16 16:07:50,233585976176435201,14244412,roblemos,0,[],,,
https://twitter.com/14244412/status/233576879473442816,https://twitter.com/roblemos,https://pbs.twimg.com/profile_images/491959336675966976/MA08Oxgt_normal.jpeg,,,Rob Lemos,"RT @briankrebs: if one removes the Gauss trojan from a PC, is it then said to be degaussed? &lt; Only if your hard drive is erased bc of it.",原创,en,1,0,0,0,2012-08-09 14:54:02,2024-04-16 16:07:50,233576879473442816,14244412,roblemos,0,[],,,
https://twitter.com/14244412/status/233569417160687616,https://twitter.com/roblemos,https://pbs.twimg.com/profile_images/491959336675966976/MA08Oxgt_normal.jpeg,,,Rob Lemos,"""Hack"" as a prostitute or hackney (for hire) cited in 1755 Johnson's dictionary. http://t.co/XrCEak0W Used to describe writers of the day.",原创,en,1,1,0,0,2012-08-09 14:24:23,2024-04-16 16:08:05,233569417160687616,14244412,roblemos,0,[],,,
https://twitter.com/14244412/status/233561238297276416,https://twitter.com/roblemos,https://pbs.twimg.com/profile_images/491959336675966976/MA08Oxgt_normal.jpeg,,,Rob Lemos,"@JoyRidErno @mikko @ErrataRob Apparently goes back into the 1700s. See Fulford's ""When hacks attract"" http://t.co/kInl0FDH via @Wikipedia",回复,en,0,0,0,0,2012-08-09 13:51:53,2024-04-16 16:08:05,233561238297276416,14244412,roblemos,0,[],https://twitter.com/ErnoVanhala,,
https://twitter.com/14244412/status/233560373561798657,https://twitter.com/roblemos,https://pbs.twimg.com/profile_images/491959336675966976/MA08Oxgt_normal.jpeg,,,Rob Lemos,"@JoyRidErno @mikko @ErrataRob Thus, golfers, writers, newsies and programmers can all be ""hack(er)s"" -  directly jumped into programming.",回复,en,0,0,0,0,2012-08-09 13:48:27,2024-04-16 16:08:05,233560373561798657,14244412,roblemos,0,[],https://twitter.com/ErnoVanhala,,
https://twitter.com/14244412/status/233559789492396032,https://twitter.com/roblemos,https://pbs.twimg.com/profile_images/491959336675966976/MA08Oxgt_normal.jpeg,,,Rob Lemos,"@JoyRidErno @mikko @ErrataRob ""Hack"" from the 1800s, a term used by pros to deride unskilled or untrained people in their occupation.",回复,en,0,0,0,0,2012-08-09 13:46:07,2024-04-16 16:08:05,233559789492396032,14244412,roblemos,0,[],https://twitter.com/ErnoVanhala,,
https://twitter.com/14244412/status/233328190616109056,https://twitter.com/roblemos,https://pbs.twimg.com/profile_images/491959336675966976/MA08Oxgt_normal.jpeg,,,Rob Lemos,RT @SarcasticRover: Everytime science gets an answer it just raises MORE QUESTIONS. All science should be TRUE OR FALSE! DO A SCIENCE? TRUE!,原创,en,0,0,0,0,2012-08-08 22:25:50,2024-04-16 16:08:05,233328190616109056,14244412,roblemos,0,[],,,
https://twitter.com/14244412/status/233317190827384833,https://twitter.com/roblemos,https://pbs.twimg.com/profile_images/491959336675966976/MA08Oxgt_normal.jpeg,,,Rob Lemos,"RT @nickdepetrillo: Crypto is hard, lets become journalists! &lt; Ah, read @csoghoian's post. Got it. Still don't like the generalization, tho.",原创,en,0,0,0,0,2012-08-08 21:42:07,2024-04-16 16:08:05,233317190827384833,14244412,roblemos,0,[],,,
https://twitter.com/14244412/status/233292289378758657,https://twitter.com/roblemos,https://pbs.twimg.com/profile_images/491959336675966976/MA08Oxgt_normal.jpeg,,,Rob Lemos,"@nickdepetrillo Of course, you can make that argument for any profession, including information security.",原创,en,0,0,0,0,2012-08-08 20:03:10,2024-04-16 16:08:05,233292289378758657,14244412,roblemos,0,[],,,
https://twitter.com/14244412/status/233192809165885440,https://twitter.com/roblemos,https://pbs.twimg.com/profile_images/491959336675966976/MA08Oxgt_normal.jpeg,,,Rob Lemos,"RT @nickdepetrillo: Crypto is hard, let's become journalists! &lt; Just step away from the keyboard, Nick...",原创,en,0,0,0,0,2012-08-08 13:27:52,2024-04-16 16:08:05,233192809165885440,14244412,roblemos,0,[],,,
https://twitter.com/14244412/status/232471171055095808,https://twitter.com/roblemos,https://pbs.twimg.com/profile_images/491959336675966976/MA08Oxgt_normal.jpeg,,,Rob Lemos,"RT @stiennon: Good morning Curiosity: http://t.co/ITT724sy &lt; Well done, NASA. Great video sim of landing  http://t.co/pzBprcXK",原创,en,0,0,0,1,2012-08-06 13:40:20,2024-04-16 16:08:05,232471171055095808,14244412,roblemos,0,[],,,
https://twitter.com/14244412/status/231079758895644672,https://twitter.com/roblemos,https://pbs.twimg.com/profile_images/491959336675966976/MA08Oxgt_normal.jpeg,,,Rob Lemos,"@bobmcmillan Well, the solar farm is cool...",回复,en,0,0,0,0,2012-08-02 17:31:22,2024-04-16 16:08:05,231079758895644672,14244412,roblemos,0,[],https://twitter.com/bobmcmillan,,
https://twitter.com/14244412/status/231049955488460800,https://twitter.com/roblemos,https://pbs.twimg.com/profile_images/491959336675966976/MA08Oxgt_normal.jpeg,,,Rob Lemos,"@bobmcmillan pix of a mystery Apple project in NC http://t.co/46mgGzCI &lt; Mystery project? Like UFOs in the desert? Oh, it's a datacenter...",回复,en,1,0,0,0,2012-08-02 15:32:56,2024-04-16 16:08:05,231049955488460800,14244412,roblemos,0,[],https://twitter.com/bobmcmillan,,
https://twitter.com/14244412/status/231047804389310467,https://twitter.com/roblemos,https://pbs.twimg.com/profile_images/491959336675966976/MA08Oxgt_normal.jpeg,,,Rob Lemos,RT @metalabasia: China's Huawei responds to US hackers http://t.co/4y9Kn6Nr &lt; @41414141 from the US? I guess the US-China angle sells...,原创,en,0,0,0,0,2012-08-02 15:24:23,2024-04-16 16:08:05,231047804389310467,14244412,roblemos,0,[],,,
https://twitter.com/14244412/status/227820126303580160,https://twitter.com/roblemos,https://pbs.twimg.com/profile_images/491959336675966976/MA08Oxgt_normal.jpeg,,,Rob Lemos,Out running this morning in Las Vegas and a valet from Caesar's ran out to me and handed me a bottle of cold water. Made my morning.,原创,en,0,0,0,1,2012-07-24 17:38:45,2024-04-16 16:08:05,227820126303580160,14244412,roblemos,0,[],,,
https://twitter.com/14244412/status/227125537582239744,https://twitter.com/roblemos,https://pbs.twimg.com/profile_images/491959336675966976/MA08Oxgt_normal.jpeg,,,Rob Lemos,"RT @treyford: #BlackHat email post mortem now live: ""Hanlon's Razor"" http://bit.ly/PBg4A7",原创,en,0,0,0,0,2012-07-22 19:38:42,2024-04-16 16:08:05,227125537582239744,14244412,roblemos,0,[],,,
https://twitter.com/14244412/status/227123891544391680,https://twitter.com/roblemos,https://pbs.twimg.com/profile_images/491959336675966976/MA08Oxgt_normal.jpeg,,,Rob Lemos,Phishing using the Black Hat delegate list? I pinged editors at sister pub Dark Reading and they pointed to this: http://bit.ly/PBg4A7,原创,en,0,0,0,0,2012-07-22 19:32:10,2024-04-16 16:08:05,227123891544391680,14244412,roblemos,0,[],,,
https://twitter.com/14244412/status/223402633568862209,https://twitter.com/roblemos,https://pbs.twimg.com/profile_images/491959336675966976/MA08Oxgt_normal.jpeg,,,Rob Lemos,"RT @davidgura: Col. Ken Allard alleges Sanger ""deliberately placed his country at significant risk for his own profit."" http://t.co/L5wWQgWN",原创,en,0,0,0,0,2012-07-12 13:05:13,2024-04-16 16:08:05,223402633568862209,14244412,roblemos,0,[],,,
https://twitter.com/14244412/status/217251165937745922,https://twitter.com/roblemos,https://pbs.twimg.com/profile_images/491959336675966976/MA08Oxgt_normal.jpeg,,,Rob Lemos,"RT @nselby: If ""posting on FB is as good as sex"" is true for you, you're doing at least one of these things wrong. http://t.co/Yjcu4sfV",原创,en,0,0,0,0,2012-06-25 13:41:28,2024-04-16 16:08:05,217251165937745922,14244412,roblemos,0,[],,,
