tweet_url,author_url,avatar_url,avatar_binary,topic,author_name,content,tweet_type,tweet_language,comment_count,retweet_count,quote_count,praise_count,publish_time,fetch_time,tweet_id,screen_id,screen_name,tourist_crawl_status,video_urls,original_author,tweet_img_url,tweet_img_binary
https://twitter.com/157286064/status/1254889577254354954,https://twitter.com/StewartRoom,https://pbs.twimg.com/profile_images/1284859941392732163/ruD9OQ_6_normal.jpg,,,"Stewart Room - #privacy, #data & #security lawyer","@CBridge_Chief @DPCIreland GDPR won’t ‘collapse’, but it has a big credibility problem, but it isn’t simply a problem caused in Ireland. The scheme over promised in the sell and expectations weren’t realistic.",回复,en,1,0,0,0,2020-04-27 21:46:04,2024-04-17 07:26:40,1254889577254354954,157286064,StewartRoom,0,[],https://twitter.com/CBridge_Chief,,
https://twitter.com/157286064/status/1254889812940775426,https://twitter.com/StewartRoom,https://pbs.twimg.com/profile_images/1284859941392732163/ruD9OQ_6_normal.jpg,,,"Stewart Room - #privacy, #data & #security lawyer",@CBridge_Chief @DPCIreland Apologies for the multiple buts!,回复,en,0,0,0,0,2020-04-27 21:47:00,2024-04-17 07:26:40,1254889812940775426,157286064,StewartRoom,0,[],https://twitter.com/StewartRoom,,
https://twitter.com/157286064/status/1254887999839633424,https://twitter.com/StewartRoom,https://pbs.twimg.com/profile_images/1284859941392732163/ruD9OQ_6_normal.jpg,,,"Stewart Room - #privacy, #data & #security lawyer","UK approach to #contacttracing seemingly adopts centralised approach. Apple/Google &amp; DP-3T plans decentralised, claiming offers better privacy. Unless we’re arguing about very peripheral, marginal privacy gains, there must be legal risk in centralisation, surely.",原创,en,0,1,0,2,2020-04-27 21:39:48,2024-04-17 07:26:40,1254887999839633424,157286064,StewartRoom,0,[],,,
https://twitter.com/157286064/status/1254767798686846980,https://twitter.com/StewartRoom,https://pbs.twimg.com/profile_images/1284859941392732163/ruD9OQ_6_normal.jpg,,,"Stewart Room - #privacy, #data & #security lawyer","RT @DWF_Law: Join @StewartRoom for the next #Technology and #Data Leaders Forum Webinar on Tuesday 5th May, where he will be discussing the…",转发,en,0,2,0,0,2020-04-27 13:42:10,2024-04-17 07:26:40,1254767798686846980,157286064,StewartRoom,0,[],https://twitter.com/DWF_Law,,
https://twitter.com/157286064/status/1254764187382931456,https://twitter.com/StewartRoom,https://pbs.twimg.com/profile_images/1284859941392732163/ruD9OQ_6_normal.jpg,,,"Stewart Room - #privacy, #data & #security lawyer","Technology &amp; Data Leaders Forum update!!!

I'm delighted to announce that the second #DWF Technology and Data Leaders Forum is being held on 5th May, at 3 pm UK time.  I will be joined by leading barrister Timothy Pitt-Payne QC and…https://t.co/594yJcCBKK https://t.co/jDbqeQtXlY",原创,en,0,0,0,0,2020-04-27 13:27:49,2024-04-17 07:26:52,1254764187382931456,157286064,StewartRoom,0,[],,,
https://twitter.com/157286064/status/1254393844025774081,https://twitter.com/StewartRoom,https://pbs.twimg.com/profile_images/1284859941392732163/ruD9OQ_6_normal.jpg,,,"Stewart Room - #privacy, #data & #security lawyer","Very interesting article on existential threats. Seems we’re ok for now on the supanova front, but we’re at a one in six risk of another threat doing us in over remainder of the century. 

Jeepers, dont like those odds at all 

https://t.co/LXtYH1ZTHI",原创,en,0,0,0,1,2020-04-26 12:56:12,2024-04-17 07:26:52,1254393844025774081,157286064,StewartRoom,0,[],,,
https://twitter.com/157286064/status/1254299521317773324,https://twitter.com/StewartRoom,https://pbs.twimg.com/profile_images/1284859941392732163/ruD9OQ_6_normal.jpg,,,"Stewart Room - #privacy, #data & #security lawyer",@Teddybreath Me too,回复,en,0,0,0,1,2020-04-26 06:41:24,2024-04-17 07:26:52,1254299521317773324,157286064,StewartRoom,0,[],https://twitter.com/Teddybreath,,
https://twitter.com/157286064/status/1254294790042267648,https://twitter.com/StewartRoom,https://pbs.twimg.com/profile_images/1284859941392732163/ruD9OQ_6_normal.jpg,,,"Stewart Room - #privacy, #data & #security lawyer","@RDBinns And also a challenge of false positives and negatives according to WHO 

https://t.co/vYGbyfnV4t",回复,en,0,0,0,2,2020-04-26 06:22:36,2024-04-17 07:26:52,1254294790042267648,157286064,StewartRoom,0,[],https://twitter.com/RDBinns,,
https://twitter.com/157286064/status/1254293644372312064,https://twitter.com/StewartRoom,https://pbs.twimg.com/profile_images/1284859941392732163/ruD9OQ_6_normal.jpg,,,"Stewart Room - #privacy, #data & #security lawyer","Clear and accessible article on some of the challenges of #ContactTracing apps.

Contact apps won't end lockdown. But they might kill off democracy https://t.co/G02VekiLrB",原创,en,1,0,0,0,2020-04-26 06:18:03,2024-04-17 07:26:52,1254293644372312064,157286064,StewartRoom,0,[],,,
https://twitter.com/157286064/status/1254149958741221385,https://twitter.com/StewartRoom,https://pbs.twimg.com/profile_images/1284859941392732163/ruD9OQ_6_normal.jpg,,,"Stewart Room - #privacy, #data & #security lawyer","Sunday Morning Love You

Bhim Niroula 

https://t.co/VKhM2p0ZBU",原创,en,0,0,0,1,2020-04-25 20:47:05,2024-04-17 07:26:52,1254149958741221385,157286064,StewartRoom,0,[],,,
https://twitter.com/157286064/status/1254142234028539904,https://twitter.com/StewartRoom,https://pbs.twimg.com/profile_images/1284859941392732163/ruD9OQ_6_normal.jpg,,,"Stewart Room - #privacy, #data & #security lawyer",Sunday Morning Love You (I want to love you everyday) - get him in the studio and this song on the radio; it’s what the country needs right now  #BritainsGotTalent,原创,en,1,0,0,4,2020-04-25 20:16:24,2024-04-17 07:26:52,1254142234028539904,157286064,StewartRoom,0,[],,,
https://twitter.com/157286064/status/1253803705461346306,https://twitter.com/StewartRoom,https://pbs.twimg.com/profile_images/1284859941392732163/ruD9OQ_6_normal.jpg,,,"Stewart Room - #privacy, #data & #security lawyer","Breaking down the most complex challenges of C-19 into 6 buckets they seem to be
😷protect highly vulnerable and front line
😷virus control &amp; reduction
😷minimise economic harm &amp; hardship
😷maintain Rule of Law, inc rights
😷lockdown exit strategy
😷Trump",原创,en,0,0,0,3,2020-04-24 21:51:12,2024-04-17 07:26:52,1253803705461346306,157286064,StewartRoom,0,[],,,
https://twitter.com/157286064/status/1253793597570387968,https://twitter.com/StewartRoom,https://pbs.twimg.com/profile_images/1284859941392732163/ruD9OQ_6_normal.jpg,,,"Stewart Room - #privacy, #data & #security lawyer","Contact Tracing and smart phone OS push: if bluetooth api is pushed in OS updates, PEC terminal device storage rules apply? If so, is there a consent problem here?",原创,en,1,0,0,1,2020-04-24 21:11:02,2024-04-17 07:26:52,1253793597570387968,157286064,StewartRoom,0,[],,,
https://twitter.com/157286064/status/1253797265501827073,https://twitter.com/StewartRoom,https://pbs.twimg.com/profile_images/1284859941392732163/ruD9OQ_6_normal.jpg,,,"Stewart Room - #privacy, #data & #security lawyer","@CBridge_Chief Thanks, my friend. Btw, you didn’t tell me what you actually think of The (Rolling) Stones new song. Like?",回复,en,1,0,0,1,2020-04-24 21:25:37,2024-04-17 07:26:52,1253797265501827073,157286064,StewartRoom,0,[],https://twitter.com/CBridge_Chief,,
https://twitter.com/157286064/status/1253796145865908229,https://twitter.com/StewartRoom,https://pbs.twimg.com/profile_images/1284859941392732163/ruD9OQ_6_normal.jpg,,,"Stewart Room - #privacy, #data & #security lawyer","@CBridge_Chief Glad agreed on PEC Daragh, tho’ isn’t the OS push by A &amp; G separate to the app dev? If so &amp; person didn’t want the facility installed (re the big picture point from earlier) where is the freedom of choice, bearing in mind the incremental nature of OS updates? Asking for a friend.",回复,en,1,0,0,0,2020-04-24 21:21:10,2024-04-17 07:26:52,1253796145865908229,157286064,StewartRoom,0,[],https://twitter.com/CBridge_Chief,,
https://twitter.com/157286064/status/1253791572560424962,https://twitter.com/StewartRoom,https://pbs.twimg.com/profile_images/1284859941392732163/ruD9OQ_6_normal.jpg,,,"Stewart Room - #privacy, #data & #security lawyer",RT @auntievice: The Onion announced it will close its publication citing its writers can no longer come up with anything more absurd than a…,转发,en,0,7061,0,0,2020-04-24 21:02:59,2024-04-17 07:26:52,1253791572560424962,157286064,StewartRoom,0,[],https://twitter.com/auntievice,,
https://twitter.com/157286064/status/1253789200262008833,https://twitter.com/StewartRoom,https://pbs.twimg.com/profile_images/1284859941392732163/ruD9OQ_6_normal.jpg,,,"Stewart Room - #privacy, #data & #security lawyer","@PrivacyMatters Lovely photos, Pat.",回复,en,0,0,0,0,2020-04-24 20:53:34,2024-04-17 07:26:52,1253789200262008833,157286064,StewartRoom,0,[],https://twitter.com/PrivacyMatters,,
https://twitter.com/157286064/status/1253788050968186882,https://twitter.com/StewartRoom,https://pbs.twimg.com/profile_images/1284859941392732163/ruD9OQ_6_normal.jpg,,,"Stewart Room - #privacy, #data & #security lawyer","@FergalMK @VariolationT @MehreenKhn @ActNowTraining Fergal, I don’t know you, but I’m sure you’re a reasonable person. Read what Barnier said. Right not the Human Rights issue is not a Brexit issue. Many Govs across Europe are departing from accepted norms, inc UK. I am answering Barnier.  

I voted remain.",原创,en,0,0,0,0,2020-04-24 20:49:00,2024-04-17 07:26:52,1253788050968186882,157286064,StewartRoom,0,[],,,
https://twitter.com/157286064/status/1253780838921187332,https://twitter.com/StewartRoom,https://pbs.twimg.com/profile_images/1284859941392732163/ruD9OQ_6_normal.jpg,,,"Stewart Room - #privacy, #data & #security lawyer",Charlie says leave the bleach for kitchen floors and toilets #Trump https://t.co/rAR5D4A4fE,原创,en,0,0,0,0,2020-04-24 20:20:20,2024-04-17 07:26:52,1253780838921187332,157286064,StewartRoom,0,[],,['https://pbs.twimg.com/media/EWZTBiIWkAIwGrt.jpg'],
https://twitter.com/157286064/status/1253745880051716099,https://twitter.com/StewartRoom,https://pbs.twimg.com/profile_images/1284859941392732163/ruD9OQ_6_normal.jpg,,,"Stewart Room - #privacy, #data & #security lawyer",@ashk4n @Apple @Google What’s the assurance mechanism that’s deployed to give Apple and Google a guarantee that apps will only be open to health authorities and not wider authorities?,回复,en,0,0,0,3,2020-04-24 18:01:25,2024-04-17 07:26:52,1253745880051716099,157286064,StewartRoom,0,[],https://twitter.com/ashk4n,,
https://twitter.com/157286064/status/1253745394783313923,https://twitter.com/StewartRoom,https://pbs.twimg.com/profile_images/1284859941392732163/ruD9OQ_6_normal.jpg,,,"Stewart Room - #privacy, #data & #security lawyer",@johnnyryan @fatemehx2 Brilliant!,回复,en,0,0,0,0,2020-04-24 17:59:30,2024-04-17 07:26:52,1253745394783313923,157286064,StewartRoom,0,[],https://twitter.com/johnnyryan,,
https://twitter.com/157286064/status/1253738995873452035,https://twitter.com/StewartRoom,https://pbs.twimg.com/profile_images/1284859941392732163/ruD9OQ_6_normal.jpg,,,"Stewart Room - #privacy, #data & #security lawyer","@W_Wiewiorowski Hi Wojtek, I hope you’re well.  Perhaps go with the one you feel most comfortable with? Best, Stewart",回复,en,0,0,0,0,2020-04-24 17:34:04,2024-04-17 07:26:52,1253738995873452035,157286064,StewartRoom,0,[],https://twitter.com/W_Wiewiorowski,,
https://twitter.com/157286064/status/1253733957159485445,https://twitter.com/StewartRoom,https://pbs.twimg.com/profile_images/1284859941392732163/ruD9OQ_6_normal.jpg,,,"Stewart Room - #privacy, #data & #security lawyer","Such an amazing person and this is lovely!

Captain Tom tops the charts at the age of 99 https://t.co/ag8mwlz1GF",原创,en,0,0,0,0,2020-04-24 17:14:03,2024-04-17 07:26:52,1253733957159485445,157286064,StewartRoom,0,[],,,
https://twitter.com/157286064/status/1253682521461657606,https://twitter.com/StewartRoom,https://pbs.twimg.com/profile_images/1284859941392732163/ruD9OQ_6_normal.jpg,,,"Stewart Room - #privacy, #data & #security lawyer","Hi folks, we recorded our webinar on the landmark judgment of The Supreme Court in the #Morrisons case, about employers’ vicarious liability for rogue insiders. Good news: you can sign up to download the recording.  

Tell your friends! https://t.co/ARFQUPioZI",原创,en,0,0,0,1,2020-04-24 13:49:40,2024-04-17 07:26:52,1253682521461657606,157286064,StewartRoom,0,[],,,
https://twitter.com/157286064/status/1253662304455012355,https://twitter.com/StewartRoom,https://pbs.twimg.com/profile_images/1284859941392732163/ruD9OQ_6_normal.jpg,,,"Stewart Room - #privacy, #data & #security lawyer","@EUstaran @TheEconomist Or perhaps privacy and data protection, in context of wider rights and Rule of Law, is actually the road, which we have to stay on?",回复,en,1,0,0,3,2020-04-24 12:29:19,2024-04-17 07:27:09,1253662304455012355,157286064,StewartRoom,0,[],https://twitter.com/EUstaran,,
https://twitter.com/157286064/status/1253661542404554753,https://twitter.com/StewartRoom,https://pbs.twimg.com/profile_images/1284859941392732163/ruD9OQ_6_normal.jpg,,,"Stewart Room - #privacy, #data & #security lawyer","@1Br0wn Stable, door, horse, bolted ...

Although perhaps #ICO could publish the A.36 analysis, the one that follows the A.35 DPIA?",回复,en,0,0,0,1,2020-04-24 12:26:18,2024-04-17 07:27:09,1253661542404554753,157286064,StewartRoom,0,[],https://twitter.com/1Br0wn,,
https://twitter.com/157286064/status/1253657388340707328,https://twitter.com/StewartRoom,https://pbs.twimg.com/profile_images/1284859941392732163/ruD9OQ_6_normal.jpg,,,"Stewart Room - #privacy, #data & #security lawyer",@FergalMK @MehreenKhn @ActNowTraining No it’s doesn’t,原创,en,6,0,0,1,2020-04-24 12:09:47,2024-04-17 07:27:09,1253657388340707328,157286064,StewartRoom,0,[],,,
https://twitter.com/157286064/status/1253656791075995648,https://twitter.com/StewartRoom,https://pbs.twimg.com/profile_images/1284859941392732163/ruD9OQ_6_normal.jpg,,,"Stewart Room - #privacy, #data & #security lawyer","@StewDuff @PrivacyMatters @NHSX Its always about pathway from voluntary to non vol to sanctions. CV Act creates that end destination.  Many in privacy &amp; regulatory communities still attached to the hope of voluntary and no further steps. Big picture demands scrutiny now, as if end destination real risk.",回复,en,1,1,0,2,2020-04-24 12:07:25,2024-04-17 07:27:09,1253656791075995648,157286064,StewartRoom,0,[],https://twitter.com/StewDuff,,
https://twitter.com/157286064/status/1253651406369828870,https://twitter.com/StewartRoom,https://pbs.twimg.com/profile_images/1284859941392732163/ruD9OQ_6_normal.jpg,,,"Stewart Room - #privacy, #data & #security lawyer","@PrivacyMatters @NHSX And at para 2, the nudge team say

‘so they can take action to protect themselves, the people they care about and the NHS.’

Wonder what the travelling draft said ...",回复,en,1,0,0,0,2020-04-24 11:46:01,2024-04-17 07:27:09,1253651406369828870,157286064,StewartRoom,0,[],https://twitter.com/PrivacyMatters,,
https://twitter.com/157286064/status/1253649461051633664,https://twitter.com/StewartRoom,https://pbs.twimg.com/profile_images/1284859941392732163/ruD9OQ_6_normal.jpg,,,"Stewart Room - #privacy, #data & #security lawyer","I see the future. We’re going to be a society of drunk naked people.  There’ll be problems, mark my words, there’ll be problems 

Shoppers swap clothes for alcohol amid record sales drops https://t.co/59dGC21dAD",原创,en,0,0,0,0,2020-04-24 11:38:17,2024-04-17 07:27:09,1253649461051633664,157286064,StewartRoom,0,[],,,
https://twitter.com/157286064/status/1253648918908481537,https://twitter.com/StewartRoom,https://pbs.twimg.com/profile_images/1284859941392732163/ruD9OQ_6_normal.jpg,,,"Stewart Room - #privacy, #data & #security lawyer",@lilianedwards Well that’s blown a whole load of planning ...,回复,en,1,0,0,0,2020-04-24 11:36:08,2024-04-17 07:27:09,1253648918908481537,157286064,StewartRoom,0,[],https://twitter.com/lilianedwards,,
https://twitter.com/157286064/status/1253648187790954499,https://twitter.com/StewartRoom,https://pbs.twimg.com/profile_images/1284859941392732163/ruD9OQ_6_normal.jpg,,,"Stewart Room - #privacy, #data & #security lawyer",Big rush on disinfectant in Trump constituencies. Get in quick. Pasta and bog roll so March 2020 ...,原创,en,0,0,0,0,2020-04-24 11:33:14,2024-04-17 07:27:09,1253648187790954499,157286064,StewartRoom,0,[],,,
https://twitter.com/157286064/status/1253644763003305984,https://twitter.com/StewartRoom,https://pbs.twimg.com/profile_images/1284859941392732163/ruD9OQ_6_normal.jpg,,,"Stewart Room - #privacy, #data & #security lawyer","Had to read this headline twice.  Reminds me of Jimmy Corkhill on Brookside in the 90s who thought injecting with bleach to combat HIV was a good idea.  Related?

Coronavirus: Outcry after Trump suggests injecting disinfectant as treatment https://t.co/pSZyBdhUSZ",原创,en,0,0,0,0,2020-04-24 11:19:37,2024-04-17 07:27:09,1253644763003305984,157286064,StewartRoom,0,[],,,
https://twitter.com/157286064/status/1253643671511105536,https://twitter.com/StewartRoom,https://pbs.twimg.com/profile_images/1284859941392732163/ruD9OQ_6_normal.jpg,,,"Stewart Room - #privacy, #data & #security lawyer","#COVIDTech in action ...

Coronavirus: Test website closes after 'significant demand' https://t.co/AbVdH18fp1",原创,en,0,0,0,0,2020-04-24 11:15:17,2024-04-17 07:27:09,1253643671511105536,157286064,StewartRoom,0,[],,,
https://twitter.com/157286064/status/1253563124382302208,https://twitter.com/StewartRoom,https://pbs.twimg.com/profile_images/1284859941392732163/ruD9OQ_6_normal.jpg,,,"Stewart Room - #privacy, #data & #security lawyer","Online registration now available for testing in UK, apparently. 

Good stuff. Wonder what happens to all the data afterwards?

Coronavirus: Virus tests now available to millions of workers https://t.co/AbVdH18fp1",原创,en,0,0,0,0,2020-04-24 05:55:13,2024-04-17 07:27:09,1253563124382302208,157286064,StewartRoom,0,[],,,
https://twitter.com/157286064/status/1253561765620785160,https://twitter.com/StewartRoom,https://pbs.twimg.com/profile_images/1284859941392732163/ruD9OQ_6_normal.jpg,,,"Stewart Room - #privacy, #data & #security lawyer",@CBridge_Chief Sorted then!,回复,en,0,0,0,0,2020-04-24 05:49:49,2024-04-17 07:27:09,1253561765620785160,157286064,StewartRoom,0,[],https://twitter.com/CBridge_Chief,,
https://twitter.com/157286064/status/1253422877791014917,https://twitter.com/StewartRoom,https://pbs.twimg.com/profile_images/1284859941392732163/ruD9OQ_6_normal.jpg,,,"Stewart Room - #privacy, #data & #security lawyer","Yep, The Stones have nailed it. Still awesome ...

https://t.co/1fuDQ94AZE",原创,en,1,1,0,0,2020-04-23 20:37:56,2024-04-17 07:27:09,1253422877791014917,157286064,StewartRoom,0,[],,,
https://twitter.com/157286064/status/1253069540977770497,https://twitter.com/StewartRoom,https://pbs.twimg.com/profile_images/1284859941392732163/ruD9OQ_6_normal.jpg,,,"Stewart Room - #privacy, #data & #security lawyer","Oh dear, my pre Lockdown haircut has run out of road. 

Any suggestions for clippers, or maybe something chemical?",原创,en,3,0,0,1,2020-04-22 21:13:54,2024-04-17 07:27:09,1253069540977770497,157286064,StewartRoom,0,[],,,
https://twitter.com/157286064/status/1253075976440942593,https://twitter.com/StewartRoom,https://pbs.twimg.com/profile_images/1284859941392732163/ruD9OQ_6_normal.jpg,,,"Stewart Room - #privacy, #data & #security lawyer","@marcus_turle Chemicals?

All’s good Marcus. Hope so with you. It would be lovely to catch up.",回复,en,1,0,0,0,2020-04-22 21:39:28,2024-04-17 07:27:09,1253075976440942593,157286064,StewartRoom,0,[],https://twitter.com/marcus_turle,,
https://twitter.com/157286064/status/1253074250568777736,https://twitter.com/StewartRoom,https://pbs.twimg.com/profile_images/1284859941392732163/ruD9OQ_6_normal.jpg,,,"Stewart Room - #privacy, #data & #security lawyer","Delighted to be presenting at #Privitar’s In:Confidence Digital conference, on 14 May, on Data Privacy in the Pandemic, when I’ll set out the key rules for initiatives such as Contact Tracing, management of WFH and eventually the return to work. https://t.co/hUpV050vmD",原创,en,0,0,0,2,2020-04-22 21:32:36,2024-04-17 07:27:09,1253074250568777736,157286064,StewartRoom,0,[],,,
https://twitter.com/157286064/status/1253065865513312258,https://twitter.com/StewartRoom,https://pbs.twimg.com/profile_images/1284859941392732163/ruD9OQ_6_normal.jpg,,,"Stewart Room - #privacy, #data & #security lawyer","@lilianedwards Yeah, who needs Unis with all of that pesky cutting edge research they do.

I mean, the engineers at UCL and their ventilator last week; those scientists at Oxford with their vaccine trial ...",回复,en,0,0,0,2,2020-04-22 20:59:17,2024-04-17 07:27:09,1253065865513312258,157286064,StewartRoom,0,[],https://twitter.com/lilianedwards,,
https://twitter.com/157286064/status/1253059670295687171,https://twitter.com/StewartRoom,https://pbs.twimg.com/profile_images/1284859941392732163/ruD9OQ_6_normal.jpg,,,"Stewart Room - #privacy, #data & #security lawyer","@PrivacyMatters More worryingly, I bet there is even further to slide",回复,en,1,0,0,0,2020-04-22 20:34:40,2024-04-17 07:27:09,1253059670295687171,157286064,StewartRoom,0,[],https://twitter.com/PrivacyMatters,,
https://twitter.com/157286064/status/1253058752808452097,https://twitter.com/StewartRoom,https://pbs.twimg.com/profile_images/1284859941392732163/ruD9OQ_6_normal.jpg,,,"Stewart Room - #privacy, #data & #security lawyer","#EDPB guidelines on use of #personaldata for #covid19 scientific research.  Here’s my take:

😷 yup, #GDPR contains a legal pathway to do this
😷 but you’ve got to work through the national law detail 
😷 then translate that into a…https://t.co/alQMJZ4PVC https://t.co/4feEzGkA3d",原创,en,0,0,0,0,2020-04-22 20:31:02,2024-04-17 07:27:26,1253058752808452097,157286064,StewartRoom,0,[],,,
https://twitter.com/157286064/status/1253055502285770752,https://twitter.com/StewartRoom,https://pbs.twimg.com/profile_images/1284859941392732163/ruD9OQ_6_normal.jpg,,,"Stewart Room - #privacy, #data & #security lawyer","I’m delighted that the #dataprotection and #cybersecurity team at #DWF is going from strength to strength. 

Alongside our success in the landmark judgment of The Supreme Court in the #Morrisons personal data breach vicarious liability case, we’re continu…https://t.co/uS6sFwpque",原创,en,0,0,0,1,2020-04-22 20:18:07,2024-04-17 07:27:26,1253055502285770752,157286064,StewartRoom,0,[],,,
https://twitter.com/157286064/status/1253031221157912576,https://twitter.com/StewartRoom,https://pbs.twimg.com/profile_images/1284859941392732163/ruD9OQ_6_normal.jpg,,,"Stewart Room - #privacy, #data & #security lawyer",Are all the #DPOs being cut out of #marketing convos? The amount of spam from CEOs disguised under #COVID19 reassurance is staggering.,原创,en,1,1,0,4,2020-04-22 18:41:37,2024-04-17 07:27:26,1253031221157912576,157286064,StewartRoom,0,[],,,
https://twitter.com/157286064/status/1253039656800849921,https://twitter.com/StewartRoom,https://pbs.twimg.com/profile_images/1284859941392732163/ruD9OQ_6_normal.jpg,,,"Stewart Room - #privacy, #data & #security lawyer","@CBridge_Chief Ever such Daragh, ever such ...",回复,en,0,0,0,0,2020-04-22 19:15:09,2024-04-17 07:27:26,1253039656800849921,157286064,StewartRoom,0,[],https://twitter.com/CBridge_Chief,,
https://twitter.com/157286064/status/1252658817709596672,https://twitter.com/StewartRoom,https://pbs.twimg.com/profile_images/1284859941392732163/ruD9OQ_6_normal.jpg,,,"Stewart Room - #privacy, #data & #security lawyer","It was only a matter of when, not if: France urges Apple and Google to ease privacy rules on contact tracing

Reminder: Tech cos have made explicit consent promises. https://t.co/eiMECesFuf",原创,en,0,0,0,1,2020-04-21 18:01:50,2024-04-17 07:27:26,1252658817709596672,157286064,StewartRoom,0,[],,,
https://twitter.com/157286064/status/1252304190837153793,https://twitter.com/StewartRoom,https://pbs.twimg.com/profile_images/1284859941392732163/ruD9OQ_6_normal.jpg,,,"Stewart Room - #privacy, #data & #security lawyer","Tomorrow’s the big day when DWF’s leading #dataprotection, #privacy and #security litigation team give the lowdown on the Supreme Court win in the Morrisons vicarious liability case.  

You can still register. Just follow the link below! https://t.co/s90e7MtyKS",原创,en,0,0,0,7,2020-04-20 18:32:40,2024-04-17 07:27:26,1252304190837153793,157286064,StewartRoom,0,[],,,
https://twitter.com/157286064/status/1251396671000510470,https://twitter.com/StewartRoom,https://pbs.twimg.com/profile_images/1284859941392732163/ruD9OQ_6_normal.jpg,,,"Stewart Room - #privacy, #data & #security lawyer","@realDonaldTrump You’re meant to be the President of The United States of America.

Do you not understand the meaning of the word United?",回复,en,0,0,0,0,2020-04-18 06:26:30,2024-04-17 07:27:26,1251396671000510470,157286064,StewartRoom,0,[],https://twitter.com/realDonaldTrump,,
https://twitter.com/157286064/status/1251179552438706177,https://twitter.com/StewartRoom,https://pbs.twimg.com/profile_images/1284859941392732163/ruD9OQ_6_normal.jpg,,,"Stewart Room - #privacy, #data & #security lawyer",Contact Tracing app to be launched but Contact Tracing Team was wound down 🤷‍♂️ https://t.co/XxvqoAJz7x,原创,en,0,0,0,1,2020-04-17 16:03:45,2024-04-17 07:27:26,1251179552438706177,157286064,StewartRoom,0,[],,,
