tweet_url,author_url,avatar_url,avatar_binary,topic,author_name,content,tweet_type,tweet_language,comment_count,retweet_count,quote_count,praise_count,publish_time,fetch_time,tweet_id,screen_id,screen_name,tourist_crawl_status,video_urls,original_author,tweet_img_url,tweet_img_binary
https://twitter.com/813697/status/1559607693370859522,https://twitter.com/mckeay,https://pbs.twimg.com/profile_images/604826163567947776/DNc178C5_normal.jpg,,,Martin McKeay,"Today's 'Too Long; Did Read' blog post is an essay about what I'm looking for when I write a review of a security industry report.

On being critical of industry reports in security:  https://t.co/1HM1Pdytgw",原创,en,0,1,1,5,2022-08-16 18:27:04,2024-04-12 08:24:40,1559607693370859522,813697,mckeay,0,[],,,
https://twitter.com/813697/status/1559588754339336192,https://twitter.com/mckeay,https://pbs.twimg.com/profile_images/604826163567947776/DNc178C5_normal.jpg,,,Martin McKeay,"I love writing that conveys a strong mental image with few words.

'the ravaged corpse of breakfast' 

In just a few words, I see a table covered in used dishes, empty plates, and all detritus left behind by a hearty meal.",原创,en,0,0,0,2,2022-08-16 17:11:49,2024-04-12 08:24:40,1559588754339336192,813697,mckeay,0,[],,,
https://twitter.com/813697/status/1559564403158261760,https://twitter.com/mckeay,https://pbs.twimg.com/profile_images/604826163567947776/DNc178C5_normal.jpg,,,Martin McKeay,"I can sympathize with both of those sentiments.  I think that's what separates a 'job' from a calling or a career.  

Then again, I'm in a philosophical mood today.",引用,en,0,0,0,1,2022-08-16 15:35:03,2024-04-12 08:24:40,1559564403158261760,813697,mckeay,0,[],https://twitter.com/quinnnorton,,
https://twitter.com/813697/status/1559247237015912449,https://twitter.com/mckeay,https://pbs.twimg.com/profile_images/604826163567947776/DNc178C5_normal.jpg,,,Martin McKeay,"I have things I could be doing today, reading reports, writing up reviews, etc.

But a sleepless night means I'm almost in the same mental state I'd be in if I'd actually attended Summer Camp last week.",原创,en,0,0,0,3,2022-08-15 18:34:45,2024-04-12 08:24:58,1559247237015912449,813697,mckeay,0,[],,,
https://twitter.com/813697/status/1559207074919489536,https://twitter.com/mckeay,https://pbs.twimg.com/profile_images/604826163567947776/DNc178C5_normal.jpg,,,Martin McKeay,"@jbhall56 There will be others.  A mask is primarily about protecting those around you, so if someone got infected beforehand and didn't wear a mask...

Here's hoping the infection rate is low!",回复,en,0,0,0,2,2022-08-15 15:55:09,2024-04-12 08:24:58,1559207074919489536,813697,mckeay,0,[],https://twitter.com/jbhall56,,
https://twitter.com/813697/status/1559188694761873409,https://twitter.com/mckeay,https://pbs.twimg.com/profile_images/604826163567947776/DNc178C5_normal.jpg,,,Martin McKeay,"After a week of BSides, Black Hat and Defcon, how many attendees are going to be laid up for a few days recovering from the August heat and contagion?",原创,en,0,0,0,4,2022-08-15 14:42:07,2024-04-12 08:24:58,1559188694761873409,813697,mckeay,0,[],,,
https://twitter.com/813697/status/1558931098226368512,https://twitter.com/mckeay,https://pbs.twimg.com/profile_images/604826163567947776/DNc178C5_normal.jpg,,,Martin McKeay,I've lost any hope the Republican party can fix itself.,引用,en,1,0,0,0,2022-08-14 21:38:32,2024-04-12 08:24:58,1558931098226368512,813697,mckeay,0,[],https://twitter.com/ErrataRob,,
https://twitter.com/813697/status/1558934445448744961,https://twitter.com/mckeay,https://pbs.twimg.com/profile_images/604826163567947776/DNc178C5_normal.jpg,,,Martin McKeay,"@ErrataRob I think we're in violent agreement.

As long as it's not violet agreement, we're good.",回复,en,1,0,0,0,2022-08-14 21:51:50,2024-04-12 08:24:58,1558934445448744961,813697,mckeay,0,[],https://twitter.com/ErrataRob,,
https://twitter.com/813697/status/1558931937569513478,https://twitter.com/mckeay,https://pbs.twimg.com/profile_images/604826163567947776/DNc178C5_normal.jpg,,,Martin McKeay,@ErrataRob Our form of a party system is corrupt by its very nature.  The only hope I ever held was that the corruption wouldn't so vastly overcome the good it might provide.,回复,en,1,0,0,1,2022-08-14 21:41:52,2024-04-12 08:24:59,1558931937569513478,813697,mckeay,0,[],https://twitter.com/ErrataRob,,
https://twitter.com/813697/status/1558931524099182594,https://twitter.com/mckeay,https://pbs.twimg.com/profile_images/604826163567947776/DNc178C5_normal.jpg,,,Martin McKeay,"@semiotic_pirate Since that was your intent, yes, it's a compliment.",回复,en,0,0,0,1,2022-08-14 21:40:13,2024-04-12 08:24:59,1558931524099182594,813697,mckeay,0,[],https://twitter.com/semiotic_pirate,,
https://twitter.com/813697/status/1558915417485320197,https://twitter.com/mckeay,https://pbs.twimg.com/profile_images/604826163567947776/DNc178C5_normal.jpg,,,Martin McKeay,I think 4 pages of hand written notes for Friday's D&amp;D game is enough for today.,原创,en,1,0,0,3,2022-08-14 20:36:13,2024-04-12 08:24:59,1558915417485320197,813697,mckeay,0,[],,,
https://twitter.com/813697/status/1558927915877863426,https://twitter.com/mckeay,https://pbs.twimg.com/profile_images/604826163567947776/DNc178C5_normal.jpg,,,Martin McKeay,"@ChrisJohnRiley I've had the beginning and the end of this campaign rattling around in my head for years.  

The middle was always going to be up to the players.",回复,en,0,0,0,1,2022-08-14 21:25:53,2024-04-12 08:24:59,1558927915877863426,813697,mckeay,0,[],https://twitter.com/ChrisJohnRiley,,
https://twitter.com/813697/status/1558926148788183040,https://twitter.com/mckeay,https://pbs.twimg.com/profile_images/604826163567947776/DNc178C5_normal.jpg,,,Martin McKeay,@semiotic_pirate That got dark very quickly.,回复,en,1,0,0,1,2022-08-14 21:18:51,2024-04-12 08:24:59,1558926148788183040,813697,mckeay,0,[],https://twitter.com/semiotic_pirate,,
https://twitter.com/813697/status/1558917746049667075,https://twitter.com/mckeay,https://pbs.twimg.com/profile_images/604826163567947776/DNc178C5_normal.jpg,,,Martin McKeay,"@ChrisJohnRiley To be fair, the first two pages were history that the players will never make any attempt to find out. 

I just wanted it out of my head so i could move on to writing up traps and monsters.",回复,en,1,0,0,1,2022-08-14 20:45:28,2024-04-12 08:24:59,1558917746049667075,813697,mckeay,0,[],https://twitter.com/ChrisJohnRiley,,
https://twitter.com/813697/status/1558899045652897794,https://twitter.com/mckeay,https://pbs.twimg.com/profile_images/604826163567947776/DNc178C5_normal.jpg,,,Martin McKeay,@_larry0 Here's hoping you get home tonight!,回复,en,0,0,0,1,2022-08-14 19:31:10,2024-04-12 08:24:59,1558899045652897794,813697,mckeay,0,[],https://twitter.com/_larry0,,
https://twitter.com/813697/status/1558259683395239938,https://twitter.com/mckeay,https://pbs.twimg.com/profile_images/604826163567947776/DNc178C5_normal.jpg,,,Martin McKeay,@hrbrmstr What is trying to escape from her purse?,回复,en,1,0,0,1,2022-08-13 01:10:34,2024-04-12 08:24:59,1558259683395239938,813697,mckeay,0,[],https://twitter.com/hrbrmstr,,
https://twitter.com/813697/status/1558100968960565248,https://twitter.com/mckeay,https://pbs.twimg.com/profile_images/604826163567947776/DNc178C5_normal.jpg,,,Martin McKeay,"For my amusement, I would never blackmail you or anyone else.

Provided the checks keep clearing.",引用,en,1,0,0,1,2022-08-12 14:39:53,2024-04-12 08:24:59,1558100968960565248,813697,mckeay,0,[],https://twitter.com/ChrisJohnRiley,,
https://twitter.com/813697/status/1558110306173259777,https://twitter.com/mckeay,https://pbs.twimg.com/profile_images/604826163567947776/DNc178C5_normal.jpg,,,Martin McKeay,@ChrisJohnRiley I'm still waiting for your first telegram to arrive.,回复,en,1,0,0,0,2022-08-12 15:16:59,2024-04-12 08:24:59,1558110306173259777,813697,mckeay,0,[],https://twitter.com/ChrisJohnRiley,,
https://twitter.com/813697/status/1558093425391591424,https://twitter.com/mckeay,https://pbs.twimg.com/profile_images/604826163567947776/DNc178C5_normal.jpg,,,Martin McKeay,The latest edition of the FIRST Impressions Podcast is out!  @ChrisJohnRiley  and I had a lot of fun talking to Raphael and Quinn for this podcast.  I'm keeping the outtakes for 'posterity'.,引用,en,1,1,0,4,2022-08-12 14:09:55,2024-04-12 08:24:59,1558093425391591424,813697,mckeay,0,[],https://twitter.com/FIRSTdotOrg,,
https://twitter.com/813697/status/1558089648521584641,https://twitter.com/mckeay,https://pbs.twimg.com/profile_images/604826163567947776/DNc178C5_normal.jpg,,,Martin McKeay,"RT @RealSexyCyborg: Best Aranet4 CO2 Meter Alternatives Under $100?
https://t.co/8t1ENhhlWk

Please RT! 🙏 https://t.co/9zSFH6agYT",转发,en,0,213,0,0,2022-08-12 13:54:54,2024-04-12 08:24:59,1558089648521584641,813697,mckeay,0,[],https://twitter.com/RealSexyCyborg,['https://pbs.twimg.com/media/FZ60XWzaMAAdYwC.jpg'],
https://twitter.com/813697/status/1557805701799485440,https://twitter.com/mckeay,https://pbs.twimg.com/profile_images/604826163567947776/DNc178C5_normal.jpg,,,Martin McKeay,RT @EffinBirds: https://t.co/gUFUEPotav,转发,zxx,0,168,0,0,2022-08-11 19:06:36,2024-04-12 08:24:59,1557805701799485440,813697,mckeay,0,[],https://twitter.com/EffinBirds,['https://pbs.twimg.com/media/FZ5v5oWXoAI9yV_.jpg'],
https://twitter.com/813697/status/1557409411152465922,https://twitter.com/mckeay,https://pbs.twimg.com/profile_images/604826163567947776/DNc178C5_normal.jpg,,,Martin McKeay,"If you're at Black Hat today, I'm sorry, but I won't be able to meet you and say hello.  I'm still in Florida, after all.",原创,en,0,0,0,6,2022-08-10 16:51:53,2024-04-12 08:24:59,1557409411152465922,813697,mckeay,0,[],,,
https://twitter.com/813697/status/1557804610261245959,https://twitter.com/mckeay,https://pbs.twimg.com/profile_images/604826163567947776/DNc178C5_normal.jpg,,,Martin McKeay,"@tkimball @SecEvangelism Give @SecEvangelism a hug for me, if she'll let you.",原创,en,0,0,0,1,2022-08-11 19:02:16,2024-04-12 08:24:59,1557804610261245959,813697,mckeay,0,[],,,
https://twitter.com/813697/status/1557801923088113665,https://twitter.com/mckeay,https://pbs.twimg.com/profile_images/604826163567947776/DNc178C5_normal.jpg,,,Martin McKeay,Rewriting my LinkedIn profile and resume for the job I want is one of the most stressful things I've done in a while.,原创,en,1,0,0,9,2022-08-11 18:51:35,2024-04-12 08:24:59,1557801923088113665,813697,mckeay,0,[],,,
https://twitter.com/813697/status/1557804193016168448,https://twitter.com/mckeay,https://pbs.twimg.com/profile_images/604826163567947776/DNc178C5_normal.jpg,,,Martin McKeay,@bbaskin I've been told since the early 00's that I should be an analyst.  I've decided it's time to see for myself.,回复,en,0,0,0,1,2022-08-11 19:00:36,2024-04-12 08:24:59,1557804193016168448,813697,mckeay,0,[],https://twitter.com/bbaskin,,
https://twitter.com/813697/status/1557788931248234499,https://twitter.com/mckeay,https://pbs.twimg.com/profile_images/604826163567947776/DNc178C5_normal.jpg,,,Martin McKeay,@armorguy @secureideas I wonder how many of the people claiming their rights have read the actual text of the Amendments since their US Government class in high school?,回复,en,0,0,0,2,2022-08-11 17:59:58,2024-04-12 08:25:11,1557788931248234499,813697,mckeay,0,[],https://twitter.com/armorguy,,
https://twitter.com/813697/status/1557774127364194306,https://twitter.com/mckeay,https://pbs.twimg.com/profile_images/604826163567947776/DNc178C5_normal.jpg,,,Martin McKeay,"Next in my 'Too Long: Did Read' series is CyberTheory's 'CISO Engagement' study.  I gave the report a D- and don't suggest reading it.  Marketing teams might gain some value from the report, but it's unlikely.  

https://t.co/Aa8F6MD9sO",原创,en,1,0,0,1,2022-08-11 17:01:08,2024-04-12 08:25:11,1557774127364194306,813697,mckeay,0,[],,,
https://twitter.com/813697/status/1557781925301035008,https://twitter.com/mckeay,https://pbs.twimg.com/profile_images/604826163567947776/DNc178C5_normal.jpg,,,Martin McKeay,"@alexanderjaeger I'm not going to review anything behind a paywall, but adding a line about providing contact details is something I wish I'd thought of myself.  :-)",回复,en,0,0,0,1,2022-08-11 17:32:07,2024-04-12 08:25:11,1557781925301035008,813697,mckeay,0,[],https://twitter.com/alexanderjaeger,,
https://twitter.com/813697/status/1557781624158396416,https://twitter.com/mckeay,https://pbs.twimg.com/profile_images/604826163567947776/DNc178C5_normal.jpg,,,Martin McKeay,"@alexanderjaeger Truthfully, I don't think most aspects of the layout matter too much, as long as they're done well and consistently.  The trend is moving more towards HTML formatting, but then it becomes an advance infographic in many cases.",回复,en,1,0,0,0,2022-08-11 17:30:56,2024-04-12 08:25:12,1557781624158396416,813697,mckeay,0,[],https://twitter.com/alexanderjaeger,,
https://twitter.com/813697/status/1557494285460770817,https://twitter.com/mckeay,https://pbs.twimg.com/profile_images/604826163567947776/DNc178C5_normal.jpg,,,Martin McKeay,I forget how truly stupid some smart D&amp;D can be.,原创,en,1,0,0,3,2022-08-10 22:29:09,2024-04-12 08:25:12,1557494285460770817,813697,mckeay,0,[],,,
https://twitter.com/813697/status/1557101237014855682,https://twitter.com/mckeay,https://pbs.twimg.com/profile_images/604826163567947776/DNc178C5_normal.jpg,,,Martin McKeay,"3D Print Pics: One of the players in my D&amp;D game is basing his character on Baby Bowler from Mystery Men, so I made him a Celtic skull as a prop. https://t.co/ZFo6lV98H8",原创,en,0,0,0,5,2022-08-09 20:27:19,2024-04-12 08:25:12,1557101237014855682,813697,mckeay,0,[],,['https://pbs.twimg.com/media/FZvvUhRWQAQGlcO.jpg'],
https://twitter.com/813697/status/1557079061104656385,https://twitter.com/mckeay,https://pbs.twimg.com/profile_images/604826163567947776/DNc178C5_normal.jpg,,,Martin McKeay,"@choochoobear No, just be the best 'you' that you can be.

Also, incorporate them into a future comic, using Davan as a sock puppet to show your utter contempt.  Or something.",回复,en,0,0,0,5,2022-08-09 18:59:11,2024-04-12 08:25:12,1557079061104656385,813697,mckeay,0,[],https://twitter.com/choochoobear,,
https://twitter.com/813697/status/1557053524248338434,https://twitter.com/mckeay,https://pbs.twimg.com/profile_images/604826163567947776/DNc178C5_normal.jpg,,,Martin McKeay,@Danacea We're going to need a bigger dice tower!,回复,en,0,0,0,1,2022-08-09 17:17:43,2024-04-12 08:25:12,1557053524248338434,813697,mckeay,0,[],https://twitter.com/Danacea,,
https://twitter.com/813697/status/1557053314180825088,https://twitter.com/mckeay,https://pbs.twimg.com/profile_images/604826163567947776/DNc178C5_normal.jpg,,,Martin McKeay,"@csoandy Thumbs down.  Sounds too much like random buzzwords thrown together, the intended message is lost because the sentence needs significant parsing to understand.",回复,en,2,0,0,4,2022-08-09 17:16:53,2024-04-12 08:25:12,1557053314180825088,813697,mckeay,0,[],https://twitter.com/csoandy,,
https://twitter.com/813697/status/1557052106535837696,https://twitter.com/mckeay,https://pbs.twimg.com/profile_images/604826163567947776/DNc178C5_normal.jpg,,,Martin McKeay,@sawaba Happy birthday and bullshit to you!,回复,en,0,0,0,1,2022-08-09 17:12:05,2024-04-12 08:25:12,1557052106535837696,813697,mckeay,0,[],https://twitter.com/sawaba,,
https://twitter.com/813697/status/1557034064372289537,https://twitter.com/mckeay,https://pbs.twimg.com/profile_images/604826163567947776/DNc178C5_normal.jpg,,,Martin McKeay,"@theladykathryn No, it's what you get for being a person who cares for the welfare of those around you.  

The tea is nice, but incidental.",回复,en,0,0,0,0,2022-08-09 16:00:23,2024-04-12 08:25:12,1557034064372289537,813697,mckeay,0,[],https://twitter.com/theladykathryn,,
https://twitter.com/813697/status/1557028579464159232,https://twitter.com/mckeay,https://pbs.twimg.com/profile_images/604826163567947776/DNc178C5_normal.jpg,,,Martin McKeay,"For todays 'Too Long: Did Read', I reviewed Meta's latest Adversarial report.  I'd give the report an A-, with plenty of great information for defenders to dig into.  

Great information in need of polish from Meta
https://t.co/nLjke4kPym",原创,en,0,1,0,2,2022-08-09 15:38:36,2024-04-12 08:25:12,1557028579464159232,813697,mckeay,0,[],,,
https://twitter.com/813697/status/1556373559638999041,https://twitter.com/mckeay,https://pbs.twimg.com/profile_images/604826163567947776/DNc178C5_normal.jpg,,,Martin McKeay,"Second failed print, but not sure what happened this time.  Maybe  I need to turn up the amount of filament flowing more to accommodate the .6mm nozzle.",原创,en,0,0,0,1,2022-08-07 20:15:47,2024-04-12 08:25:12,1556373559638999041,813697,mckeay,0,[],,,
https://twitter.com/813697/status/1556362312742850560,https://twitter.com/mckeay,https://pbs.twimg.com/profile_images/604826163567947776/DNc178C5_normal.jpg,,,Martin McKeay,"First print failure of the day.  I'm pretty sure the filament I was using was just too old.  I just opened it, but I probably purchased it at least 5 years ago.  

Even sealed isn't enough to protect from Florida humidity.",原创,en,0,0,0,0,2022-08-07 19:31:05,2024-04-12 08:25:12,1556362312742850560,813697,mckeay,0,[],,,
https://twitter.com/813697/status/1556358511520538626,https://twitter.com/mckeay,https://pbs.twimg.com/profile_images/604826163567947776/DNc178C5_normal.jpg,,,Martin McKeay,Pandemic (the tabletop game) is a lot harder than it looks at first glance.,原创,en,0,0,0,0,2022-08-07 19:15:59,2024-04-12 08:25:12,1556358511520538626,813697,mckeay,0,[],,,
https://twitter.com/813697/status/1556283878402408449,https://twitter.com/mckeay,https://pbs.twimg.com/profile_images/604826163567947776/DNc178C5_normal.jpg,,,Martin McKeay,"It's a 3D printer day.  Have some minis printing on my Anycubic Mono X 6k, and I just put a .6mm nozzle on my Prusa i3mk3.  I've read that using a .6 nozzle prints almost as fine as a .4, but at a much higher speed using Arachne slicer.",原创,en,1,0,0,1,2022-08-07 14:19:25,2024-04-12 08:25:12,1556283878402408449,813697,mckeay,0,[],,,
https://twitter.com/813697/status/1556332493036453888,https://twitter.com/mckeay,https://pbs.twimg.com/profile_images/604826163567947776/DNc178C5_normal.jpg,,,Martin McKeay,"@llorenzin @fromagefacile Arachne is an option in the Prusa slicer.  I don't understand the details yet, but it is faster and has options the default slicer didn't have.  It's only available in the latest beta versions, so far.",回复,en,1,0,0,1,2022-08-07 17:32:36,2024-04-12 08:25:12,1556332493036453888,813697,mckeay,0,[],https://twitter.com/llorenzin,,
https://twitter.com/813697/status/1556260240282230785,https://twitter.com/mckeay,https://pbs.twimg.com/profile_images/604826163567947776/DNc178C5_normal.jpg,,,Martin McKeay,@McGrewSecurity There was also the year that the roller derby ladies were invited to the IOActive party.,回复,en,1,0,0,1,2022-08-07 12:45:29,2024-04-12 08:25:12,1556260240282230785,813697,mckeay,0,[],https://twitter.com/McGrewSecurity,,
https://twitter.com/813697/status/1555950697086160899,https://twitter.com/mckeay,https://pbs.twimg.com/profile_images/604826163567947776/DNc178C5_normal.jpg,,,Martin McKeay,"@cyentiainst @ISMGCorp So much blue!

No, seriously, too many shades of blue make these plots unreadable.  

Try using a palette that includes something with more contrast than 'cyan vs cobalt' next time",回复,en,0,0,0,0,2022-08-06 16:15:29,2024-04-12 08:25:29,1555950697086160899,813697,mckeay,0,[],https://twitter.com/cyentiainst,,
https://twitter.com/813697/status/1555948778703781890,https://twitter.com/mckeay,https://pbs.twimg.com/profile_images/604826163567947776/DNc178C5_normal.jpg,,,Martin McKeay,"I got some sausages from the local butcher that could, technically, but called 'hot dogs', but it would be an insult to both the butcher and her product.",原创,en,0,0,0,1,2022-08-06 16:07:51,2024-04-12 08:25:29,1555948778703781890,813697,mckeay,0,[],,,
https://twitter.com/813697/status/1555612032128385025,https://twitter.com/mckeay,https://pbs.twimg.com/profile_images/604826163567947776/DNc178C5_normal.jpg,,,Martin McKeay,"@jowyang @baba12 I read the Facebook ToS from start to finish, once, years ago.  It was time wasted, most of it made no sense to me.  No one in their right mind reads every update to the ToS.",回复,en,0,0,0,0,2022-08-05 17:49:44,2024-04-12 08:25:29,1555612032128385025,813697,mckeay,0,[],https://twitter.com/jowyang,,
https://twitter.com/813697/status/1555568775214284801,https://twitter.com/mckeay,https://pbs.twimg.com/profile_images/604826163567947776/DNc178C5_normal.jpg,,,Martin McKeay,"@wendynather @EricWenger Not without reason, if they've met you before.",回复,en,0,0,0,2,2022-08-05 14:57:51,2024-04-12 08:25:29,1555568775214284801,813697,mckeay,0,[],https://twitter.com/wendynather,,
https://twitter.com/813697/status/1555563624990756870,https://twitter.com/mckeay,https://pbs.twimg.com/profile_images/604826163567947776/DNc178C5_normal.jpg,,,Martin McKeay,@jowyang At least the satellite radio companies make it clear from the start they use a subscription model.,回复,en,0,0,0,2,2022-08-05 14:37:23,2024-04-12 08:25:29,1555563624990756870,813697,mckeay,0,[],https://twitter.com/jowyang,,
https://twitter.com/813697/status/1555555002290262021,https://twitter.com/mckeay,https://pbs.twimg.com/profile_images/604826163567947776/DNc178C5_normal.jpg,,,Martin McKeay,"NASA is looking for a Lead IT Cybersecurity Analyst.  The posting is only open until Monday and requires being on-site, but they have a lot of sites.

https://t.co/lJNxshTPfM",原创,en,0,2,0,0,2022-08-05 14:03:08,2024-04-12 08:25:29,1555555002290262021,813697,mckeay,0,[],,,
https://twitter.com/813697/status/1555551589988913152,https://twitter.com/mckeay,https://pbs.twimg.com/profile_images/604826163567947776/DNc178C5_normal.jpg,,,Martin McKeay,"I still laugh when I'm going through my book shelves and find a copy of the March 2017 Popular Mechanics, with a quote from me.  

Of all the times I've talked to press, that was the most surreal.",原创,en,0,0,0,5,2022-08-05 13:49:34,2024-04-12 08:25:29,1555551589988913152,813697,mckeay,0,[],,,
https://twitter.com/813697/status/1555545358834475008,https://twitter.com/mckeay,https://pbs.twimg.com/profile_images/604826163567947776/DNc178C5_normal.jpg,,,Martin McKeay,Why is it always the cyan ink?,原创,en,4,0,0,5,2022-08-05 13:24:48,2024-04-12 08:25:29,1555545358834475008,813697,mckeay,0,[],,,
https://twitter.com/813697/status/1555548763229405184,https://twitter.com/mckeay,https://pbs.twimg.com/profile_images/604826163567947776/DNc178C5_normal.jpg,,,Martin McKeay,"@abaranov That sounds like the most reasonable answer I've heard so far*.  It's also why we have a B&amp;W printer in my office.

* Actually the only reasonable answer I've heard so far.",回复,en,0,0,0,1,2022-08-05 13:38:20,2024-04-12 08:25:29,1555548763229405184,813697,mckeay,0,[],https://twitter.com/abaranov,,
https://twitter.com/813697/status/1555548363394879489,https://twitter.com/mckeay,https://pbs.twimg.com/profile_images/604826163567947776/DNc178C5_normal.jpg,,,Martin McKeay,@mfratto Or it will fail and all get swept under the rug.,回复,en,0,0,0,1,2022-08-05 13:36:45,2024-04-12 08:25:29,1555548363394879489,813697,mckeay,0,[],https://twitter.com/mfratto,,
https://twitter.com/813697/status/1555546492819193858,https://twitter.com/mckeay,https://pbs.twimg.com/profile_images/604826163567947776/DNc178C5_normal.jpg,,,Martin McKeay,@krypt3ia It's her fault not mine.  I have a B&amp;W laser printer in my office I generally use.,回复,en,1,0,0,0,2022-08-05 13:29:19,2024-04-12 08:25:29,1555546492819193858,813697,mckeay,0,[],https://twitter.com/krypt3ia,,
https://twitter.com/813697/status/1555543529757310977,https://twitter.com/mckeay,https://pbs.twimg.com/profile_images/604826163567947776/DNc178C5_normal.jpg,,,Martin McKeay,"@dallendoug @gattaca The pictures are relatively innocent, they show a few people 'resting their heads' after multiple bottles of scotch were consumed. 

It's the stories that I'm contractually required to keep secret.",回复,en,0,0,0,1,2022-08-05 13:17:32,2024-04-12 08:25:29,1555543529757310977,813697,mckeay,0,[],https://twitter.com/dallendoug,,
https://twitter.com/813697/status/1555542574827536384,https://twitter.com/mckeay,https://pbs.twimg.com/profile_images/604826163567947776/DNc178C5_normal.jpg,,,Martin McKeay,@gattaca @dallendoug That was a long time ago.  And I have pictures.,回复,en,2,0,0,0,2022-08-05 13:13:45,2024-04-12 08:25:29,1555542574827536384,813697,mckeay,0,[],https://twitter.com/gattaca,,
https://twitter.com/813697/status/1555542410779844609,https://twitter.com/mckeay,https://pbs.twimg.com/profile_images/604826163567947776/DNc178C5_normal.jpg,,,Martin McKeay,"Our next #FIRSTImpressions podcast is out this morning, a conversation with members of the Ukrainian CERT, recorded live at the FIRST Conference in Dublin.",引用,en,0,2,0,2,2022-08-05 13:13:05,2024-04-12 08:25:29,1555542410779844609,813697,mckeay,0,[],https://twitter.com/FIRSTdotOrg,,
https://twitter.com/813697/status/1555542041295200258,https://twitter.com/mckeay,https://pbs.twimg.com/profile_images/604826163567947776/DNc178C5_normal.jpg,,,Martin McKeay,"If your significant other ever asks what the best thing to ever happen to you was, the answer should always be ""You, of course.""

Whatever you're thinking in the back of your mind should stay there.  

#LessonsLearned",原创,en,0,0,0,4,2022-08-05 13:11:37,2024-04-12 08:25:29,1555542041295200258,813697,mckeay,0,[],,,
