tweet_url,author_url,avatar_url,avatar_binary,topic,author_name,content,tweet_type,tweet_language,comment_count,retweet_count,quote_count,praise_count,publish_time,fetch_time,tweet_id,screen_id,screen_name,tourist_crawl_status,video_urls,original_author,tweet_img_url,tweet_img_binary
https://twitter.com/813697/status/1508135634103414788,https://twitter.com/mckeay,https://pbs.twimg.com/profile_images/604826163567947776/DNc178C5_normal.jpg,,,Martin McKeay,"@ErrataRob You mean things like 'imposter syndrome*' isn't really thing and most of the D-K  work suffers from confirmation bias?  

*as defined in D-K and generally understood, it's not a thing.  But it is decent shorthand for feelings of inadequacy.",回复,en,0,0,0,0,2022-03-27 17:35:29,2024-04-12 08:35:42,1508135634103414788,813697,mckeay,0,[],https://twitter.com/ErrataRob,,
https://twitter.com/813697/status/1508107500339535879,https://twitter.com/mckeay,https://pbs.twimg.com/profile_images/604826163567947776/DNc178C5_normal.jpg,,,Martin McKeay,I know I'll find that screw eventually.  The hard way.,原创,en,1,0,0,1,2022-03-27 15:43:42,2024-04-12 08:35:42,1508107500339535879,813697,mckeay,0,[],,,
https://twitter.com/813697/status/1507812705595502592,https://twitter.com/mckeay,https://pbs.twimg.com/profile_images/604826163567947776/DNc178C5_normal.jpg,,,Martin McKeay,"Woot!  The Prusa i3 Mk3 sits in its new home perfectly, even with the spool on top!   The drawer pulls out smoothly and the spool doesn't even wobble. https://t.co/uwDNpIL4rE",原创,en,1,0,0,3,2022-03-26 20:12:17,2024-04-12 08:35:42,1507812705595502592,813697,mckeay,0,[],,"['https://pbs.twimg.com/media/FOzTpuXXEAIJ6xB.jpg', 'https://pbs.twimg.com/media/FOzTqUMX0AMPPcK.jpg']",
https://twitter.com/813697/status/1508099374907375622,https://twitter.com/mckeay,https://pbs.twimg.com/profile_images/604826163567947776/DNc178C5_normal.jpg,,,Martin McKeay,"@matthbraun Ahh, I was in NM recently and understand.  I live in FL, where a humidity level below 50% is noteworthy.",回复,en,1,0,0,0,2022-03-27 15:11:24,2024-04-12 08:35:42,1508099374907375622,813697,mckeay,0,[],https://twitter.com/matthbraun,,
https://twitter.com/813697/status/1508086643017854976,https://twitter.com/mckeay,https://pbs.twimg.com/profile_images/604826163567947776/DNc178C5_normal.jpg,,,Martin McKeay,"Bought a tool yesterday to replace one I couldn't find, found it as soon as I got home.  Returned it this morning, only to spend the money I got back and more before leaving the store.",原创,en,4,0,1,10,2022-03-27 14:20:49,2024-04-12 08:35:42,1508086643017854976,813697,mckeay,0,[],,,
https://twitter.com/813697/status/1508084517600387079,https://twitter.com/mckeay,https://pbs.twimg.com/profile_images/604826163567947776/DNc178C5_normal.jpg,,,Martin McKeay,"@matthbraun I was at Home Depot and picked up some rechargeable, motion activated, under-counter lights to put in the cabinet.  Highly recommend this as an upgrade to the cabinet.",回复,en,0,0,0,1,2022-03-27 14:12:22,2024-04-12 08:35:42,1508084517600387079,813697,mckeay,0,[],https://twitter.com/matthbraun,,
https://twitter.com/813697/status/1507709269008961538,https://twitter.com/mckeay,https://pbs.twimg.com/profile_images/604826163567947776/DNc178C5_normal.jpg,,,Martin McKeay,"I have a lot of pent up need/desire for tools after having lived over seas or rented for most of the last decade.  I'm finally at a point where I can buy what I want, and buy decent quality tools, so I'll risk the wrath of Wife0 and get them.",原创,en,1,0,0,4,2022-03-26 13:21:16,2024-04-12 08:35:42,1507709269008961538,813697,mckeay,0,[],,,
https://twitter.com/813697/status/1508078694597804033,https://twitter.com/mckeay,https://pbs.twimg.com/profile_images/604826163567947776/DNc178C5_normal.jpg,,,Martin McKeay,@jpierini I want tools that are going to last more than a few months.,回复,en,0,0,0,0,2022-03-27 13:49:14,2024-04-12 08:35:42,1508078694597804033,813697,mckeay,0,[],https://twitter.com/jpierini,,
https://twitter.com/813697/status/1507874284542246913,https://twitter.com/mckeay,https://pbs.twimg.com/profile_images/604826163567947776/DNc178C5_normal.jpg,,,Martin McKeay,"My daughter and I wrote something together yesterday, and I hope you'll get to read it next Friday.

Even five years after she revealed she is trans, the act of opening up to each other and writing about it was HARD. But we both felt we learned something in the process.",原创,en,0,0,0,14,2022-03-27 00:16:59,2024-04-12 08:35:42,1507874284542246913,813697,mckeay,0,[],,,
https://twitter.com/813697/status/1507823881154879492,https://twitter.com/mckeay,https://pbs.twimg.com/profile_images/604826163567947776/DNc178C5_normal.jpg,,,Martin McKeay,"Both my Prusa printers fit in their new homes, along with all the filament.  Best of all, I have a second 90"" cabinet on the other wall and nothing to go in it. Yet. 

With the doors closed, none of it can be seen https://t.co/NoMjSciSxg",原创,en,0,0,0,6,2022-03-26 20:56:41,2024-04-12 08:35:42,1507823881154879492,813697,mckeay,0,[],,['https://pbs.twimg.com/media/FOzd00QXMAM9cDE.jpg'],
https://twitter.com/813697/status/1507767507523940360,https://twitter.com/mckeay,https://pbs.twimg.com/profile_images/604826163567947776/DNc178C5_normal.jpg,,,Martin McKeay,"As I get closer and closer to being done with my new built in office cabinets, 'done' seems to be receding into the distance.

Every task I complete reminds me of half a dozen I still have to do.  The biggy is finding some place to get a small quartz top at a reasonable price.",原创,en,1,0,0,0,2022-03-26 17:12:41,2024-04-12 08:35:55,1507767507523940360,813697,mckeay,0,[],,,
https://twitter.com/813697/status/1507769078865399816,https://twitter.com/mckeay,https://pbs.twimg.com/profile_images/604826163567947776/DNc178C5_normal.jpg,,,Martin McKeay,"@mfratto I need a countertop that is approximately 91"" by 25"", which is well below the point where they charge you a premium for the quartz &amp; cutting.  Might be able to find a good second hand piece, don't have the energy to do so right now.",回复,en,0,0,0,0,2022-03-26 17:18:56,2024-04-12 08:35:55,1507769078865399816,813697,mckeay,0,[],https://twitter.com/mfratto,,
https://twitter.com/813697/status/1507755793898262528,https://twitter.com/mckeay,https://pbs.twimg.com/profile_images/604826163567947776/DNc178C5_normal.jpg,,,Martin McKeay,"My father in law had to have some project to work on every day while he was visiting us.  I think he's forgotten how to relax.

I know he's forgotten more about woodworking than I ever learned.",原创,en,0,0,0,1,2022-03-26 16:26:08,2024-04-12 08:35:55,1507755793898262528,813697,mckeay,0,[],,,
https://twitter.com/813697/status/1507747926872924171,https://twitter.com/mckeay,https://pbs.twimg.com/profile_images/604826163567947776/DNc178C5_normal.jpg,,,Martin McKeay,@SecBarbie @k8em0 Jinx!,回复,in,0,0,0,2,2022-03-26 15:54:53,2024-04-12 08:35:55,1507747926872924171,813697,mckeay,0,[],https://twitter.com/SecBarbie,,
https://twitter.com/813697/status/1507747731816730627,https://twitter.com/mckeay,https://pbs.twimg.com/profile_images/604826163567947776/DNc178C5_normal.jpg,,,Martin McKeay,@k8em0 You have my vote!!,回复,en,0,0,0,2,2022-03-26 15:54:06,2024-04-12 08:35:55,1507747731816730627,813697,mckeay,0,[],https://twitter.com/k8em0,,
https://twitter.com/813697/status/1507745761152413706,https://twitter.com/mckeay,https://pbs.twimg.com/profile_images/604826163567947776/DNc178C5_normal.jpg,,,Martin McKeay,"Bourbon-maple glazed salmon steaks cooked on the pellet grill with alder, with lemon juice drizzled over the top for lunch.  

Wife0 doesn't like fish, so I have to make it for myself when she's out of town.",原创,en,0,0,0,1,2022-03-26 15:46:16,2024-04-12 08:35:55,1507745761152413706,813697,mckeay,0,[],,,
https://twitter.com/813697/status/1507727769983143939,https://twitter.com/mckeay,https://pbs.twimg.com/profile_images/604826163567947776/DNc178C5_normal.jpg,,,Martin McKeay,"Any thought that starts with, ""Maybe @SteveD3 had a good idea ..."" should be immediately flagged as dangerous.",原创,en,0,0,0,4,2022-03-26 14:34:47,2024-04-12 08:35:55,1507727769983143939,813697,mckeay,0,[],,,
https://twitter.com/813697/status/1507721604628992006,https://twitter.com/mckeay,https://pbs.twimg.com/profile_images/604826163567947776/DNc178C5_normal.jpg,,,Martin McKeay,"I read a lot of LitRPG, stories about people being sucked into a world based on a game they were playing.  

The thought of being transported to a Metaverse run by Facebook scares the snot out of me.",原创,en,0,0,0,5,2022-03-26 14:10:17,2024-04-12 08:35:55,1507721604628992006,813697,mckeay,0,[],,,
https://twitter.com/813697/status/1507380826522140680,https://twitter.com/mckeay,https://pbs.twimg.com/profile_images/604826163567947776/DNc178C5_normal.jpg,,,Martin McKeay,"Her: ""I paid off all our cards, we have no debt!""

Me: ""Challenge Accepted!""

Her: ""Wait, what, NO!  Bad husband, don't make me punish you!""",原创,en,1,0,0,12,2022-03-25 15:36:09,2024-04-12 08:35:55,1507380826522140680,813697,mckeay,0,[],,,
https://twitter.com/813697/status/1507720636562653189,https://twitter.com/mckeay,https://pbs.twimg.com/profile_images/604826163567947776/DNc178C5_normal.jpg,,,Martin McKeay,"@krypt3ia But now that you mention it, I bet there's a wifi enabled router robot or something similar out there.  

There goes my afternoon.",回复,en,0,0,0,2,2022-03-26 14:06:26,2024-04-12 08:35:55,1507720636562653189,813697,mckeay,0,[],https://twitter.com/krypt3ia,,
https://twitter.com/813697/status/1507719575835754506,https://twitter.com/mckeay,https://pbs.twimg.com/profile_images/604826163567947776/DNc178C5_normal.jpg,,,Martin McKeay,@krypt3ia Silly boy.,回复,en,0,0,0,1,2022-03-26 14:02:13,2024-04-12 08:35:55,1507719575835754506,813697,mckeay,0,[],https://twitter.com/krypt3ia,,
https://twitter.com/813697/status/1507718146748256265,https://twitter.com/mckeay,https://pbs.twimg.com/profile_images/604826163567947776/DNc178C5_normal.jpg,,,Martin McKeay,"Thinking back to Shmoo 2, I think, where I met @jack_daniel and his son for the very first time.  So much has happened since then, a lot of good and a lot of bad.

Wish I could be there this weekend, but maybe next year.",原创,en,2,0,0,1,2022-03-26 13:56:32,2024-04-12 08:35:55,1507718146748256265,813697,mckeay,0,[],,,
https://twitter.com/813697/status/1507716322477625357,https://twitter.com/mckeay,https://pbs.twimg.com/profile_images/604826163567947776/DNc178C5_normal.jpg,,,Martin McKeay,"@cutaway Good stuff, my friend! 

Part of me wants to ask to see more of it, while the rest is screaming, ""NO! Don't ask for something you don't want to see!""",回复,en,2,0,0,1,2022-03-26 13:49:17,2024-04-12 08:35:55,1507716322477625357,813697,mckeay,0,[],https://twitter.com/cutaway,,
https://twitter.com/813697/status/1507704115140378631,https://twitter.com/mckeay,https://pbs.twimg.com/profile_images/604826163567947776/DNc178C5_normal.jpg,,,Martin McKeay,"All I really needed was a marking tool, but I walked out with several new tools, bits, and a router table.

Luckily, Wife0 is out of town and won't see most of the evidence.",原创,en,0,0,0,2,2022-03-26 13:00:47,2024-04-12 08:35:55,1507704115140378631,813697,mckeay,0,[],,,
https://twitter.com/813697/status/1507689272769490949,https://twitter.com/mckeay,https://pbs.twimg.com/profile_images/604826163567947776/DNc178C5_normal.jpg,,,Martin McKeay,I wrote about 1200 words yesterday with my daughter.  It was an interesting experience for both of us.,原创,en,0,0,0,2,2022-03-26 12:01:48,2024-04-12 08:35:55,1507689272769490949,813697,mckeay,0,[],,,
https://twitter.com/813697/status/1507681249992790019,https://twitter.com/mckeay,https://pbs.twimg.com/profile_images/604826163567947776/DNc178C5_normal.jpg,,,Martin McKeay,"It's 55F/13C outside in Central Florida, and I'm opening as many windows as I can.  This may be one of the last cool days we have until fall.  I might actually enjoy it here if it was like this more often.",原创,en,0,0,0,1,2022-03-26 11:29:56,2024-04-12 08:35:55,1507681249992790019,813697,mckeay,0,[],,,
https://twitter.com/813697/status/1507480830209413123,https://twitter.com/mckeay,https://pbs.twimg.com/profile_images/604826163567947776/DNc178C5_normal.jpg,,,Martin McKeay,"The ride home from the store is 2.5 miles and takes nearly 20 minutes this time of day.

'We should restrict traffic flow so people will take a different route.'

No, that's what all the other neighborhoods did, and why it is so bad.  Let's try reopening the other routes instead",原创,en,1,0,0,2,2022-03-25 22:13:32,2024-04-12 08:35:55,1507480830209413123,813697,mckeay,0,[],,,
https://twitter.com/813697/status/1507434180325556225,https://twitter.com/mckeay,https://pbs.twimg.com/profile_images/604826163567947776/DNc178C5_normal.jpg,,,Martin McKeay,I need a nap.,原创,en,1,0,0,4,2022-03-25 19:08:10,2024-04-12 08:36:12,1507434180325556225,813697,mckeay,0,[],,,
https://twitter.com/813697/status/1507351741695725576,https://twitter.com/mckeay,https://pbs.twimg.com/profile_images/604826163567947776/DNc178C5_normal.jpg,,,Martin McKeay,"As of this morning we are debt free, except for her car and the house.  I'm not sure if we've ever had so little debt in our entire married life.",原创,en,5,0,0,29,2022-03-25 13:40:35,2024-04-12 08:36:12,1507351741695725576,813697,mckeay,0,[],,,
https://twitter.com/813697/status/1507412524714631173,https://twitter.com/mckeay,https://pbs.twimg.com/profile_images/604826163567947776/DNc178C5_normal.jpg,,,Martin McKeay,@gisellis There's also a little bit of bitter sweet irony in knowing it was being laid off that made this possible.,回复,en,1,0,0,0,2022-03-25 17:42:06,2024-04-12 08:36:12,1507412524714631173,813697,mckeay,0,[],https://twitter.com/gisellis,,
https://twitter.com/813697/status/1507343619757428739,https://twitter.com/mckeay,https://pbs.twimg.com/profile_images/604826163567947776/DNc178C5_normal.jpg,,,Martin McKeay,"New 'On a call' sign acquired, with a simple button to turn it off and on remotely. Thanks to @armorguy for suggesting BusyBox as a solution to my interruption problem. https://t.co/0CIkGNlsvb",原创,en,2,0,0,5,2022-03-25 13:08:18,2024-04-12 08:36:12,1507343619757428739,813697,mckeay,0,[],,['https://pbs.twimg.com/media/FOspCA6XMAcMKwF.jpg'],
https://twitter.com/813697/status/1507411248085884937,https://twitter.com/mckeay,https://pbs.twimg.com/profile_images/604826163567947776/DNc178C5_normal.jpg,,,Martin McKeay,"@gattaca @armorguy Get the button too.  It works with an app on your phone, but just being able to hit a button is what makes it a great option.",回复,en,1,0,0,0,2022-03-25 17:37:02,2024-04-12 08:36:12,1507411248085884937,813697,mckeay,0,[],https://twitter.com/gattaca,,
https://twitter.com/813697/status/1507373792078802948,https://twitter.com/mckeay,https://pbs.twimg.com/profile_images/604826163567947776/DNc178C5_normal.jpg,,,Martin McKeay,"Aren't all companies now 'developers' to some degree? 

Certainly every company big enough to be called an 'enterprise' is.",原创,en,0,0,0,2,2022-03-25 15:08:12,2024-04-12 08:36:12,1507373792078802948,813697,mckeay,0,[],,,
https://twitter.com/813697/status/1507372587491409926,https://twitter.com/mckeay,https://pbs.twimg.com/profile_images/604826163567947776/DNc178C5_normal.jpg,,,Martin McKeay,"RT @fsmontenegro: Our team at Omdia has an industry analyst opening focused on Security Operations - think SIEM/SOAR, XDR, and more...
http…",转发,en,0,4,0,0,2022-03-25 15:03:25,2024-04-12 08:36:12,1507372587491409926,813697,mckeay,0,[],https://twitter.com/fsmontenegro,,
https://twitter.com/813697/status/1507372450320945154,https://twitter.com/mckeay,https://pbs.twimg.com/profile_images/604826163567947776/DNc178C5_normal.jpg,,,Martin McKeay,"Current mood:

""What have you accomplished today?""

""I got out of bed.""

""What else?""

""Isn't that enough?""",原创,en,0,0,0,10,2022-03-25 15:02:52,2024-04-12 08:36:12,1507372450320945154,813697,mckeay,0,[],,,
https://twitter.com/813697/status/1507356549890650118,https://twitter.com/mckeay,https://pbs.twimg.com/profile_images/604826163567947776/DNc178C5_normal.jpg,,,Martin McKeay,"@awpiii Gaahh, NO!  

The biggest boat I ever want is a kayak.  I know too many people who own 'money holes' already.",回复,en,1,0,0,1,2022-03-25 13:59:41,2024-04-12 08:36:12,1507356549890650118,813697,mckeay,0,[],https://twitter.com/awpiii,,
https://twitter.com/813697/status/1507350507442090003,https://twitter.com/mckeay,https://pbs.twimg.com/profile_images/604826163567947776/DNc178C5_normal.jpg,,,Martin McKeay,RT @SammyHep: [Community Internship] I’m growing my team at @snyksec  &amp; on the hunt for a Community Intern. It’s an awesome opportunity for…,转发,en,0,11,0,0,2022-03-25 13:35:40,2024-04-12 08:36:12,1507350507442090003,813697,mckeay,0,[],https://twitter.com/SammyHep,,
https://twitter.com/813697/status/1507349382252875783,https://twitter.com/mckeay,https://pbs.twimg.com/profile_images/604826163567947776/DNc178C5_normal.jpg,,,Martin McKeay,"The more I learn about autism to better deal with my youngest, the more I realize how many of the same symptoms are displayed in my own behaviors, just to a lesser degree.  

I'm better at pretending to be normal than he is.  Or so I tell myself.",原创,en,0,0,0,1,2022-03-25 13:31:12,2024-04-12 08:36:12,1507349382252875783,813697,mckeay,0,[],,,
https://twitter.com/813697/status/1507345082655064069,https://twitter.com/mckeay,https://pbs.twimg.com/profile_images/604826163567947776/DNc178C5_normal.jpg,,,Martin McKeay,"@cyentiainst @CyentiaLibrary I'm no Gandalf, but I definitely approve of the @CyentiaLibrary !

I've used it many times to find out who's produced the latest research in our industry.",回复,en,0,0,0,2,2022-03-25 13:14:07,2024-04-12 08:36:12,1507345082655064069,813697,mckeay,0,[],https://twitter.com/cyentiainst,,
https://twitter.com/813697/status/1506646115118108686,https://twitter.com/mckeay,https://pbs.twimg.com/profile_images/604826163567947776/DNc178C5_normal.jpg,,,Martin McKeay,"It's impossible to escape WebEx, isn't it?",原创,en,3,0,0,3,2022-03-23 14:56:40,2024-04-12 08:36:12,1506646115118108686,813697,mckeay,0,[],,,
https://twitter.com/813697/status/1507329340618514434,https://twitter.com/mckeay,https://pbs.twimg.com/profile_images/604826163567947776/DNc178C5_normal.jpg,,,Martin McKeay,@OldFatherWm I thought he was dead.,回复,en,1,0,0,1,2022-03-25 12:11:34,2024-04-12 08:36:12,1507329340618514434,813697,mckeay,0,[],https://twitter.com/OldFatherWm,,
https://twitter.com/813697/status/1507113230619095053,https://twitter.com/mckeay,https://pbs.twimg.com/profile_images/604826163567947776/DNc178C5_normal.jpg,,,Martin McKeay,Gaaah!  A flight from Orland to DC tomorrow morning is available and relatively affordable.  I'm finding myself tempted to ignore Wife0's forbiddance and fly up to join lobbycon!,原创,en,0,0,0,1,2022-03-24 21:52:49,2024-04-12 08:36:12,1507113230619095053,813697,mckeay,0,[],,,
https://twitter.com/813697/status/1507108028188921868,https://twitter.com/mckeay,https://pbs.twimg.com/profile_images/604826163567947776/DNc178C5_normal.jpg,,,Martin McKeay,"@Walshman23 I think his words were, ""Your son is definitely ADHD and I can see where he gets it from.""

Me: ""What?""

Him: ""You didn't realize you had ADHD?""",回复,en,0,0,0,0,2022-03-24 21:32:09,2024-04-12 08:36:12,1507108028188921868,813697,mckeay,0,[],https://twitter.com/Walshman23,,
https://twitter.com/813697/status/1507107384480645120,https://twitter.com/mckeay,https://pbs.twimg.com/profile_images/604826163567947776/DNc178C5_normal.jpg,,,Martin McKeay,"Daughter to me, while learning woodworking from her grandfather: This would have been so much easier if you just have a router!

Me:  I do have one.  It's right there on the shelf.  

Daughter:  Ummm...",原创,en,0,0,0,3,2022-03-24 21:29:35,2024-04-12 08:36:12,1507107384480645120,813697,mckeay,0,[],,,
https://twitter.com/813697/status/1507103054730076164,https://twitter.com/mckeay,https://pbs.twimg.com/profile_images/604826163567947776/DNc178C5_normal.jpg,,,Martin McKeay,"Always be willing to admit it when you've made a mistake.

It confuses and annoys the hell out of those people who feel they always have to be right.",原创,en,0,1,0,5,2022-03-24 21:12:23,2024-04-12 08:36:12,1507103054730076164,813697,mckeay,0,[],,,
https://twitter.com/813697/status/1507102319732793357,https://twitter.com/mckeay,https://pbs.twimg.com/profile_images/604826163567947776/DNc178C5_normal.jpg,,,Martin McKeay,"@Richard_Kadrey Raspberry Pi.  Maybe not those with tons of cash, but those with liter bottles filled with coins certainly do.",回复,en,0,0,0,1,2022-03-24 21:09:28,2024-04-12 08:36:12,1507102319732793357,813697,mckeay,0,[],https://twitter.com/Richard_Kadrey,,
https://twitter.com/813697/status/1507096802495025156,https://twitter.com/mckeay,https://pbs.twimg.com/profile_images/604826163567947776/DNc178C5_normal.jpg,,,Martin McKeay,What's the soundscape like at your house this afternoon?,原创,en,1,0,0,0,2022-03-24 20:47:32,2024-04-12 08:36:29,1507096802495025156,813697,mckeay,0,[],,,
https://twitter.com/813697/status/1507098544402014221,https://twitter.com/mckeay,https://pbs.twimg.com/profile_images/604826163567947776/DNc178C5_normal.jpg,,,Martin McKeay,"@krypt3ia What about the sounds that aren't in your head?

Or have you lost the ability to tell the difference at this point?",回复,en,1,0,0,0,2022-03-24 20:54:28,2024-04-12 08:36:29,1507098544402014221,813697,mckeay,0,[],https://twitter.com/krypt3ia,,
https://twitter.com/813697/status/1507095971381096451,https://twitter.com/mckeay,https://pbs.twimg.com/profile_images/604826163567947776/DNc178C5_normal.jpg,,,Martin McKeay,"This afternoon's sound track: My MiL and her sister complaining about health problems, my FiL teaching my daughter and her GF woodworking skills, and the hammer blows of me putting together Ikea furniture.

Oh, and Ludovico Einaudi playing quietly underneath it all.",原创,en,0,0,0,1,2022-03-24 20:44:14,2024-04-12 08:36:29,1507095971381096451,813697,mckeay,0,[],,,
https://twitter.com/813697/status/1506982541970001921,https://twitter.com/mckeay,https://pbs.twimg.com/profile_images/604826163567947776/DNc178C5_normal.jpg,,,Martin McKeay,"@krypt3ia ""What's the worst that could happen?"", we asked ourselves.

A couple years later, ""As cynical as we are, there was no way we believed it would get this bad!""",回复,en,1,0,0,3,2022-03-24 13:13:31,2024-04-12 08:36:29,1506982541970001921,813697,mckeay,0,[],https://twitter.com/krypt3ia,,
https://twitter.com/813697/status/1506784953488625666,https://twitter.com/mckeay,https://pbs.twimg.com/profile_images/604826163567947776/DNc178C5_normal.jpg,,,Martin McKeay,"Linkedin: Please look at this list of great companies that are hiring!

Also LinkedIn: Look at this list of awful companies that recently got breached!

Me: it's not my imagination, those really are the same lists!",原创,en,0,0,0,2,2022-03-24 00:08:22,2024-04-12 08:36:29,1506784953488625666,813697,mckeay,0,[],,,
https://twitter.com/813697/status/1506717599656251397,https://twitter.com/mckeay,https://pbs.twimg.com/profile_images/604826163567947776/DNc178C5_normal.jpg,,,Martin McKeay,"I don't wanna learn how to write a proper survey.

But, if the only alternative is creating a poorly worded one, I'll learn how to create some of the best in our industry.

The bar isn't that high, after all.",原创,en,0,0,0,4,2022-03-23 19:40:43,2024-04-12 08:36:29,1506717599656251397,813697,mckeay,0,[],,,
https://twitter.com/813697/status/1506668007950594054,https://twitter.com/mckeay,https://pbs.twimg.com/profile_images/604826163567947776/DNc178C5_normal.jpg,,,Martin McKeay,"It can be hard to defend dedicated time for learning, even in your own mind.

But you have to preserve a commitment to learning, even if it means saying no to other projects sometimes.",原创,en,0,1,0,3,2022-03-23 16:23:40,2024-04-12 08:36:29,1506668007950594054,813697,mckeay,0,[],,,
https://twitter.com/813697/status/1506659129603117058,https://twitter.com/mckeay,https://pbs.twimg.com/profile_images/604826163567947776/DNc178C5_normal.jpg,,,Martin McKeay,RT @cyentiainst: Need data to drive cyber risk quantification efforts? We've released a free study with all kids of useful data points like…,转发,en,0,3,0,0,2022-03-23 15:48:23,2024-04-12 08:36:29,1506659129603117058,813697,mckeay,0,[],https://twitter.com/cyentiainst,,
https://twitter.com/813697/status/1506658455335186436,https://twitter.com/mckeay,https://pbs.twimg.com/profile_images/604826163567947776/DNc178C5_normal.jpg,,,Martin McKeay,"@armorguy I'm not sure we can persuade @gattaca to take on a mission like that, but it's worth asking.",回复,en,0,0,0,0,2022-03-23 15:45:42,2024-04-12 08:36:29,1506658455335186436,813697,mckeay,0,[],https://twitter.com/armorguy,,
https://twitter.com/813697/status/1506642562744041477,https://twitter.com/mckeay,https://pbs.twimg.com/profile_images/604826163567947776/DNc178C5_normal.jpg,,,Martin McKeay,"How much am I learning in order to make the most of my role at Snyk?

Well, it's not been two months yet and I've already filled a notebook.  It's taken me a year or more to do the same in the before times.",原创,en,0,0,0,6,2022-03-23 14:42:33,2024-04-12 08:36:29,1506642562744041477,813697,mckeay,0,[],,,
https://twitter.com/813697/status/1506602151300194308,https://twitter.com/mckeay,https://pbs.twimg.com/profile_images/604826163567947776/DNc178C5_normal.jpg,,,Martin McKeay,"I'm probably going to have a monkey showing me its anus in my timeline for days.  Thanks, @snipeyhead",原创,en,1,0,0,2,2022-03-23 12:01:58,2024-04-12 08:36:29,1506602151300194308,813697,mckeay,0,[],,,
