tweet_url,author_url,avatar_url,avatar_binary,topic,author_name,content,tweet_type,tweet_language,comment_count,retweet_count,quote_count,praise_count,publish_time,fetch_time,tweet_id,screen_id,screen_name,tourist_crawl_status,video_urls,original_author,tweet_img_url,tweet_img_binary
https://twitter.com/1023698377/status/1138492087077343232,https://twitter.com/JulieSBrill,https://pbs.twimg.com/profile_images/1693653278041812992/885coUMF_normal.jpg,,,Julie Brill,"Want to know what will happen next in #privacy and #dataprotection?  @caprivacyorg’s Alastair MacTaggart, @BrunoGencarelli @JustinAnt1 and I spell it out for you. https://t.co/YatEnc6BJV",原创,en,0,0,1,3,2019-06-11 17:04:00,2024-04-11 09:02:39,1138492087077343232,1023698377,JulieSBrill,0,[],,,
https://twitter.com/1023698377/status/1136648942610001920,https://twitter.com/JulieSBrill,https://pbs.twimg.com/profile_images/1693653278041812992/885coUMF_normal.jpg,,,Julie Brill,Kids want to be asked for their permission before parents post their pics online. Gives new meaning to “parental control”! Good story in @washingtonpost by @CaitJGibson https://t.co/IHIFPg1y19,原创,en,0,5,0,10,2019-06-06 15:00:00,2024-04-11 09:02:39,1136648942610001920,1023698377,JulieSBrill,0,[],,,
https://twitter.com/1023698377/status/1135622180467859463,https://twitter.com/JulieSBrill,https://pbs.twimg.com/profile_images/1693653278041812992/885coUMF_normal.jpg,,,Julie Brill,Congress is back in session this week. Time to get back to work on privacy legislation. My recommendations on how Congress can – and should – do more to provide protections in this new era of data privacy. https://t.co/yPUpDwdEMO,原创,en,0,3,1,7,2019-06-03 19:00:01,2024-04-11 09:02:40,1135622180467859463,1023698377,JulieSBrill,0,[],,,
https://twitter.com/1023698377/status/1132300293738246145,https://twitter.com/JulieSBrill,https://pbs.twimg.com/profile_images/1693653278041812992/885coUMF_normal.jpg,,,Julie Brill,"GDPR’s one year birthday is not the only milestone we are celebrating today.  OECD nations + 6 others agreed to principles for human-centered development and use of AI.  

And for the first time, the U.S. has endorsed international principles on AI. 

https://t.co/RPeNdZ1Y8s",原创,en,0,17,1,17,2019-05-25 15:00:01,2024-04-11 09:02:51,1132300293738246145,1023698377,JulieSBrill,0,[],,,
https://twitter.com/1023698377/status/1131956930795073536,https://twitter.com/JulieSBrill,https://pbs.twimg.com/profile_images/1693653278041812992/885coUMF_normal.jpg,,,Julie Brill,"Never before has the demand for modern privacy laws been so strong. Consumers want it. Businesses need it. It’s time our government delivers. My views, in @thehill:  https://t.co/NzsXhMFPSf https://t.co/fkGPR73iqQ",原创,en,2,28,2,46,2019-05-24 16:15:37,2024-04-11 09:02:51,1131956930795073536,1023698377,JulieSBrill,0,[],,['https://pbs.twimg.com/media/D7WD92bU8AEADYY.jpg'],
https://twitter.com/1023698377/status/1131092579544702976,https://twitter.com/JulieSBrill,https://pbs.twimg.com/profile_images/1693653278041812992/885coUMF_normal.jpg,,,Julie Brill,"It’s been a year since #GDPR took effect, and there is a lot we can learn from this effort. One thing we know for sure: it’s not just Europeans who want to know more about what is happening with their data. Americans continue to be the most eager to view their data. https://t.co/MScjOt0RFW",原创,en,0,4,0,11,2019-05-22 07:01:00,2024-04-11 09:02:51,1131092579544702976,1023698377,JulieSBrill,0,[],,['https://pbs.twimg.com/media/D7E_zKnXsAAK5c7.jpg'],
https://twitter.com/1023698377/status/1130552816668467200,https://twitter.com/JulieSBrill,https://pbs.twimg.com/profile_images/1693653278041812992/885coUMF_normal.jpg,,,Julie Brill,"Over 18 million people have used the @Microsoft privacy dashboard to control their data since #GDPR began, including 6.7 million users from the US – the most of any country. Does this show an appetite among Americans for updated privacy laws? Yes! https://t.co/Yyw5Sf7sTA",原创,en,1,45,2,75,2019-05-20 19:16:10,2024-04-11 09:02:51,1130552816668467200,1023698377,JulieSBrill,0,[],,,
https://twitter.com/1023698377/status/1130486787070201857,https://twitter.com/JulieSBrill,https://pbs.twimg.com/profile_images/1693653278041812992/885coUMF_normal.jpg,,,Julie Brill,"What might the U.S. do with regards to a data privacy law? I addressed the euroforum #EDPD19 audience on my predictions, and reminded them how Europe and the U.S. have influenced and informed one another’s approach to privacy for decades. https://t.co/2EnKKUO5fx",原创,en,0,2,0,18,2019-05-20 14:53:48,2024-04-11 09:02:51,1130486787070201857,1023698377,JulieSBrill,0,[],,['https://pbs.twimg.com/media/D7BLeGDWkAEBjbV.jpg'],
https://twitter.com/1023698377/status/1129012372746756099,https://twitter.com/JulieSBrill,https://pbs.twimg.com/profile_images/1693653278041812992/885coUMF_normal.jpg,,,Julie Brill,"At 2019 German-American Data Protection Day, @martinselmayr also said #PrivacyShield is subject to significance risk in European Court of Justice. A new US #privacy law would provide greater assurance of continued data flows to the EU, and does not need to be identical to #GDPR.",原创,en,0,1,2,5,2019-05-16 13:15:00,2024-04-11 09:02:52,1129012372746756099,1023698377,JulieSBrill,0,[],,,
https://twitter.com/1023698377/status/1129008597457784832,https://twitter.com/JulieSBrill,https://pbs.twimg.com/profile_images/1693653278041812992/885coUMF_normal.jpg,,,Julie Brill,"Today in Munich, European Commission Sec-Gen @MartinSelmayr shares that GDPR has inspired 138 laws around the world, and that the world is moving towards convergence around the need for strong privacy laws. https://t.co/GUeAuF67zN",原创,en,1,8,1,18,2019-05-16 13:00:00,2024-04-11 09:02:52,1129008597457784832,1023698377,JulieSBrill,0,[],,['https://pbs.twimg.com/media/D6rpcu0XoAAZjYj.jpg'],
https://twitter.com/1023698377/status/1128706610585411585,https://twitter.com/JulieSBrill,https://pbs.twimg.com/profile_images/1693653278041812992/885coUMF_normal.jpg,,,Julie Brill,"I’m bound for Europe this week, to present on #privacy, ethical #AI &amp; #GDPR with @MartinSelmayr, @VeraJourova. and @PaulNemitz https://t.co/qZTwfCbcMx",原创,en,0,1,0,9,2019-05-15 17:00:00,2024-04-11 09:02:52,1128706610585411585,1023698377,JulieSBrill,0,[],,,
https://twitter.com/1023698377/status/1127595606053130245,https://twitter.com/JulieSBrill,https://pbs.twimg.com/profile_images/1693653278041812992/885coUMF_normal.jpg,,,Julie Brill,Wishing all mothers a wonderful #MothersDay! Let’s all have a fantastic day celebrating your greatness! 👩💝💐,原创,en,0,0,0,7,2019-05-12 15:25:16,2024-04-11 09:02:52,1127595606053130245,1023698377,JulieSBrill,0,[],,,
https://twitter.com/1023698377/status/1126613818178719744,https://twitter.com/JulieSBrill,https://pbs.twimg.com/profile_images/1693653278041812992/885coUMF_normal.jpg,,,Julie Brill,This is a good primer on the #CCPA via @natlawreview for emerging companies to architect their privacy policies with a consumer-centric mindset. https://t.co/Plltn7AKPg,原创,en,0,1,0,3,2019-05-09 22:24:00,2024-04-11 09:02:52,1126613818178719744,1023698377,JulieSBrill,0,[],,,
https://twitter.com/1023698377/status/1126532802327932929,https://twitter.com/JulieSBrill,https://pbs.twimg.com/profile_images/1693653278041812992/885coUMF_normal.jpg,,,Julie Brill,"From two-step authentication and password managers to using antivirus software, this @wirecutter @kingthor article provides 7 clear steps all of us can take to secure our online #privacy. https://t.co/B8k91gu2pP",原创,en,1,6,0,23,2019-05-09 17:02:04,2024-04-11 09:02:52,1126532802327932929,1023698377,JulieSBrill,0,[],,,
https://twitter.com/1023698377/status/1126234627490795520,https://twitter.com/JulieSBrill,https://pbs.twimg.com/profile_images/1693653278041812992/885coUMF_normal.jpg,,,Julie Brill,"Women Know Cyber, indeed! Honored to be listed among some of the leaders in online privacy and security (who also happen to be women). https://t.co/DFcC3A4acN",原创,en,1,8,0,14,2019-05-08 21:17:14,2024-04-11 09:02:52,1126234627490795520,1023698377,JulieSBrill,0,[],,,
https://twitter.com/1023698377/status/1126170202612191233,https://twitter.com/JulieSBrill,https://pbs.twimg.com/profile_images/1693653278041812992/885coUMF_normal.jpg,,,Julie Brill,.@katecrawford’s research with @AINowInstitute explains the problems and pitfalls of existing artificial intelligence systems. Confronting these issues is critically important for the future of #AI – and the future of all of us.,原创,en,1,0,0,0,2019-05-08 17:01:14,2024-04-11 09:02:52,1126170202612191233,1023698377,JulieSBrill,0,[],,,
https://twitter.com/1023698377/status/1125828392941699073,https://twitter.com/JulieSBrill,https://pbs.twimg.com/profile_images/1693653278041812992/885coUMF_normal.jpg,,,Julie Brill,Important that the U.S. Congress gain insights on #GDPR as they work towards privacy legislation. Cooperation and information sharing is critical to ensuring we have frameworks with both strong privacy protections and interoperable standards. https://t.co/YwQceXFGgL,原创,en,0,11,0,10,2019-05-07 18:23:00,2024-04-11 09:02:52,1125828392941699073,1023698377,JulieSBrill,0,[],,,
https://twitter.com/1023698377/status/1124349998991327232,https://twitter.com/JulieSBrill,https://pbs.twimg.com/profile_images/1693653278041812992/885coUMF_normal.jpg,,,Julie Brill,"I’m thankful to @EU_EDPB’s Andrea Jelinek and @PrivacyPros for the opportunity today to discuss enforcement, interagency cooperation, and next steps one year into #GDPR implementation. #GPS19 https://t.co/2N340hwbNV",原创,en,0,2,0,6,2019-05-03 16:28:23,2024-04-11 09:03:09,1124349998991327232,1023698377,JulieSBrill,0,[],,"['https://pbs.twimg.com/media/D5p9fj3X4AAGy6P.jpg', 'https://pbs.twimg.com/media/D5p9iVQX4AIgRa2.jpg']",
https://twitter.com/1023698377/status/1124319877500743680,https://twitter.com/JulieSBrill,https://pbs.twimg.com/profile_images/1693653278041812992/885coUMF_normal.jpg,,,Julie Brill,"A year from now at #GPS20, Chair Jelinek hopes the two of us will be talking about a strong U.S. federal law that provides robust privacy protections for all Americans. I couldn't agree more. #GPS19 #IAPP",原创,en,1,5,0,10,2019-05-03 14:28:42,2024-04-11 09:03:09,1124319877500743680,1023698377,JulieSBrill,0,[],,,
https://twitter.com/1023698377/status/1124315820946075649,https://twitter.com/JulieSBrill,https://pbs.twimg.com/profile_images/1693653278041812992/885coUMF_normal.jpg,,,Julie Brill,"""Carrots and sticks are important...you have to have an enforcer to be taken seriously."" - @EU_EDPB Chair Andrea Jelinek on her advice for developing privacy laws #GPS19",原创,en,0,8,1,5,2019-05-03 14:12:35,2024-04-11 09:03:09,1124315820946075649,1023698377,JulieSBrill,0,[],,,
https://twitter.com/1023698377/status/1124313751237353472,https://twitter.com/JulieSBrill,https://pbs.twimg.com/profile_images/1693653278041812992/885coUMF_normal.jpg,,,Julie Brill,"I asked Chair Jelinek, what is the impact of GDPR beyond the EU? She says as Europe sets the pace on privacy through the GDPR, adequacy negotiations are very important, and global alignment on the principles will be much easier for everyone. #GPS19 #IAPP",原创,en,0,7,0,8,2019-05-03 14:04:21,2024-04-11 09:03:09,1124313751237353472,1023698377,JulieSBrill,0,[],,,
https://twitter.com/1023698377/status/1124311303689048074,https://twitter.com/JulieSBrill,https://pbs.twimg.com/profile_images/1693653278041812992/885coUMF_normal.jpg,,,Julie Brill,"Chair Jelinek points to existing guidance from @EU_EDPB on behavioral advertising under the GDPR, and that legitimate interest can sometimes be a justification for behavioral advertising. Proposes an ethical board on technology. #GPS19 #IAPP",原创,en,1,6,0,14,2019-05-03 13:54:38,2024-04-11 09:03:09,1124311303689048074,1023698377,JulieSBrill,0,[],,,
https://twitter.com/1023698377/status/1124310057355743232,https://twitter.com/JulieSBrill,https://pbs.twimg.com/profile_images/1693653278041812992/885coUMF_normal.jpg,,,Julie Brill,".@EU_EDPB Chair Andrea Jelinek emphasizes how thorough the investigations from the lead supervisory authorities have been, and that is why no cases have risen to the level of being investigated further by the board.  #GPS19 #IAPP",原创,en,0,2,0,6,2019-05-03 13:49:41,2024-04-11 09:03:09,1124310057355743232,1023698377,JulieSBrill,0,[],,,
https://twitter.com/1023698377/status/1124118626066259968,https://twitter.com/JulieSBrill,https://pbs.twimg.com/profile_images/1693653278041812992/885coUMF_normal.jpg,,,Julie Brill,Congratulations to my friend in privacy @the_cipl’s Bojana Bellamy for being this year’s recipient of the #IAPP Privacy Vanguard Award! https://t.co/VGV1qdh44Y #GPS19,原创,en,0,1,0,2,2019-05-03 01:09:00,2024-04-11 09:03:09,1124118626066259968,1023698377,JulieSBrill,0,[],,,
https://twitter.com/1023698377/status/1124101264353026048,https://twitter.com/JulieSBrill,https://pbs.twimg.com/profile_images/1693653278041812992/885coUMF_normal.jpg,,,Julie Brill,"If you’re at #GPS19, join my fireside chat tomorrow with @EU_EDPB’s Andrea Jelinek on key learnings about the renewed regulatory landscape as we come up on GDPR’s first anniversary.  [9:30am ET, Salon 5, Level M2] https://t.co/DJ1Msus8pV",原创,en,0,3,0,6,2019-05-03 00:00:00,2024-04-11 09:03:09,1124101264353026048,1023698377,JulieSBrill,0,[],,,
https://twitter.com/1023698377/status/1124000104816553984,https://twitter.com/JulieSBrill,https://pbs.twimg.com/profile_images/1693653278041812992/885coUMF_normal.jpg,,,Julie Brill,"The truth is, in this ecosystem, it's impossible for consumers to navigate everything. Whether it's opting-in or opting-out, it's really too much. Companies need to bear their share of the responsibility for their data practices through privacy impact assessments. #GPS19 #IAPP",原创,en,0,10,3,18,2019-05-02 17:18:02,2024-04-11 09:03:09,1124000104816553984,1023698377,JulieSBrill,0,[],,,
https://twitter.com/1023698377/status/1123950267706167296,https://twitter.com/JulieSBrill,https://pbs.twimg.com/profile_images/1693653278041812992/885coUMF_normal.jpg,,,Julie Brill,"So great to be at @privacypros #GPS19. I kick off the day with Alastair MacTaggart and @JustinAnt1 talking about #GDPR, #CCPA and more. 12:45 pm at the Marriot, Salon 5. https://t.co/D0uhRBcPaj",原创,en,0,3,0,10,2019-05-02 14:00:00,2024-04-11 09:03:09,1123950267706167296,1023698377,JulieSBrill,0,[],,['https://pbs.twimg.com/media/D5j5iIQWkAAFGXj.jpg'],
https://twitter.com/1023698377/status/1123278341300264960,https://twitter.com/JulieSBrill,https://pbs.twimg.com/profile_images/1693653278041812992/885coUMF_normal.jpg,,,Julie Brill,.@Microsoft is committed to giving customers more control over their data and to continually improving our services. Today we’re taking additional steps to give customers more transparency and control regarding how our products collect their data. https://t.co/4a1cNpFdPu,原创,en,0,4,0,7,2019-04-30 17:30:00,2024-04-11 09:03:09,1123278341300264960,1023698377,JulieSBrill,0,[],,,
https://twitter.com/1023698377/status/1123251915624800256,https://twitter.com/JulieSBrill,https://pbs.twimg.com/profile_images/1693653278041812992/885coUMF_normal.jpg,,,Julie Brill,"As laboratories of democracy, states can lead the way with strong privacy laws that empower individuals to control their data, make companies accountable, and are backed by strong enforcement. Consumers deserve nothing less. https://t.co/XoCGc41VOb",原创,en,0,1,2,2,2019-04-30 15:45:00,2024-04-11 09:03:09,1123251915624800256,1023698377,JulieSBrill,0,[],,,
https://twitter.com/1023698377/status/1122954958544916480,https://twitter.com/JulieSBrill,https://pbs.twimg.com/profile_images/1693653278041812992/885coUMF_normal.jpg,,,Julie Brill,"Important op-ed from @datasociety @mary_madden in the @NYTimes on how lower income and marginalized communities are more likely to be impacted by privacy harms, and in great need of strong privacy laws to provide protection. https://t.co/JPEyb3wQr3",原创,en,2,63,5,128,2019-04-29 20:05:00,2024-04-11 09:03:09,1122954958544916480,1023698377,JulieSBrill,0,[],,,
https://twitter.com/1023698377/status/1120367912131416065,https://twitter.com/JulieSBrill,https://pbs.twimg.com/profile_images/1693653278041812992/885coUMF_normal.jpg,,,Julie Brill,"Happy #EarthDay! We need a global approach to sustainability, just like we need a global approach to data privacy and protection. @Microsoft is taking serious steps to do its part – including a $15 carbon fee and 70% renewable energy data centers by 2023. https://t.co/nMSXqYNazJ",原创,en,0,0,1,2,2019-04-22 16:45:00,2024-04-11 09:03:09,1120367912131416065,1023698377,JulieSBrill,0,[],,,
https://twitter.com/1023698377/status/1115653835261923328,https://twitter.com/JulieSBrill,https://pbs.twimg.com/profile_images/1693653278041812992/885coUMF_normal.jpg,,,Julie Brill,Chairman @JoeSimonsFTC is right: the FTC needs a large infusion of resources to competently handle privacy enforcement. https://t.co/ruCOmxEJbi,原创,en,1,14,5,21,2019-04-09 16:32:56,2024-04-11 09:03:09,1115653835261923328,1023698377,JulieSBrill,0,[],,,
https://twitter.com/1023698377/status/1113790069167611904,https://twitter.com/JulieSBrill,https://pbs.twimg.com/profile_images/1693653278041812992/885coUMF_normal.jpg,,,Julie Brill,"It is time for the US to work closely with multilateral stakeholders at the @OECD and elsewhere. @Microsoft we believe #privacy, #AI and other challenges require global thought leadership and cooperation. Important perspectives in piece by @SteveLohr: https://t.co/DNx5WPyIdj",原创,en,0,2,0,4,2019-04-04 13:07:00,2024-04-11 09:03:09,1113790069167611904,1023698377,JulieSBrill,0,[],,,
https://twitter.com/1023698377/status/1110287766930235392,https://twitter.com/JulieSBrill,https://pbs.twimg.com/profile_images/1693653278041812992/885coUMF_normal.jpg,,,Julie Brill,Back in Washington D.C. at the @FTC today to address distinguished regulators from around the globe regarding international engagement and emerging technologies like AI. I’d like to share some points I made. #FTCHearings,原创,en,1,2,0,1,2019-03-25 21:10:06,2024-04-11 09:03:09,1110287766930235392,1023698377,JulieSBrill,0,[],,,
https://twitter.com/1023698377/status/1110176079858335745,https://twitter.com/JulieSBrill,https://pbs.twimg.com/profile_images/1693653278041812992/885coUMF_normal.jpg,,,Julie Brill,Honored to join the @OECD Going Digital Summit to talk about privacy as part of OECD’s efforts to understand how technology impacts our societies and economies.  We must develop new legal frameworks to ensure that the digital transformation benefits us all.,原创,en,0,0,0,7,2019-03-25 13:46:18,2024-04-11 09:03:24,1110176079858335745,1023698377,JulieSBrill,0,[],,,
https://twitter.com/1023698377/status/1109179677896105984,https://twitter.com/JulieSBrill,https://pbs.twimg.com/profile_images/1693653278041812992/885coUMF_normal.jpg,,,Julie Brill,"Honored to stand alongside Joanne McNabb of CA @AGBecerra’s office and @privacymama Nuala O’Connor of @CenDemTech today to receive the @BerkeleyLawBCLT Privacy Award. 

When we fight for the fundamental right to privacy, we all win. https://t.co/clDpzOhDfw",原创,en,2,12,3,47,2019-03-22 19:46:57,2024-04-11 09:03:24,1109179677896105984,1023698377,JulieSBrill,0,[],,['https://pbs.twimg.com/media/D2SY2k7U4AA2VDB.jpg'],
https://twitter.com/1023698377/status/1108819036391895040,https://twitter.com/JulieSBrill,https://pbs.twimg.com/profile_images/1693653278041812992/885coUMF_normal.jpg,,,Julie Brill,"Heading to California to finish up the week at the @BerkeleyLawBCLT #Privacy Law Forum. Looking forward to connecting with @privacymama Nuala O’Connor of @CenDemTech, Alastair MacTaggart of @caprivacyorg, Deirdre Mulligan of @UCBerkeley, and many more privacy wonks.",原创,en,0,0,1,10,2019-03-21 19:53:53,2024-04-11 09:03:24,1108819036391895040,1023698377,JulieSBrill,0,[],,,
https://twitter.com/1023698377/status/1102977361559969792,https://twitter.com/JulieSBrill,https://pbs.twimg.com/profile_images/1693653278041812992/885coUMF_normal.jpg,,,Julie Brill,Heading to @RSAConference where #Security welcomes #privacy into the family.  Today I join @PrivacyPros’ Angelique Carson (aka @privacypen) &amp; others to talk about federal &amp; state privacy legislation.,原创,en,2,7,1,35,2019-03-05 17:01:09,2024-04-11 09:03:24,1102977361559969792,1023698377,JulieSBrill,0,[],,,
https://twitter.com/1023698377/status/1060557408710393857,https://twitter.com/JulieSBrill,https://pbs.twimg.com/profile_images/1693653278041812992/885coUMF_normal.jpg,,,Julie Brill,"Happening now: my talk at the @FTC hearing, focusing on #privacy, #bigdata, and #competition on the former enforcers panel with @ArnoldPorter’s Bill Baer and @M_Ohlhausen. #FTChearings:  https://t.co/eD6w5GIyTy",原创,en,2,3,0,11,2018-11-08 15:39:25,2024-04-11 09:03:24,1060557408710393857,1023698377,JulieSBrill,0,[],,,
https://twitter.com/1023698377/status/1060374953051205632,https://twitter.com/JulieSBrill,https://pbs.twimg.com/profile_images/1693653278041812992/885coUMF_normal.jpg,,,Julie Brill,"A good day in Redmond. Thanks UK Home Secretary @Sajidjavid for your leadership in our shared cause to develop even better solutions to keep children safe online &amp; to end online child sexual exploitation. For #OnlineSafety info, please visit @Microsoft's @Safer_Online. https://t.co/dXqGozkMLJ",原创,en,0,6,0,14,2018-11-08 03:34:24,2024-04-11 09:03:24,1060374953051205632,1023698377,JulieSBrill,0,[],,['https://pbs.twimg.com/media/Drc1FPPWoAAoIOh.jpg'],
https://twitter.com/1023698377/status/1055397001012097024,https://twitter.com/JulieSBrill,https://pbs.twimg.com/profile_images/1693653278041812992/885coUMF_normal.jpg,,,Julie Brill,"Thanks Elizabeth Denham @ICOnews, @MarcRotenberg, Andrea Jelinek @EU_EDPB, @FTCPhillips and #ICDPPC2018 for great discussion on the future of #DataProtection and #digitalethics.",原创,en,1,1,0,5,2018-10-25 09:53:48,2024-04-11 09:03:41,1055397001012097024,1023698377,JulieSBrill,0,[],,,
https://twitter.com/1023698377/status/1055011672086208513,https://twitter.com/JulieSBrill,https://pbs.twimg.com/profile_images/1693653278041812992/885coUMF_normal.jpg,,,Julie Brill,"We applaud @tim_cook for joining @Microsoft in supporting a robust US federal #privacy law. #GDPR has set a strong global standard, but privacy is not just a European value, it’s shared worldwide. It’s our shared responsibility–companies, governments &amp; citizens–to protect privacy",原创,en,1,57,6,101,2018-10-24 08:22:38,2024-04-11 09:03:41,1055011672086208513,1023698377,JulieSBrill,0,[],,,
https://twitter.com/1023698377/status/1053849146883366912,https://twitter.com/JulieSBrill,https://pbs.twimg.com/profile_images/1693653278041812992/885coUMF_normal.jpg,,,Julie Brill,"Brussels bound! In 2 days, the @EU_EDPS hosts the @icdppc2018. I look forward to seeing old and new friends, and to addressing digital #ethics, fairness in #privacy and #dataprotection, and transatlantic cooperation. https://t.co/kcK2K1gjec",原创,en,0,12,0,32,2018-10-21 03:23:10,2024-04-11 09:03:41,1053849146883366912,1023698377,JulieSBrill,0,[],,,
https://twitter.com/1023698377/status/1041773241180680192,https://twitter.com/JulieSBrill,https://pbs.twimg.com/profile_images/1693653278041812992/885coUMF_normal.jpg,,,Julie Brill,".@Microsoft extended the data subject rights at the heart of #GDPR to consumers around the world, and more than 5 million people from over 200 countries - including 2 million Americans - have exercised their rights and managed their information. https://t.co/s9Ute0bmiG",原创,en,2,112,16,136,2018-09-17 19:37:50,2024-04-11 09:03:41,1041773241180680192,1023698377,JulieSBrill,0,[],,,
https://twitter.com/1023698377/status/1032748998203912192,https://twitter.com/JulieSBrill,https://pbs.twimg.com/profile_images/1693653278041812992/885coUMF_normal.jpg,,,Julie Brill,"I’m excited to give the opening keynote @SNUnow’s AI Policy Initiative conference today in Seoul. Along with @EdFelten &amp; @hartzog, I'll discuss the ethical development of AI, its potential promise &amp; impact, &amp; what it means to use AI for the greater good. https://t.co/WR5KtIfjbq https://t.co/vwzLOOIA6s",原创,en,0,2,1,13,2018-08-23 21:58:43,2024-04-11 09:03:41,1032748998203912192,1023698377,JulieSBrill,0,[],,['https://pbs.twimg.com/media/DlUPoOsUcAAiPxZ.jpg'],
https://twitter.com/1023698377/status/1022015422483374080,https://twitter.com/JulieSBrill,https://pbs.twimg.com/profile_images/1693653278041812992/885coUMF_normal.jpg,,,Julie Brill,"Our teen #CouncilForDigitalGood sends its #digitalcivility proposals to U.S. policymakers to address #cyberbullying and improve #onlinesafety. Once again young people lead the way, showing that we can choose to act when confronted with a problem: https://t.co/B7bvZOOSvI",原创,en,0,1,0,6,2018-07-25 07:07:19,2024-04-11 09:03:42,1022015422483374080,1023698377,JulieSBrill,0,[],,,
https://twitter.com/1023698377/status/1020317557125976066,https://twitter.com/JulieSBrill,https://pbs.twimg.com/profile_images/1693653278041812992/885coUMF_normal.jpg,,,Julie Brill,".@Microsoft wants to empower individuals to control their own data. Today we announce the Data Transfer Project, an open source data portability project aimed at helping people move their data securely and seamlessly between platforms &amp; providers: https://t.co/QiyvCzvDyg",原创,en,8,142,26,266,2018-07-20 14:40:36,2024-04-11 09:03:42,1020317557125976066,1023698377,JulieSBrill,0,[],,,
