tweet_url,author_url,avatar_url,avatar_binary,topic,author_name,content,tweet_type,tweet_language,comment_count,retweet_count,quote_count,praise_count,publish_time,fetch_time,tweet_id,screen_id,screen_name,tourist_crawl_status,video_urls,original_author,tweet_img_url,tweet_img_binary
https://twitter.com/14090906/status/1562858260356792326,https://twitter.com/WeldPond,https://pbs.twimg.com/profile_images/1732479699748519937/5NQhmNOG_normal.jpg,,,Weld Pond | Chris Wysopal,When end of life software means end of virtual marriage. This guy needs a hacker to reconnect him with his love.  https://t.co/oMoGhNn1Rg,原创,en,4,2,1,7,2022-08-25 17:43:40,2024-04-10 20:15:17,1562858260356792326,14090906,WeldPond,0,[],,,
https://twitter.com/14090906/status/1560271804438298624,https://twitter.com/WeldPond,https://pbs.twimg.com/profile_images/1732479699748519937/5NQhmNOG_normal.jpg,,,Weld Pond | Chris Wysopal,"""Password expiration requirements do more harm than good, because these requirements make users select predictable passwords"" 

Thank you Microsoft. NIST agrees. Everyone who attacks password auth agrees. Can we get compliance to update their requirements.
https://t.co/8nZszqKUBC",原创,en,36,496,65,1609,2022-08-18 14:26:01,2024-04-10 20:15:17,1560271804438298624,14090906,WeldPond,0,[],,,
https://twitter.com/14090906/status/1724838194766909928,https://twitter.com/WeldPond,https://pbs.twimg.com/profile_images/1732479699748519937/5NQhmNOG_normal.jpg,,,Weld Pond | Chris Wysopal,Thrilled to be named a Cybersecurity Visionary by @CyberScoopNews! It's an honor to stand among such distinguished leaders and innovators in public sector cybersecurity. This award is a testament to our collective commitment to securing our digital world. https://t.co/hU2TOAkddu,原创,en,4,8,0,41,2023-11-15 17:14:06,2024-04-10 20:15:33,1724838194766909928,14090906,WeldPond,0,[],,['https://pbs.twimg.com/media/F-_bL6fbAAAm8aU.jpg'],
https://twitter.com/14090906/status/1559925515171102721,https://twitter.com/WeldPond,https://pbs.twimg.com/profile_images/1732479699748519937/5NQhmNOG_normal.jpg,,,Weld Pond | Chris Wysopal,A challenge I hear in software security is the tree vs the forest problem. It's one thing to work with one dev team to improve their secure dev process &amp; have them meet a policy before pushing to prod. It's another thing to manage the security of a fleet of apps across an org.,原创,en,3,5,1,19,2022-08-17 15:29:59,2024-04-10 20:15:33,1559925515171102721,14090906,WeldPond,0,[],,,
https://twitter.com/14090906/status/1559653934817574912,https://twitter.com/WeldPond,https://pbs.twimg.com/profile_images/1732479699748519937/5NQhmNOG_normal.jpg,,,Weld Pond | Chris Wysopal,"Product &amp; service providers, you are a node in your customers (or customers customers or customers customers customers...) attack tree.

Think of how you trust upstream data/code/services &amp; how your downstream customers trust your data/code/services

2022 very different than 1990 https://t.co/649TslLyfi",原创,en,0,2,0,3,2022-08-16 21:30:49,2024-04-10 20:15:33,1559653934817574912,14090906,WeldPond,0,[],,['https://pbs.twimg.com/media/FaT-WajWAAMod4e.png'],
https://twitter.com/14090906/status/1559520976437760000,https://twitter.com/WeldPond,https://pbs.twimg.com/profile_images/1732479699748519937/5NQhmNOG_normal.jpg,,,Weld Pond | Chris Wysopal,"Insecure product &amp; services are more expensive as companies pass cost of breach to customers.

""The report also suggests that more than half of the surveyed companies agreed that the costs of data breaches alter the pricing of their products &amp; services""
https://t.co/RtNZNO34Pp",原创,en,0,0,0,3,2022-08-16 12:42:29,2024-04-10 20:15:33,1559520976437760000,14090906,WeldPond,0,[],,,
https://twitter.com/14090906/status/1559518060939300864,https://twitter.com/WeldPond,https://pbs.twimg.com/profile_images/1732479699748519937/5NQhmNOG_normal.jpg,,,Weld Pond | Chris Wysopal,This attack highlights the risk of giving your authentication data to a 3rd party. https://t.co/DvRFkZMuCR,原创,en,0,2,0,2,2022-08-16 12:30:54,2024-04-10 20:15:33,1559518060939300864,14090906,WeldPond,0,[],,,
https://twitter.com/14090906/status/1559517325119954944,https://twitter.com/WeldPond,https://pbs.twimg.com/profile_images/1732479699748519937/5NQhmNOG_normal.jpg,,,Weld Pond | Chris Wysopal,Ransomware attackers go after water supply companies but say they don't want to disrupt the OT systems. How nice of them! https://t.co/9WtmLycUcD,原创,en,1,1,0,2,2022-08-16 12:27:59,2024-04-10 20:15:33,1559517325119954944,14090906,WeldPond,0,[],,,
https://twitter.com/14090906/status/1559513725450821632,https://twitter.com/WeldPond,https://pbs.twimg.com/profile_images/1732479699748519937/5NQhmNOG_normal.jpg,,,Weld Pond | Chris Wysopal,"“Since most RU kinetic operations focused on civilian infrastructure and cyber operations supportive of that are exactly the same type of thing, hitting civilian IT infrastructure. These cases we can treat them as war crimes in cyberspace.”#cyberwarcrime

https://t.co/UJBJQKmSpe",原创,en,1,3,1,4,2022-08-16 12:13:41,2024-04-10 20:15:33,1559513725450821632,14090906,WeldPond,0,[],,,
https://twitter.com/14090906/status/1558855410743857152,https://twitter.com/WeldPond,https://pbs.twimg.com/profile_images/1732479699748519937/5NQhmNOG_normal.jpg,,,Weld Pond | Chris Wysopal,Bye bye Vegas! The last thing I did was wait in massive crowds because some idiot made a gunshot sound at the airport this morning. Besides that I had a blast. Thanks #w00w00 for an amazing rooftop party! Here was the view. https://t.co/i8UqjQc641,原创,en,2,2,0,46,2022-08-14 16:37:46,2024-04-10 20:15:34,1558855410743857152,14090906,WeldPond,0,[],,['https://pbs.twimg.com/media/FaIqoZFUEAAK1cl.jpg'],
https://twitter.com/14090906/status/1724838194766909928,https://twitter.com/WeldPond,https://pbs.twimg.com/profile_images/1732479699748519937/5NQhmNOG_normal.jpg,,,Weld Pond | Chris Wysopal,Thrilled to be named a Cybersecurity Visionary by @CyberScoopNews! It's an honor to stand among such distinguished leaders and innovators in public sector cybersecurity. This award is a testament to our collective commitment to securing our digital world. https://t.co/hU2TOAkddu,原创,en,4,8,0,41,2023-11-15 17:14:06,2024-04-10 20:15:50,1724838194766909928,14090906,WeldPond,0,[],,['https://pbs.twimg.com/media/F-_bL6fbAAAm8aU.jpg'],
https://twitter.com/14090906/status/1558855410743857152,https://twitter.com/WeldPond,https://pbs.twimg.com/profile_images/1732479699748519937/5NQhmNOG_normal.jpg,,,Weld Pond | Chris Wysopal,Bye bye Vegas! The last thing I did was wait in massive crowds because some idiot made a gunshot sound at the airport this morning. Besides that I had a blast. Thanks #w00w00 for an amazing rooftop party! Here was the view. https://t.co/i8UqjQc641,原创,en,2,2,0,46,2022-08-14 16:37:46,2024-04-10 20:15:50,1558855410743857152,14090906,WeldPond,0,[],,['https://pbs.twimg.com/media/FaIqoZFUEAAK1cl.jpg'],
https://twitter.com/14090906/status/1558130615601356800,https://twitter.com/WeldPond,https://pbs.twimg.com/profile_images/1732479699748519937/5NQhmNOG_normal.jpg,,,Weld Pond | Chris Wysopal,"FEMA issued an advisory to broadcasters after learning the exploit may be demonstrated to a large audience at the DEF CON hacking conference in Las Vegas that runs Aug. 11-14, 2022. https://t.co/3UW4HWQHJD",原创,en,2,4,1,9,2022-08-12 16:37:42,2024-04-10 20:15:50,1558130615601356800,14090906,WeldPond,0,[],,,
https://twitter.com/14090906/status/1558226083421376512,https://twitter.com/WeldPond,https://pbs.twimg.com/profile_images/1732479699748519937/5NQhmNOG_normal.jpg,,,Weld Pond | Chris Wysopal,Time to charge the hacker noodle wrist badge. #defcon #badgelife https://t.co/MQTLTrG76A,原创,en,1,2,1,19,2022-08-12 22:57:03,2024-04-10 20:15:50,1558226083421376512,14090906,WeldPond,0,[],,['https://pbs.twimg.com/media/FZ_uW8zVsAESFUm.jpg'],
https://twitter.com/14090906/status/1557161858737528834,https://twitter.com/WeldPond,https://pbs.twimg.com/profile_images/1732479699748519937/5NQhmNOG_normal.jpg,,,Weld Pond | Chris Wysopal,"https://t.co/JdotMnge6q is fun. I don’t remember this 1999 article. 

“People are getting at a corporation’s information through the client [desktop],” said a hacker who identified himself as Weld Pond. “Windows 95 doesn’t even have a security model.” https://t.co/yqbUAHQDZ9",原创,en,1,1,0,14,2022-08-10 00:28:12,2024-04-10 20:15:50,1557161858737528834,14090906,WeldPond,0,[],,,
https://twitter.com/14090906/status/1724838194766909928,https://twitter.com/WeldPond,https://pbs.twimg.com/profile_images/1732479699748519937/5NQhmNOG_normal.jpg,,,Weld Pond | Chris Wysopal,Thrilled to be named a Cybersecurity Visionary by @CyberScoopNews! It's an honor to stand among such distinguished leaders and innovators in public sector cybersecurity. This award is a testament to our collective commitment to securing our digital world. https://t.co/hU2TOAkddu,原创,en,4,8,0,41,2023-11-15 17:14:06,2024-04-10 20:16:04,1724838194766909928,14090906,WeldPond,0,[],,['https://pbs.twimg.com/media/F-_bL6fbAAAm8aU.jpg'],
https://twitter.com/14090906/status/1557161858737528834,https://twitter.com/WeldPond,https://pbs.twimg.com/profile_images/1732479699748519937/5NQhmNOG_normal.jpg,,,Weld Pond | Chris Wysopal,"https://t.co/JdotMnge6q is fun. I don’t remember this 1999 article. 

“People are getting at a corporation’s information through the client [desktop],” said a hacker who identified himself as Weld Pond. “Windows 95 doesn’t even have a security model.” https://t.co/yqbUAHQDZ9",原创,en,1,1,0,14,2022-08-10 00:28:12,2024-04-10 20:16:04,1557161858737528834,14090906,WeldPond,0,[],,,
https://twitter.com/14090906/status/1557497527917617152,https://twitter.com/WeldPond,https://pbs.twimg.com/profile_images/1732479699748519937/5NQhmNOG_normal.jpg,,,Weld Pond | Chris Wysopal,You wanted a CyberNTSB? How about a cyber incident investigation handbook by @tarah &amp; Victoria Ontiveros https://t.co/JEUPVTRJbM https://t.co/m79ZB1bhlW,原创,en,2,6,0,22,2022-08-10 22:42:02,2024-04-10 20:16:04,1557497527917617152,14090906,WeldPond,0,[],,['https://pbs.twimg.com/media/FZ1XvttUIAATKrU.jpg'],
https://twitter.com/14090906/status/1557431582473875456,https://twitter.com/WeldPond,https://pbs.twimg.com/profile_images/1732479699748519937/5NQhmNOG_normal.jpg,,,Weld Pond | Chris Wysopal,It turns our there are at least 2 Wysopals in cybersecurity. I have a new friend from Poland. #blackhat https://t.co/9UQg1j0nFV,原创,en,6,1,1,66,2022-08-10 18:19:59,2024-04-10 20:16:04,1557431582473875456,14090906,WeldPond,0,[],,['https://pbs.twimg.com/media/FZ0bxH-UUAANiGo.jpg'],
https://twitter.com/14090906/status/1557057781668134915,https://twitter.com/WeldPond,https://pbs.twimg.com/profile_images/1732479699748519937/5NQhmNOG_normal.jpg,,,Weld Pond | Chris Wysopal,"On this eve of the 25th #blackhat briefings, I have good news. Developers are building more secure applications then they did 10 years ago. This tide is turning, finally! https://t.co/lOwP5QULAh",原创,en,0,3,0,5,2022-08-09 17:34:38,2024-04-10 20:16:04,1557057781668134915,14090906,WeldPond,0,[],,,
https://twitter.com/14090906/status/1555566296527413251,https://twitter.com/WeldPond,https://pbs.twimg.com/profile_images/1732479699748519937/5NQhmNOG_normal.jpg,,,Weld Pond | Chris Wysopal,If you have trade crypto you owe it to yourself to have an anti-phishing solution. #pixm https://t.co/lobwKlpjLk,原创,en,0,1,0,3,2022-08-05 14:48:00,2024-04-10 20:16:04,1555566296527413251,14090906,WeldPond,0,[],,,
https://twitter.com/14090906/status/1724838194766909928,https://twitter.com/WeldPond,https://pbs.twimg.com/profile_images/1732479699748519937/5NQhmNOG_normal.jpg,,,Weld Pond | Chris Wysopal,Thrilled to be named a Cybersecurity Visionary by @CyberScoopNews! It's an honor to stand among such distinguished leaders and innovators in public sector cybersecurity. This award is a testament to our collective commitment to securing our digital world. https://t.co/hU2TOAkddu,原创,en,4,8,0,41,2023-11-15 17:14:06,2024-04-10 20:16:20,1724838194766909928,14090906,WeldPond,0,[],,['https://pbs.twimg.com/media/F-_bL6fbAAAm8aU.jpg'],
https://twitter.com/14090906/status/1555238856429010944,https://twitter.com/WeldPond,https://pbs.twimg.com/profile_images/1732479699748519937/5NQhmNOG_normal.jpg,,,Weld Pond | Chris Wysopal,"I'm be participating in the DEF CON Policy Chaotic Gavel Battles on Friday, Aug 12th. Come see me debate @joshcorman @PDXbek Kathleen Noble and @__winn! It's debate club with much more cyberz. https://t.co/fukeh4q0Mi",原创,en,0,6,1,8,2022-08-04 17:06:52,2024-04-10 20:16:20,1555238856429010944,14090906,WeldPond,0,[],,['https://pbs.twimg.com/media/FZVQPCzWYAAryLB.jpg'],
https://twitter.com/14090906/status/1554860716976472066,https://twitter.com/WeldPond,https://pbs.twimg.com/profile_images/1732479699748519937/5NQhmNOG_normal.jpg,,,Weld Pond | Chris Wysopal,"If you find a security bug in an open source package there won't be a bounty payment, but finders could look for a crypto system that uses the the package to collect.",原创,en,3,2,0,14,2022-08-03 16:04:17,2024-04-10 20:16:20,1554860716976472066,14090906,WeldPond,0,[],,,
https://twitter.com/14090906/status/1555200429339951105,https://twitter.com/WeldPond,https://pbs.twimg.com/profile_images/1732479699748519937/5NQhmNOG_normal.jpg,,,Weld Pond | Chris Wysopal,@dogrosemk https://t.co/JRF1kH4Hj7,原创,qme,0,0,0,0,2022-08-04 14:34:11,2024-04-10 20:16:20,1555200429339951105,14090906,WeldPond,0,[],,,
https://twitter.com/14090906/status/1554817525686345729,https://twitter.com/WeldPond,https://pbs.twimg.com/profile_images/1732479699748519937/5NQhmNOG_normal.jpg,,,Weld Pond | Chris Wysopal,"Are you a developer and your mobile is app leaking API keys like this? https://t.co/p2neYgxEDQ

Veracode Labs has a free trial with a course on mobile app security for developers. It includes how to handle secrets securely.",原创,en,0,5,0,8,2022-08-03 13:12:39,2024-04-10 20:16:20,1554817525686345729,14090906,WeldPond,0,[],,,
https://twitter.com/14090906/status/1554560318700982275,https://twitter.com/WeldPond,https://pbs.twimg.com/profile_images/1732479699748519937/5NQhmNOG_normal.jpg,,,Weld Pond | Chris Wysopal,I started the day with supply chain and I am ending it with zero trust.,原创,en,4,0,0,17,2022-08-02 20:10:36,2024-04-10 20:16:20,1554560318700982275,14090906,WeldPond,0,[],,,
https://twitter.com/14090906/status/1554496010445111298,https://twitter.com/WeldPond,https://pbs.twimg.com/profile_images/1732479699748519937/5NQhmNOG_normal.jpg,,,Weld Pond | Chris Wysopal,"NETGEAR notifies BR200 AND BR500 owners, which are mostly SMBs, that their routers have ""forever day"" vulnerabilities and will need to be replaced.  https://t.co/G2wvvw1cqe",原创,en,0,3,0,3,2022-08-02 15:55:04,2024-04-10 20:16:20,1554496010445111298,14090906,WeldPond,0,[],,,
https://twitter.com/14090906/status/1554489333293383680,https://twitter.com/WeldPond,https://pbs.twimg.com/profile_images/1732479699748519937/5NQhmNOG_normal.jpg,,,Weld Pond | Chris Wysopal,"Biden nominates Nathaniel Fick as the 1st Cyber Ambassador at the State Department.
https://t.co/SBE7MVYkRZ",原创,en,0,2,2,6,2022-08-02 15:28:32,2024-04-10 20:16:20,1554489333293383680,14090906,WeldPond,0,[],,,
https://twitter.com/14090906/status/1554487652157739008,https://twitter.com/WeldPond,https://pbs.twimg.com/profile_images/1732479699748519937/5NQhmNOG_normal.jpg,,,Weld Pond | Chris Wysopal,"It turns out the malware was the good kind, only to be used on the bad guys. https://t.co/6LGAs804P2",原创,en,1,3,1,5,2022-08-02 15:21:51,2024-04-10 20:16:20,1554487652157739008,14090906,WeldPond,0,[],,,
https://twitter.com/14090906/status/1554475645232627712,https://twitter.com/WeldPond,https://pbs.twimg.com/profile_images/1732479699748519937/5NQhmNOG_normal.jpg,,,Weld Pond | Chris Wysopal,"My commentary for FCW: ""comprehensive security requires a “zero trust” approach, including code in the SW supply chain. Applying zero trust principles to the SW supply chain assumes that all SW: commercial, 3rd party or OSS, is guilty until proven innocent https://t.co/l7XiZ6xqcA",原创,en,1,1,0,5,2022-08-02 14:34:09,2024-04-10 20:16:20,1554475645232627712,14090906,WeldPond,0,[],,,
https://twitter.com/14090906/status/1554134644513247232,https://twitter.com/WeldPond,https://pbs.twimg.com/profile_images/1732479699748519937/5NQhmNOG_normal.jpg,,,Weld Pond | Chris Wysopal,"""Applying zero trust principles to the software supply chain assumes that all software – whether commercial, third-party, or open source – is guilty until proven innocent."" https://t.co/l7XiZ6xqcA",原创,en,0,3,0,16,2022-08-01 15:59:08,2024-04-10 20:16:20,1554134644513247232,14090906,WeldPond,0,[],,,
https://twitter.com/14090906/status/1724838194766909928,https://twitter.com/WeldPond,https://pbs.twimg.com/profile_images/1732479699748519937/5NQhmNOG_normal.jpg,,,Weld Pond | Chris Wysopal,Thrilled to be named a Cybersecurity Visionary by @CyberScoopNews! It's an honor to stand among such distinguished leaders and innovators in public sector cybersecurity. This award is a testament to our collective commitment to securing our digital world. https://t.co/hU2TOAkddu,原创,en,4,8,0,41,2023-11-15 17:14:06,2024-04-10 20:16:32,1724838194766909928,14090906,WeldPond,0,[],,['https://pbs.twimg.com/media/F-_bL6fbAAAm8aU.jpg'],
https://twitter.com/14090906/status/1553096045118296064,https://twitter.com/WeldPond,https://pbs.twimg.com/profile_images/1732479699748519937/5NQhmNOG_normal.jpg,,,Weld Pond | Chris Wysopal,"JavaScript objects are easily manipulated via static methods as demonstrated in this blog post. So, when is a case of object manipulation considered to be prototype pollution? Read this to find out. https://t.co/HnzraOD04B",原创,en,0,0,0,3,2022-07-29 19:12:06,2024-04-10 20:16:32,1553096045118296064,14090906,WeldPond,0,[],,,
https://twitter.com/14090906/status/1553016719110717441,https://twitter.com/WeldPond,https://pbs.twimg.com/profile_images/1732479699748519937/5NQhmNOG_normal.jpg,,,Weld Pond | Chris Wysopal,Office equipment IoT with hard coded bluetooth password. https://t.co/vw9ghQtmWC,原创,en,1,2,0,5,2022-07-29 13:56:54,2024-04-10 20:16:32,1553016719110717441,14090906,WeldPond,0,[],,,
https://twitter.com/14090906/status/1552743359747350529,https://twitter.com/WeldPond,https://pbs.twimg.com/profile_images/1732479699748519937/5NQhmNOG_normal.jpg,,,Weld Pond | Chris Wysopal,"Insightful article by former Veracoder, @colindomoney with some words from @JastrzebskiJ, Veracode manager of application security consulting. 

Security needs empathy for the developer. https://t.co/NrPkShi8Gy",原创,en,0,3,0,5,2022-07-28 19:50:40,2024-04-10 20:16:33,1552743359747350529,14090906,WeldPond,0,[],,,
https://twitter.com/14090906/status/1552696857587064833,https://twitter.com/WeldPond,https://pbs.twimg.com/profile_images/1732479699748519937/5NQhmNOG_normal.jpg,,,Weld Pond | Chris Wysopal,"All vulnerability information is dual use
https://t.co/3NNzMkCkGu",原创,en,0,5,2,9,2022-07-28 16:45:53,2024-04-10 20:16:33,1552696857587064833,14090906,WeldPond,0,[],,,
https://twitter.com/14090906/status/1724838194766909928,https://twitter.com/WeldPond,https://pbs.twimg.com/profile_images/1732479699748519937/5NQhmNOG_normal.jpg,,,Weld Pond | Chris Wysopal,Thrilled to be named a Cybersecurity Visionary by @CyberScoopNews! It's an honor to stand among such distinguished leaders and innovators in public sector cybersecurity. This award is a testament to our collective commitment to securing our digital world. https://t.co/hU2TOAkddu,原创,en,4,8,0,41,2023-11-15 17:14:06,2024-04-10 20:19:09,1724838194766909928,14090906,WeldPond,0,[],,['https://pbs.twimg.com/media/F-_bL6fbAAAm8aU.jpg'],
https://twitter.com/14090906/status/1552273997949198341,https://twitter.com/WeldPond,https://pbs.twimg.com/profile_images/1732479699748519937/5NQhmNOG_normal.jpg,,,Weld Pond | Chris Wysopal,"While experts like Guido adamantly advise that companies have other security processes baked into their development and review processes, external audits have become a crutch for an industry hobbled by a lack of blockchain security experts. https://t.co/umtNTV8hsO",原创,en,1,2,0,7,2022-07-27 12:45:35,2024-04-10 20:19:09,1552273997949198341,14090906,WeldPond,0,[],,,
https://twitter.com/14090906/status/1552273121947811840,https://twitter.com/WeldPond,https://pbs.twimg.com/profile_images/1732479699748519937/5NQhmNOG_normal.jpg,,,Weld Pond | Chris Wysopal,"She sent the attacker a URL. The URL, made to look like a porn site, actually collected the IP address of anyone who clicked it, using a website called Grabify IP Logger. The attacker didn't use a VPN. It turned out to be a crucial mistake. https://t.co/va3h7KJoen",原创,en,7,17,2,36,2022-07-27 12:42:06,2024-04-10 20:19:09,1552273121947811840,14090906,WeldPond,0,[],,,
https://twitter.com/14090906/status/1551948202257039366,https://twitter.com/WeldPond,https://pbs.twimg.com/profile_images/1732479699748519937/5NQhmNOG_normal.jpg,,,Weld Pond | Chris Wysopal,What was the very first cybersecurity task you remember doing?  For me it was turning off services in /etc/inetd.conf to harden a default Linux install.,原创,en,184,22,27,311,2022-07-26 15:10:59,2024-04-10 20:19:09,1551948202257039366,14090906,WeldPond,0,[],,,
https://twitter.com/14090906/status/1551932453534797826,https://twitter.com/WeldPond,https://pbs.twimg.com/profile_images/1732479699748519937/5NQhmNOG_normal.jpg,,,Weld Pond | Chris Wysopal,"AWS #reinforce keynote calls to action: Block public access, enable MFA. There is a lot of reinforcing the basics sprinkled in with new product announcements.",原创,en,1,0,0,2,2022-07-26 14:08:25,2024-04-10 20:19:09,1551932453534797826,14090906,WeldPond,0,[],,,
https://twitter.com/14090906/status/1551927744933629952,https://twitter.com/WeldPond,https://pbs.twimg.com/profile_images/1732479699748519937/5NQhmNOG_normal.jpg,,,Weld Pond | Chris Wysopal,This morning at #AWSreinforce @chriseng from @Veracode talked about trends in code remediation and microservices. https://t.co/353eHsatNi,原创,en,1,2,0,6,2022-07-26 13:49:42,2024-04-10 20:19:09,1551927744933629952,14090906,WeldPond,0,[],,"['https://pbs.twimg.com/media/FYmODoqXkAM2oCx.jpg', 'https://pbs.twimg.com/media/FYmODopXkAANaMA.jpg']",
https://twitter.com/14090906/status/1551925568412721155,https://twitter.com/WeldPond,https://pbs.twimg.com/profile_images/1732479699748519937/5NQhmNOG_normal.jpg,,,Weld Pond | Chris Wysopal,It was great to see @veracode highlighted as an AWS security competency partner during the #AWSreinforce keynote. Come to booth 311 and learn how you can secure your AWS cloud native apps with Veracode.,原创,en,0,0,0,2,2022-07-26 13:41:03,2024-04-10 20:19:09,1551925568412721155,14090906,WeldPond,0,[],,,
https://twitter.com/14090906/status/1551923713108545543,https://twitter.com/WeldPond,https://pbs.twimg.com/profile_images/1732479699748519937/5NQhmNOG_normal.jpg,,,Weld Pond | Chris Wysopal,AWS lessons from #log4j response at #awsreinforce https://t.co/n4dqOL94Kx,原创,en,0,4,0,6,2022-07-26 13:33:41,2024-04-10 20:19:09,1551923713108545543,14090906,WeldPond,0,[],,['https://pbs.twimg.com/media/FYmKY-5XgAEZMzl.jpg'],
https://twitter.com/14090906/status/1551918275814105088,https://twitter.com/WeldPond,https://pbs.twimg.com/profile_images/1732479699748519937/5NQhmNOG_normal.jpg,,,Weld Pond | Chris Wysopal,Excellent quote applied to #cybersecurity from #awsreinforce keynote. https://t.co/ovtILMiFeZ,原创,en,0,3,0,8,2022-07-26 13:12:04,2024-04-10 20:19:09,1551918275814105088,14090906,WeldPond,0,[],,['https://pbs.twimg.com/media/FYmFccYWQAEJ2_b.jpg'],
https://twitter.com/14090906/status/1551603223483531266,https://twitter.com/WeldPond,https://pbs.twimg.com/profile_images/1732479699748519937/5NQhmNOG_normal.jpg,,,Weld Pond | Chris Wysopal,Prosecutors said Sullivan arranged to pay hackers $100K in BTC &amp; have them sign nondisclosure agreements that falsely stated they had not stolen data. Uber had a bounty prgrm designed to reward researchers who report flaws but not to cover up data thefts https://t.co/2ArI7TSRnn,原创,en,2,4,1,9,2022-07-25 16:20:10,2024-04-10 20:19:09,1551603223483531266,14090906,WeldPond,0,[],,,
https://twitter.com/14090906/status/1724838194766909928,https://twitter.com/WeldPond,https://pbs.twimg.com/profile_images/1732479699748519937/5NQhmNOG_normal.jpg,,,Weld Pond | Chris Wysopal,Thrilled to be named a Cybersecurity Visionary by @CyberScoopNews! It's an honor to stand among such distinguished leaders and innovators in public sector cybersecurity. This award is a testament to our collective commitment to securing our digital world. https://t.co/hU2TOAkddu,原创,en,4,8,0,41,2023-11-15 17:14:06,2024-04-10 20:19:25,1724838194766909928,14090906,WeldPond,0,[],,['https://pbs.twimg.com/media/F-_bL6fbAAAm8aU.jpg'],
https://twitter.com/14090906/status/1550503548928000001,https://twitter.com/WeldPond,https://pbs.twimg.com/profile_images/1732479699748519937/5NQhmNOG_normal.jpg,,,Weld Pond | Chris Wysopal,The Federal Trade Commission expects companies to have “reasonable patching procedures in place” to identify and mitigate known vulnerabilities. https://t.co/zl12A49jgH,原创,en,0,0,1,2,2022-07-22 15:30:27,2024-04-10 20:19:25,1550503548928000001,14090906,WeldPond,0,[],,,
https://twitter.com/14090906/status/1550142937438162945,https://twitter.com/WeldPond,https://pbs.twimg.com/profile_images/1732479699748519937/5NQhmNOG_normal.jpg,,,Weld Pond | Chris Wysopal,It’s nice to see after 16 years you are still one of the coolest. “You” being Veracode. I’m not as cool. 😁 https://t.co/pok4QYy71C,原创,en,1,0,0,7,2022-07-21 15:37:31,2024-04-10 20:19:25,1550142937438162945,14090906,WeldPond,0,[],,,
