tweet_url,author_url,avatar_url,avatar_binary,topic,author_name,content,tweet_type,tweet_language,comment_count,retweet_count,quote_count,praise_count,publish_time,fetch_time,tweet_id,screen_id,screen_name,tourist_crawl_status,video_urls,original_author,tweet_img_url,tweet_img_binary
https://twitter.com/14090906/status/1724838194766909928,https://twitter.com/WeldPond,https://pbs.twimg.com/profile_images/1732479699748519937/5NQhmNOG_normal.jpg,,,Weld Pond | Chris Wysopal,Thrilled to be named a Cybersecurity Visionary by @CyberScoopNews! It's an honor to stand among such distinguished leaders and innovators in public sector cybersecurity. This award is a testament to our collective commitment to securing our digital world. https://t.co/hU2TOAkddu,原创,en,4,8,0,41,2023-11-15 17:14:06,2024-04-10 19:55:47,1724838194766909928,14090906,WeldPond,0,[],,['https://pbs.twimg.com/media/F-_bL6fbAAAm8aU.jpg'],
https://twitter.com/14090906/status/1635683779393081344,https://twitter.com/WeldPond,https://pbs.twimg.com/profile_images/1732479699748519937/5NQhmNOG_normal.jpg,,,Weld Pond | Chris Wysopal,"Which came 1st, the silent fix or the known exploited vulnerability? https://t.co/Mmv6wuQETA",原创,en,0,1,1,3,2023-03-14 16:46:17,2024-04-10 19:55:47,1635683779393081344,14090906,WeldPond,0,[],,,
https://twitter.com/14090906/status/1635683049307353102,https://twitter.com/WeldPond,https://pbs.twimg.com/profile_images/1732479699748519937/5NQhmNOG_normal.jpg,,,Weld Pond | Chris Wysopal,"Misconfiguration of the iFrame-resizer open-source library enabled the cross-site search vulnerability to exist, leading to the potential exposure of user identities https://t.co/XCpNRZAYph",原创,en,0,1,0,3,2023-03-14 16:43:23,2024-04-10 19:55:47,1635683049307353102,14090906,WeldPond,0,[],,,
https://twitter.com/14090906/status/1635682377694425092,https://twitter.com/WeldPond,https://pbs.twimg.com/profile_images/1732479699748519937/5NQhmNOG_normal.jpg,,,Weld Pond | Chris Wysopal,"The RVWP will see CISA assess flaws commonly associated with known ransomware exploitation

After finding these vulnerabilities, the Agency will warn critical infrastructure entities with the goal of enabling mitigation before a ransomware incident https://t.co/GsfW9IyFJ4",原创,en,0,0,0,0,2023-03-14 16:40:43,2024-04-10 19:55:47,1635682377694425092,14090906,WeldPond,0,[],,,
https://twitter.com/14090906/status/1635678165132607488,https://twitter.com/WeldPond,https://pbs.twimg.com/profile_images/1732479699748519937/5NQhmNOG_normal.jpg,,,Weld Pond | Chris Wysopal,"Ukraine would join a handful of other Western nations, led by Finland and Estonia, that have a full-scale reserve cyber force to augment their regular military https://t.co/3HBpv2XX05",原创,en,1,4,0,7,2023-03-14 16:23:58,2024-04-10 19:55:47,1635678165132607488,14090906,WeldPond,0,[],,,
https://twitter.com/14090906/status/1635675700488273920,https://twitter.com/WeldPond,https://pbs.twimg.com/profile_images/1732479699748519937/5NQhmNOG_normal.jpg,,,Weld Pond | Chris Wysopal,"$1M bounties not enough for crypto

""The vulnerable code was reviewed &amp; approved during an outside audit... The vuln remained on-chain for 8mo until it was exploited today, despite a $1m bug bounty being in place during that time” https://t.co/psXgi1Odzh",原创,en,0,4,1,4,2023-03-14 16:14:11,2024-04-10 19:55:47,1635675700488273920,14090906,WeldPond,0,[],,,
https://twitter.com/14090906/status/1635671047738458115,https://twitter.com/WeldPond,https://pbs.twimg.com/profile_images/1732479699748519937/5NQhmNOG_normal.jpg,,,Weld Pond | Chris Wysopal,"Much like Batman (no not really), I have returned to the Decipher Podcast to discuss the new National Cybersecurity Strategy with @DennisF

We talk about software vendor liability and the concept of a safe harbor for orgs building security in. https://t.co/fwhEHQSXNO",原创,en,1,1,0,3,2023-03-14 15:55:41,2024-04-10 19:55:47,1635671047738458115,14090906,WeldPond,0,[],,,
https://twitter.com/14090906/status/1635047352200495105,https://twitter.com/WeldPond,https://pbs.twimg.com/profile_images/1732479699748519937/5NQhmNOG_normal.jpg,,,Weld Pond | Chris Wysopal,"“Secretary Yellen approved actions enabling the FDIC to complete its resolution of Silicon Valley Bank, Santa Clara, California, in a manner that fully protects all depositors. Depositors will have access to all of their money starting Monday, March 13” https://t.co/xHDOUoFN95",原创,en,3,5,1,12,2023-03-12 22:37:21,2024-04-10 19:55:47,1635047352200495105,14090906,WeldPond,0,[],,,
https://twitter.com/14090906/status/1632813224914477061,https://twitter.com/WeldPond,https://pbs.twimg.com/profile_images/1732479699748519937/5NQhmNOG_normal.jpg,,,Weld Pond | Chris Wysopal,"NVD rescores the CVSS scores that open source projects like Curl release with their CVEs
https://t.co/lrCw6LWTYy",原创,en,1,1,0,2,2023-03-06 18:39:43,2024-04-10 19:55:47,1632813224914477061,14090906,WeldPond,0,[],,,
https://twitter.com/14090906/status/1632796559485091842,https://twitter.com/WeldPond,https://pbs.twimg.com/profile_images/1732479699748519937/5NQhmNOG_normal.jpg,,,Weld Pond | Chris Wysopal,The first Twitter/Tesla integration is with fart mode https://t.co/Xedn42myVG,原创,en,2,0,0,5,2023-03-06 17:33:30,2024-04-10 19:55:47,1632796559485091842,14090906,WeldPond,0,[],,['https://pbs.twimg.com/media/FqjberNXwAIIoV3.jpg'],
https://twitter.com/14090906/status/1632741662752489472,https://twitter.com/WeldPond,https://pbs.twimg.com/profile_images/1732479699748519937/5NQhmNOG_normal.jpg,,,Weld Pond | Chris Wysopal,"Atlantic Council had a group of experts mark up the new 2023 US National Cybersecurity Strategy. The group included: Maia Hamin, Trey Herr, Danielle Jablanski, @webjedi @loomisoncyber @thedarktangent @likethecoins @marcwrogers   Stewart Scott &amp; @WeldPond 

https://t.co/tVKl6d6Afx",原创,en,0,4,2,9,2023-03-06 13:55:21,2024-04-10 19:55:47,1632741662752489472,14090906,WeldPond,0,[],,,
https://twitter.com/14090906/status/1632502145923653633,https://twitter.com/WeldPond,https://pbs.twimg.com/profile_images/1732479699748519937/5NQhmNOG_normal.jpg,,,Weld Pond | Chris Wysopal,Alternatives for these services are available if data privacy is important to you.  https://t.co/XTuN6NNQwt,原创,en,0,2,0,2,2023-03-05 22:03:36,2024-04-10 19:55:47,1632502145923653633,14090906,WeldPond,0,[],,,
https://twitter.com/14090906/status/1631649443391983617,https://twitter.com/WeldPond,https://pbs.twimg.com/profile_images/1732479699748519937/5NQhmNOG_normal.jpg,,,Weld Pond | Chris Wysopal,"US Cybersecurity Strategy Shifts Liability Issues to Vendors. Holding Vendors Liable for Insecure Apps Fuels Safe Harbor, Transparency Questions https://t.co/2NPt4mxDRN",原创,en,1,0,1,6,2023-03-03 13:35:16,2024-04-10 19:55:47,1631649443391983617,14090906,WeldPond,0,[],,,
https://twitter.com/14090906/status/1724838194766909928,https://twitter.com/WeldPond,https://pbs.twimg.com/profile_images/1732479699748519937/5NQhmNOG_normal.jpg,,,Weld Pond | Chris Wysopal,Thrilled to be named a Cybersecurity Visionary by @CyberScoopNews! It's an honor to stand among such distinguished leaders and innovators in public sector cybersecurity. This award is a testament to our collective commitment to securing our digital world. https://t.co/hU2TOAkddu,原创,en,4,8,0,41,2023-11-15 17:14:06,2024-04-10 19:59:30,1724838194766909928,14090906,WeldPond,0,[],,['https://pbs.twimg.com/media/F-_bL6fbAAAm8aU.jpg'],
https://twitter.com/14090906/status/1631649443391983617,https://twitter.com/WeldPond,https://pbs.twimg.com/profile_images/1732479699748519937/5NQhmNOG_normal.jpg,,,Weld Pond | Chris Wysopal,"US Cybersecurity Strategy Shifts Liability Issues to Vendors. Holding Vendors Liable for Insecure Apps Fuels Safe Harbor, Transparency Questions https://t.co/2NPt4mxDRN",原创,en,1,0,1,6,2023-03-03 13:35:16,2024-04-10 19:59:30,1631649443391983617,14090906,WeldPond,0,[],,,
https://twitter.com/14090906/status/1631720700217106434,https://twitter.com/WeldPond,https://pbs.twimg.com/profile_images/1732479699748519937/5NQhmNOG_normal.jpg,,,Weld Pond | Chris Wysopal,"94% of CISOs reported being stressed at work, with 65% confiding that work-stress levels compromised their ability to protect their organizations https://t.co/UNgyx1xEFY",原创,en,1,0,0,2,2023-03-03 18:18:25,2024-04-10 19:59:30,1631720700217106434,14090906,WeldPond,0,[],,,
https://twitter.com/14090906/status/1631297495639678978,https://twitter.com/WeldPond,https://pbs.twimg.com/profile_images/1732479699748519937/5NQhmNOG_normal.jpg,,,Weld Pond | Chris Wysopal,"The National Cybersecurity Strategy includes the concept of:

""Shifting liability for software products and services to promote secure development practices""

This is a big deal.",原创,en,6,13,4,43,2023-03-02 14:16:45,2024-04-10 19:59:30,1631297495639678978,14090906,WeldPond,0,[],,,
https://twitter.com/14090906/status/1631374733508857856,https://twitter.com/WeldPond,https://pbs.twimg.com/profile_images/1732479699748519937/5NQhmNOG_normal.jpg,,,Weld Pond | Chris Wysopal,"“Surely vendors who aren’t doing anything need to be liable, but it makes sense for there to be a safe harbor for those who do due diligence. So the question remains: what qualifies a safe harbor? Vendors need a concrete list of activities &amp; features” https://t.co/ujcQq20pUx",原创,en,2,2,0,3,2023-03-02 19:23:40,2024-04-10 19:59:30,1631374733508857856,14090906,WeldPond,0,[],,,
https://twitter.com/14090906/status/1631369016961818659,https://twitter.com/WeldPond,https://pbs.twimg.com/profile_images/1732479699748519937/5NQhmNOG_normal.jpg,,,Weld Pond | Chris Wysopal,"a discussion on the Strategy with remarks from Acting National Cyber Director @KembaWalden46 and Deputy Assistant to the President and Deputy National Security Advisor for Cyber and Emerging Technology Anne Neuberger.
https://t.co/1H8i7A3ogt",原创,en,0,0,0,1,2023-03-02 19:00:57,2024-04-10 19:59:30,1631369016961818659,14090906,WeldPond,0,[],,,
https://twitter.com/14090906/status/1631341053432274951,https://twitter.com/WeldPond,https://pbs.twimg.com/profile_images/1732479699748519937/5NQhmNOG_normal.jpg,,,Weld Pond | Chris Wysopal,I just read IoC as Infrastructure as Code and got thoroughly confused.  I've been looking at more cloud native code than threat reports lately.,原创,en,1,0,0,6,2023-03-02 17:09:50,2024-04-10 19:59:30,1631341053432274951,14090906,WeldPond,0,[],,,
https://twitter.com/14090906/status/1631336843118616578,https://twitter.com/WeldPond,https://pbs.twimg.com/profile_images/1732479699748519937/5NQhmNOG_normal.jpg,,,Weld Pond | Chris Wysopal,"Government’s Role in Increasing Software Supply Chain Security: A Toolbox for Policy Makers is published today. 

It was my pleasure to participate in the workshop which helped advise this publication.

https://t.co/A46n4WX8Tn https://t.co/vWmSGYmtnx",原创,en,0,4,1,13,2023-03-02 16:53:06,2024-04-10 19:59:30,1631336843118616578,14090906,WeldPond,0,[],,['https://pbs.twimg.com/media/FqOrUWaWYAEc7OH.png'],
https://twitter.com/14090906/status/1631280321135083521,https://twitter.com/WeldPond,https://pbs.twimg.com/profile_images/1732479699748519937/5NQhmNOG_normal.jpg,,,Weld Pond | Chris Wysopal,FACT SHEET: Biden-⁠Harris Administration Announces National Cybersecurity Strategy  https://t.co/zTGTCKwO96,原创,en,0,0,0,4,2023-03-02 13:08:30,2024-04-10 19:59:30,1631280321135083521,14090906,WeldPond,0,[],,,
https://twitter.com/14090906/status/1724838194766909928,https://twitter.com/WeldPond,https://pbs.twimg.com/profile_images/1732479699748519937/5NQhmNOG_normal.jpg,,,Weld Pond | Chris Wysopal,Thrilled to be named a Cybersecurity Visionary by @CyberScoopNews! It's an honor to stand among such distinguished leaders and innovators in public sector cybersecurity. This award is a testament to our collective commitment to securing our digital world. https://t.co/hU2TOAkddu,原创,en,4,8,0,41,2023-11-15 17:14:06,2024-04-10 20:02:10,1724838194766909928,14090906,WeldPond,0,[],,['https://pbs.twimg.com/media/F-_bL6fbAAAm8aU.jpg'],
https://twitter.com/14090906/status/1630985529465470985,https://twitter.com/WeldPond,https://pbs.twimg.com/profile_images/1732479699748519937/5NQhmNOG_normal.jpg,,,Weld Pond | Chris Wysopal,"On March 2nd the Biden-Harris Administration will be releasing its National Cybersecurity Strategy, defining the government’s approach to cybersecurity. 

I'll be tuning in! 
https://t.co/X3Gk6CUJpS",原创,en,0,5,0,10,2023-03-01 17:37:07,2024-04-10 20:02:10,1630985529465470985,14090906,WeldPond,0,[],,,
https://twitter.com/14090906/status/1630666857240731659,https://twitter.com/WeldPond,https://pbs.twimg.com/profile_images/1732479699748519937/5NQhmNOG_normal.jpg,,,Weld Pond | Chris Wysopal,"In his article ""Make companies liable for software insecurity, top cybersecurity official says"" (https://t.co/iTQvlYaXUW), @timstarks quotes me on software liability. 

@JenEasterly addresses some of my concerns with the idea of a safe harbor, a concept that's worth exploring. https://t.co/LGHddNOvyr",原创,en,4,8,1,16,2023-02-28 20:30:49,2024-04-10 20:02:10,1630666857240731659,14090906,WeldPond,0,[],,['https://pbs.twimg.com/media/FqFJJhZXwAAl-DJ.png'],
https://twitter.com/14090906/status/1630495427865788418,https://twitter.com/WeldPond,https://pbs.twimg.com/profile_images/1732479699748519937/5NQhmNOG_normal.jpg,,,Weld Pond | Chris Wysopal,"“by targeting the DevOps engineer’s home computer and exploiting a vulnerable third-party media software package, which enabled remote code exec”
I wonder what security controls were on that computer.  https://t.co/Gzv8k3kfMS",原创,en,3,16,1,19,2023-02-28 09:09:37,2024-04-10 20:02:10,1630495427865788418,14090906,WeldPond,0,[],,,
https://twitter.com/14090906/status/1628746268494163968,https://twitter.com/WeldPond,https://pbs.twimg.com/profile_images/1732479699748519937/5NQhmNOG_normal.jpg,,,Weld Pond | Chris Wysopal,“any robust discussion of Zero Trust must include approaches for finding and remediating those application security flaws and preventing new flaws from being introduced and secure DevOps (DevSecOps) is the way we do it.” https://t.co/6o8SDHce4X,原创,en,0,3,1,6,2023-02-23 13:19:05,2024-04-10 20:02:10,1628746268494163968,14090906,WeldPond,0,[],,,
https://twitter.com/14090906/status/1628508728323448846,https://twitter.com/WeldPond,https://pbs.twimg.com/profile_images/1732479699748519937/5NQhmNOG_normal.jpg,,,Weld Pond | Chris Wysopal,Perhaps we are time travelers and don’t know it.,原创,en,5,0,0,8,2023-02-22 21:35:11,2024-04-10 20:02:10,1628508728323448846,14090906,WeldPond,0,[],,,
https://twitter.com/14090906/status/1628492326199762944,https://twitter.com/WeldPond,https://pbs.twimg.com/profile_images/1732479699748519937/5NQhmNOG_normal.jpg,,,Weld Pond | Chris Wysopal,TIL some tap rooms will make pint crowlers. Wonderful beer from Taphouse in Copenhagen from Fermenterana. https://t.co/fl69tdjHv6,原创,en,1,2,0,8,2023-02-22 20:30:01,2024-04-10 20:02:10,1628492326199762944,14090906,WeldPond,0,[],,['https://pbs.twimg.com/media/FpmRH6XXoAEeqbC.jpg'],
https://twitter.com/14090906/status/1724838194766909928,https://twitter.com/WeldPond,https://pbs.twimg.com/profile_images/1732479699748519937/5NQhmNOG_normal.jpg,,,Weld Pond | Chris Wysopal,Thrilled to be named a Cybersecurity Visionary by @CyberScoopNews! It's an honor to stand among such distinguished leaders and innovators in public sector cybersecurity. This award is a testament to our collective commitment to securing our digital world. https://t.co/hU2TOAkddu,原创,en,4,8,0,41,2023-11-15 17:14:06,2024-04-10 20:02:24,1724838194766909928,14090906,WeldPond,0,[],,['https://pbs.twimg.com/media/F-_bL6fbAAAm8aU.jpg'],
https://twitter.com/14090906/status/1628316873753329665,https://twitter.com/WeldPond,https://pbs.twimg.com/profile_images/1732479699748519937/5NQhmNOG_normal.jpg,,,Weld Pond | Chris Wysopal,"One hacker group called Conti even laid off 45 call-center operators last year who were working as part of an apparent scheme to spread ransomware attacks after the call centers failed to make money,  https://t.co/A9DKyZSvj7",原创,en,1,31,10,55,2023-02-22 08:52:50,2024-04-10 20:02:24,1628316873753329665,14090906,WeldPond,0,[],,,
https://twitter.com/14090906/status/1626685134484168706,https://twitter.com/WeldPond,https://pbs.twimg.com/profile_images/1732479699748519937/5NQhmNOG_normal.jpg,,,Weld Pond | Chris Wysopal,NY FBI Field office suffers a breach. 2 sources briefed on the matter said that the incident involved an FBI computer system used in investigations of images of child sexual exploitation. They say it is an isolated incident and has been contained. https://t.co/0B4YSvmV5a,原创,en,0,0,0,0,2023-02-17 20:48:53,2024-04-10 20:02:24,1626685134484168706,14090906,WeldPond,0,[],,,
https://twitter.com/14090906/status/1626583809692172290,https://twitter.com/WeldPond,https://pbs.twimg.com/profile_images/1732479699748519937/5NQhmNOG_normal.jpg,,,Weld Pond | Chris Wysopal,"Its great to see tech vendors like Google embracing ""secure by design."" 25y ago @L0phtHeavyInd  called on vendors to secure their products during the dev process &amp; not after the fact, which shifts cost/risk to their customers. You can read a book about it https://t.co/h4vex4O5Sw",原创,en,2,7,0,23,2023-02-17 14:06:15,2024-04-10 20:02:24,1626583809692172290,14090906,WeldPond,0,[],,,
https://twitter.com/14090906/status/1626585728804352005,https://twitter.com/WeldPond,https://pbs.twimg.com/profile_images/1732479699748519937/5NQhmNOG_normal.jpg,,,Weld Pond | Chris Wysopal,"Unless you are authorized, please don't do this at home. This is an example of how inexpensive programmable hardware is upending the lack of security in many hardware devices that receive and transmit.  https://t.co/eiND2F1pke",原创,en,20,35,1,175,2023-02-17 14:13:52,2024-04-10 20:02:24,1626585728804352005,14090906,WeldPond,0,[],,,
https://twitter.com/14090906/status/1626269761448423429,https://twitter.com/WeldPond,https://pbs.twimg.com/profile_images/1732479699748519937/5NQhmNOG_normal.jpg,,,Weld Pond | Chris Wysopal,Thistle Technologies today is making generally available a new platform that aims to help IoT manufacturers securely deploy updates and implement capabilities for secure communications and memory management into their devices. https://t.co/HEjTndYOgs,原创,en,1,3,0,11,2023-02-16 17:18:20,2024-04-10 20:02:24,1626269761448423429,14090906,WeldPond,0,[],,,
https://twitter.com/14090906/status/1626248036841291777,https://twitter.com/WeldPond,https://pbs.twimg.com/profile_images/1732479699748519937/5NQhmNOG_normal.jpg,,,Weld Pond | Chris Wysopal,"Hot wiring in the digital era.                              Thieves typically break a back window to avoid alarms, expose the steering column, and fit a USB-A cable into a matching plug. Turning the plug with an inserted cable starts the car.  https://t.co/WVvi51ly0w",原创,en,3,9,0,23,2023-02-16 15:52:00,2024-04-10 20:02:24,1626248036841291777,14090906,WeldPond,0,[],,,
https://twitter.com/14090906/status/1625966136243224594,https://twitter.com/WeldPond,https://pbs.twimg.com/profile_images/1732479699748519937/5NQhmNOG_normal.jpg,,,Weld Pond | Chris Wysopal,"Ethical hackers can hack Belgian Companies. ""Until today, we always needed permission from a company. The had to explicitly ask us to test the security of their systems."" As of today, this is no longer necessary, although there are a number of conditions https://t.co/CaVCJ6Xlyp",原创,en,1,2,0,5,2023-02-15 21:11:50,2024-04-10 20:02:24,1625966136243224594,14090906,WeldPond,0,[],,,
https://twitter.com/14090906/status/1625415858909585408,https://twitter.com/WeldPond,https://pbs.twimg.com/profile_images/1732479699748519937/5NQhmNOG_normal.jpg,,,Weld Pond | Chris Wysopal,Crypto wallets age like milk.  https://t.co/q6a4Fcoum6,原创,en,2,0,1,4,2023-02-14 08:45:14,2024-04-10 20:02:24,1625415858909585408,14090906,WeldPond,0,[],,,
https://twitter.com/14090906/status/1625232836155285517,https://twitter.com/WeldPond,https://pbs.twimg.com/profile_images/1732479699748519937/5NQhmNOG_normal.jpg,,,Weld Pond | Chris Wysopal,"“there’s a growing cottage industry of wallet recovery services, a breed of crypto dark-arts practitioners to help recover lost funds.” https://t.co/Im29Kt73ye",原创,en,0,0,0,4,2023-02-13 20:37:58,2024-04-10 20:02:24,1625232836155285517,14090906,WeldPond,0,[],,,
https://twitter.com/14090906/status/1724838194766909928,https://twitter.com/WeldPond,https://pbs.twimg.com/profile_images/1732479699748519937/5NQhmNOG_normal.jpg,,,Weld Pond | Chris Wysopal,Thrilled to be named a Cybersecurity Visionary by @CyberScoopNews! It's an honor to stand among such distinguished leaders and innovators in public sector cybersecurity. This award is a testament to our collective commitment to securing our digital world. https://t.co/hU2TOAkddu,原创,en,4,8,0,41,2023-11-15 17:14:06,2024-04-10 20:02:41,1724838194766909928,14090906,WeldPond,0,[],,['https://pbs.twimg.com/media/F-_bL6fbAAAm8aU.jpg'],
https://twitter.com/14090906/status/1624190595794100224,https://twitter.com/WeldPond,https://pbs.twimg.com/profile_images/1732479699748519937/5NQhmNOG_normal.jpg,,,Weld Pond | Chris Wysopal,"“We would like to take this opportunity to address, clarify and respond to some of the arguments made about OneKey” https://t.co/m8AJAuLW2x",原创,en,0,0,0,2,2023-02-10 23:36:28,2024-04-10 20:02:41,1624190595794100224,14090906,WeldPond,0,[],,,
https://twitter.com/14090906/status/1624044161929252871,https://twitter.com/WeldPond,https://pbs.twimg.com/profile_images/1732479699748519937/5NQhmNOG_normal.jpg,,,Weld Pond | Chris Wysopal,"Putting your company’s code into ChatGPT is leaking it. 

""This is important because your inputs may be used as training data for a further iteration of ChatGPT,"" https://t.co/SYMax9QFtp",原创,en,7,40,5,91,2023-02-10 13:54:36,2024-04-10 20:02:41,1624044161929252871,14090906,WeldPond,0,[],,,
https://twitter.com/14090906/status/1623403514570620928,https://twitter.com/WeldPond,https://pbs.twimg.com/profile_images/1732479699748519937/5NQhmNOG_normal.jpg,,,Weld Pond | Chris Wysopal,"I'm looking forward to testifying today to the Oregon State Legislature's Joint Committee On Information Management and Technology on the subject of application security. 

Software that is purchased or built must be ""secure by design"" https://t.co/cCNYHtr1V0",原创,en,0,2,0,14,2023-02-08 19:28:53,2024-04-10 20:02:41,1623403514570620928,14090906,WeldPond,0,[],,,
https://twitter.com/14090906/status/1623014326373126161,https://twitter.com/WeldPond,https://pbs.twimg.com/profile_images/1732479699748519937/5NQhmNOG_normal.jpg,,,Weld Pond | Chris Wysopal,"New Executive Order to drop after SOTU. Finally! MFA for users interacting with federal government accounts. 

""The Digital Theft EO is a directive that seeks to introduce new measures to prevent and detect identity theft involving public benefits"" https://t.co/4lI25R8elz",原创,en,0,2,0,4,2023-02-07 17:42:24,2024-04-10 20:02:41,1623014326373126161,14090906,WeldPond,0,[],,,
https://twitter.com/14090906/status/1622978157627179012,https://twitter.com/WeldPond,https://pbs.twimg.com/profile_images/1732479699748519937/5NQhmNOG_normal.jpg,,,Weld Pond | Chris Wysopal,"""Count Zero told us that the hat biz was failing, that Mary &amp; Alicia were moving their stuff out. That’s when he asked Kingpin, Weld &amp; me a question that would change our lives forever: Would we be interested in renting space with them there at the loft?"" https://t.co/uzEU6HhxHu",原创,en,1,5,1,31,2023-02-07 15:18:40,2024-04-10 20:02:41,1622978157627179012,14090906,WeldPond,0,[],,,
https://twitter.com/14090906/status/1622928513887088644,https://twitter.com/WeldPond,https://pbs.twimg.com/profile_images/1732479699748519937/5NQhmNOG_normal.jpg,,,Weld Pond | Chris Wysopal,"Cyber incidents are costly for manufacturers. 
“some of its IT systems were irrecoverable, and it had been forced to revert to manual transaction processes at a number of sites. The total cost of dealing with the incident could be as much as £12M” https://t.co/AwZWR1irv7",原创,en,1,3,0,3,2023-02-07 12:01:24,2024-04-10 20:02:41,1622928513887088644,14090906,WeldPond,0,[],,,
https://twitter.com/14090906/status/1622927050561421313,https://twitter.com/WeldPond,https://pbs.twimg.com/profile_images/1732479699748519937/5NQhmNOG_normal.jpg,,,Weld Pond | Chris Wysopal,"We need an engine check light for critical server maintenance. if these were cars the would be broken down on the side of the road. Patches for the vulnerability ""were made available to customers 2 yrs ago in VMware's security advisory of Feb 23, 2021"" https://t.co/pvd5CPgX2M",原创,en,1,0,0,2,2023-02-07 11:55:36,2024-04-10 20:02:41,1622927050561421313,14090906,WeldPond,0,[],,,
https://twitter.com/14090906/status/1622925525286002689,https://twitter.com/WeldPond,https://pbs.twimg.com/profile_images/1732479699748519937/5NQhmNOG_normal.jpg,,,Weld Pond | Chris Wysopal,"New book. A Hacker’s Mind: How the Powerful Bend Society’s Rules, and How to Bend them Back https://t.co/Fotq2Dv1Eg",原创,en,0,0,0,3,2023-02-07 11:49:32,2024-04-10 20:02:41,1622925525286002689,14090906,WeldPond,0,[],,,
https://twitter.com/14090906/status/1724838194766909928,https://twitter.com/WeldPond,https://pbs.twimg.com/profile_images/1732479699748519937/5NQhmNOG_normal.jpg,,,Weld Pond | Chris Wysopal,Thrilled to be named a Cybersecurity Visionary by @CyberScoopNews! It's an honor to stand among such distinguished leaders and innovators in public sector cybersecurity. This award is a testament to our collective commitment to securing our digital world. https://t.co/hU2TOAkddu,原创,en,4,8,0,41,2023-11-15 17:14:06,2024-04-10 20:02:56,1724838194766909928,14090906,WeldPond,0,[],,['https://pbs.twimg.com/media/F-_bL6fbAAAm8aU.jpg'],
