tweet_url,author_url,avatar_url,avatar_binary,topic,author_name,content,tweet_type,tweet_language,comment_count,retweet_count,quote_count,praise_count,publish_time,fetch_time,tweet_id,screen_id,screen_name,tourist_crawl_status,video_urls,original_author,tweet_img_url,tweet_img_binary
https://twitter.com/1134334789/status/1776345485558653057,https://twitter.com/KonstantHacker,https://pbs.twimg.com/profile_images/1337469588720799749/aEOmnHTF_normal.jpg,,,Konstantinos Karagiannis,NY's new Barbenheimer is having an earthquake on a Friday and an eclipse on a Monday. I want a commemorative shirt.,原创,en,3,1,0,2,2024-04-05 20:25:41,2024-04-11 11:33:22,1776345485558653057,1134334789,KonstantHacker,0,[],,,
https://twitter.com/1134334789/status/1776344945076416623,https://twitter.com/KonstantHacker,https://pbs.twimg.com/profile_images/1337469588720799749/aEOmnHTF_normal.jpg,,,Konstantinos Karagiannis,30 physical qubits were used to make 4 logical qubits. That's an amazing 7.5:1 ratio. This comes months after QuEra and Harvard's 48 logical qubits. Quantum computing is having a good year so far. https://t.co/TbFNMSZvWc,原创,en,0,2,0,4,2024-04-05 20:23:32,2024-04-11 11:33:22,1776344945076416623,1134334789,KonstantHacker,0,[],,,
https://twitter.com/1134334789/status/1776267920990982374,https://twitter.com/KonstantHacker,https://pbs.twimg.com/profile_images/1337469588720799749/aEOmnHTF_normal.jpg,,,Konstantinos Karagiannis,"We've known about large earthquakes causing smaller ones for quite some time. I half joked this week that after Taiwan NYC would have one by Friday, so my phone is blowing up. #earthquake #epicenter https://t.co/PjDy2lCOHW",原创,en,2,2,0,6,2024-04-05 15:17:28,2024-04-11 11:33:22,1776267920990982374,1134334789,KonstantHacker,0,[],,,
https://twitter.com/1134334789/status/1767907370888237297,https://twitter.com/KonstantHacker,https://pbs.twimg.com/profile_images/1337469588720799749/aEOmnHTF_normal.jpg,,,Konstantinos Karagiannis,"Nothing ground breaking, but a good intro to post quantum cryptography. Note the hybrid approach. Google will release further installments, so we'll see how it evolves. https://t.co/KDvNixheCi",原创,en,0,0,0,0,2024-03-13 13:35:38,2024-04-11 11:33:22,1767907370888237297,1134334789,KonstantHacker,0,[],,,
https://twitter.com/1134334789/status/1767555746063896660,https://twitter.com/KonstantHacker,https://pbs.twimg.com/profile_images/1337469588720799749/aEOmnHTF_normal.jpg,,,Konstantinos Karagiannis,"I just got invited to buy a spot in ""The 10 Visionaries Defining the Future of Quantum Technology in 2024"" for only $3000.

No thanks. Looking forward to seeing who makes the cut (check out to the company).",原创,en,2,0,0,2,2024-03-12 14:18:24,2024-04-11 11:33:22,1767555746063896660,1134334789,KonstantHacker,0,[],,,
https://twitter.com/1134334789/status/1767205140161769675,https://twitter.com/KonstantHacker,https://pbs.twimg.com/profile_images/1337469588720799749/aEOmnHTF_normal.jpg,,,Konstantinos Karagiannis,"Ethereum has been thinking of going post quantum crypto for a while now. Good start here. Would like to see BTC take this seriously, too! https://t.co/bNsQpR0VZ3",原创,en,4,6,1,11,2024-03-11 15:05:13,2024-04-11 11:33:23,1767205140161769675,1134334789,KonstantHacker,0,[],,,
https://twitter.com/1134334789/status/1744360450932748372,https://twitter.com/KonstantHacker,https://pbs.twimg.com/profile_images/1337469588720799749/aEOmnHTF_normal.jpg,,,Konstantinos Karagiannis,Quantum computing folks watch Satoshi Nakanoto's wallet as a canary. BTC going out means trouble. But someone just added $1 million?! https://t.co/AWjJAbGhyC,原创,en,0,0,2,7,2024-01-08 14:08:34,2024-04-11 11:33:40,1744360450932748372,1134334789,KonstantHacker,0,[],,,
https://twitter.com/1134334789/status/1735058530112008664,https://twitter.com/KonstantHacker,https://pbs.twimg.com/profile_images/1337469588720799749/aEOmnHTF_normal.jpg,,,Konstantinos Karagiannis,"I'm sure this quantum computer is modest, but who wouldn't want one under their tree? https://t.co/LXTyxgXf5i",原创,en,0,1,0,1,2023-12-13 22:06:04,2024-04-11 11:33:40,1735058530112008664,1134334789,KonstantHacker,0,[],,,
https://twitter.com/1134334789/status/1727491880064032957,https://twitter.com/KonstantHacker,https://pbs.twimg.com/profile_images/1337469588720799749/aEOmnHTF_normal.jpg,,,Konstantinos Karagiannis,"Imagine if the Sam Altman ouster was because of AGI being achieved at OpenAI. Read about the alleged ""Q"" intelligence... https://t.co/FuDHvquWxN",原创,en,0,0,0,1,2023-11-23 00:58:54,2024-04-11 11:33:40,1727491880064032957,1134334789,KonstantHacker,0,[],,,
https://twitter.com/1134334789/status/1704587892490707431,https://twitter.com/KonstantHacker,https://pbs.twimg.com/profile_images/1337469588720799749/aEOmnHTF_normal.jpg,,,Konstantinos Karagiannis,Signal is adding hybrid post-quantum cryptography #QuantumComputing https://t.co/ASdBuHvmuD,原创,en,0,7,0,15,2023-09-20 20:06:37,2024-04-11 11:33:40,1704587892490707431,1134334789,KonstantHacker,0,[],,,
https://twitter.com/1134334789/status/1699821928368816502,https://twitter.com/KonstantHacker,https://pbs.twimg.com/profile_images/1337469588720799749/aEOmnHTF_normal.jpg,,,Konstantinos Karagiannis,Need increased randomness for your encryption keys? This will be an interesting approach to keep an eye on in the world of post quantum cryptography #quantumcomputing https://t.co/Y2qgKX6iof,原创,en,0,1,0,4,2023-09-07 16:28:23,2024-04-11 11:33:40,1699821928368816502,1134334789,KonstantHacker,0,[],,,
https://twitter.com/1134334789/status/1694832989249630664,https://twitter.com/KonstantHacker,https://pbs.twimg.com/profile_images/1337469588720799749/aEOmnHTF_normal.jpg,,,Konstantinos Karagiannis,"NIST released draft standards for 3/4 post quantum cryptography algorithms it selected in 2022. A draft standard for FALCON, the fourth algorithm, will be released in about a year. https://t.co/jNZ6iF61sp",原创,en,0,3,0,8,2023-08-24 22:04:07,2024-04-11 11:33:40,1694832989249630664,1134334789,KonstantHacker,0,[],,,
https://twitter.com/1134334789/status/1692187468705972308,https://twitter.com/KonstantHacker,https://pbs.twimg.com/profile_images/1337469588720799749/aEOmnHTF_normal.jpg,,,Konstantinos Karagiannis,Google Chrome will feature hybrid post-quantum cryptography in version 116. In some ways this is already late for protecting long shelf life data from #QuantumComputing attacks in the future. But it's a start! https://t.co/R4JFIyJUoN,原创,en,0,2,2,10,2023-08-17 14:51:46,2024-04-11 11:33:40,1692187468705972308,1134334789,KonstantHacker,0,[],,,
https://twitter.com/1134334789/status/1691471829242617856,https://twitter.com/KonstantHacker,https://pbs.twimg.com/profile_images/1337469588720799749/aEOmnHTF_normal.jpg,,,Konstantinos Karagiannis,"Me on stage:
""AI alignment and safety are important.""

Me every time Google Bard makes a mistake:
""Just release Gemini now!""",原创,en,1,0,0,2,2023-08-15 15:28:04,2024-04-11 11:33:40,1691471829242617856,1134334789,KonstantHacker,0,[],,,
https://twitter.com/1134334789/status/1691187165420572673,https://twitter.com/KonstantHacker,https://pbs.twimg.com/profile_images/1337469588720799749/aEOmnHTF_normal.jpg,,,Konstantinos Karagiannis,"The JWST showed us that when you're designing a simulation, you should remove comments from the source code. https://t.co/XjTalbMtvA",原创,en,0,0,0,3,2023-08-14 20:36:55,2024-04-11 11:33:40,1691187165420572673,1134334789,KonstantHacker,0,[],,['https://pbs.twimg.com/media/F3hNw8gW4AAIpXw.jpg'],
https://twitter.com/1134334789/status/1690183756639019008,https://twitter.com/KonstantHacker,https://pbs.twimg.com/profile_images/1337469588720799749/aEOmnHTF_normal.jpg,,,Konstantinos Karagiannis,Thanks so much to everyone who came to my quantum-inspired talk and my quantum advantage debate. I haven't spoken at @defcon since DC25 and it was great to feel the love at @quantum_village. Stay quantum curious! #DEFCON31,原创,en,0,3,0,6,2023-08-12 02:09:44,2024-04-11 11:33:40,1690183756639019008,1134334789,KonstantHacker,0,[],,,
https://twitter.com/1134334789/status/1689777025282985987,https://twitter.com/KonstantHacker,https://pbs.twimg.com/profile_images/1337469588720799749/aEOmnHTF_normal.jpg,,,Konstantinos Karagiannis,Got my badge from @quantum_village and ready for #hackersummercamp #DEFCON31 https://t.co/Nmcn8hBehz,原创,en,0,2,0,8,2023-08-10 23:13:32,2024-04-11 11:33:40,1689777025282985987,1134334789,KonstantHacker,0,[],,['https://pbs.twimg.com/media/F3NLCdEaQAE8wf1.jpg'],
https://twitter.com/1134334789/status/1686465322088386562,https://twitter.com/KonstantHacker,https://pbs.twimg.com/profile_images/1337469588720799749/aEOmnHTF_normal.jpg,,,Konstantinos Karagiannis,LK-99 tweets are starting to resemble Swifties decoding the release date of 1989 Taylor's Version.,原创,en,0,2,0,2,2023-08-01 19:54:00,2024-04-11 11:33:40,1686465322088386562,1134334789,KonstantHacker,0,[],,,
https://twitter.com/1134334789/status/1685367933382356992,https://twitter.com/KonstantHacker,https://pbs.twimg.com/profile_images/1337469588720799749/aEOmnHTF_normal.jpg,,,Konstantinos Karagiannis,"Coming to @defcon 31? I'll be speaking in the
@quantum_village on Friday 8/11 at 3PM. Come learn about quantum-inspired approaches. No dil fridges will be harmed (or needed).

#QuantumComputing",原创,en,1,4,0,7,2023-07-29 19:13:22,2024-04-11 11:33:40,1685367933382356992,1134334789,KonstantHacker,0,[],,,
https://twitter.com/1134334789/status/1683984110304260097,https://twitter.com/KonstantHacker,https://pbs.twimg.com/profile_images/1337469588720799749/aEOmnHTF_normal.jpg,,,Konstantinos Karagiannis,"I was going to tweet once that Twitter will defeat Threads because no one wants to say they ""posted a thread."" Now I'm confused how to make X a verb. I'll X about it later.",原创,en,1,1,0,3,2023-07-25 23:34:33,2024-04-11 11:33:53,1683984110304260097,1134334789,KonstantHacker,0,[],,,
https://twitter.com/1134334789/status/1682037298496684039,https://twitter.com/KonstantHacker,https://pbs.twimg.com/profile_images/1337469588720799749/aEOmnHTF_normal.jpg,,,Konstantinos Karagiannis,Saddened by the death of Kevin Mitnick. InfoSec really wouldn't have been the same without him. https://t.co/bOjdl5wak1,原创,en,0,0,0,3,2023-07-20 14:38:37,2024-04-11 11:33:53,1682037298496684039,1134334789,KonstantHacker,0,[],,['https://pbs.twimg.com/media/F1fMAZ9aMAYgCMb.jpg'],
https://twitter.com/1134334789/status/1672333837739622401,https://twitter.com/KonstantHacker,https://pbs.twimg.com/profile_images/1337469588720799749/aEOmnHTF_normal.jpg,,,Konstantinos Karagiannis,"Midjourney 5.2 creates perfect fictional images, while GPT 4 writes fiction that reads like Mad Libs.",原创,en,0,1,0,2,2023-06-23 20:00:32,2024-04-11 11:33:53,1672333837739622401,1134334789,KonstantHacker,0,[],,,
https://twitter.com/1134334789/status/1671165984504430595,https://twitter.com/KonstantHacker,https://pbs.twimg.com/profile_images/1337469588720799749/aEOmnHTF_normal.jpg,,,Konstantinos Karagiannis,Is there a quantum computing digital divide? I'd like articles to note that anyone can learn quantum coding with a modest computer running a simulator https://t.co/xRtVVnDLes,原创,en,0,0,0,1,2023-06-20 14:39:54,2024-04-11 11:33:53,1671165984504430595,1134334789,KonstantHacker,0,[],,,
https://twitter.com/1134334789/status/1670102313288060929,https://twitter.com/KonstantHacker,https://pbs.twimg.com/profile_images/1337469588720799749/aEOmnHTF_normal.jpg,,,Konstantinos Karagiannis,"When your ""Quantum' Computer"" is as powerful as a Chromebook. https://t.co/xABfKGsaMF",原创,en,0,0,0,0,2023-06-17 16:13:15,2024-04-11 11:33:53,1670102313288060929,1134334789,KonstantHacker,0,[],,,
https://twitter.com/1134334789/status/1669057063970807820,https://twitter.com/KonstantHacker,https://pbs.twimg.com/profile_images/1337469588720799749/aEOmnHTF_normal.jpg,,,Konstantinos Karagiannis,"IBM isn't claiming #QuantumComputing advantage yet, but they're certainly promising useful applications with error mitigation as we await error correction. https://t.co/cC0qIuFvyf",原创,en,0,0,0,3,2023-06-14 18:59:48,2024-04-11 11:33:53,1669057063970807820,1134334789,KonstantHacker,0,[],,,
https://twitter.com/1134334789/status/1666858594157965317,https://twitter.com/KonstantHacker,https://pbs.twimg.com/profile_images/1337469588720799749/aEOmnHTF_normal.jpg,,,Konstantinos Karagiannis,"No one predicted quantum computing would show advantage in artificial intelligence first. Lots to validate here, of course. https://t.co/xEbkdZBLCz",原创,en,0,0,0,0,2023-06-08 17:23:52,2024-04-11 11:33:53,1666858594157965317,1134334789,KonstantHacker,0,[],,,
https://twitter.com/1134334789/status/1656745155913711616,https://twitter.com/KonstantHacker,https://pbs.twimg.com/profile_images/1337469588720799749/aEOmnHTF_normal.jpg,,,Konstantinos Karagiannis,"In a tough economic year, some companies are spending less on quantum computing PoCs and considering ways to get a quick ROI. Enter quantum-inspired algorithms and approaches...

https://t.co/yqQSwx0cbM",原创,en,0,0,0,1,2023-05-11 19:36:40,2024-04-11 11:33:53,1656745155913711616,1134334789,KonstantHacker,0,[],,,
https://twitter.com/1134334789/status/1655961604062838789,https://twitter.com/KonstantHacker,https://pbs.twimg.com/profile_images/1337469588720799749/aEOmnHTF_normal.jpg,,,Konstantinos Karagiannis,"We could use a quantum computing tsar, but not sure invoking Oppenheimer is the way to go https://t.co/XStRdtQ5D9",原创,en,0,3,2,5,2023-05-09 15:43:07,2024-04-11 11:33:53,1655961604062838789,1134334789,KonstantHacker,0,[],,,
https://twitter.com/1134334789/status/1646663119123390468,https://twitter.com/KonstantHacker,https://pbs.twimg.com/profile_images/1337469588720799749/aEOmnHTF_normal.jpg,,,Konstantinos Karagiannis,Quantum-inspired Tensor Networks to the rescue! https://t.co/nJg4yWbuOp,原创,en,0,0,0,0,2023-04-13 23:54:15,2024-04-11 11:33:53,1646663119123390468,1134334789,KonstantHacker,0,[],,,
https://twitter.com/1134334789/status/1641486258672218123,https://twitter.com/KonstantHacker,https://pbs.twimg.com/profile_images/1337469588720799749/aEOmnHTF_normal.jpg,,,Konstantinos Karagiannis,The 6-month moratorium on AI beyond GPT-4 is a ridiculous idea. Another large country would advance their own models (or the new open source ones) in that time and surpass us anyway.,原创,en,0,0,0,2,2023-03-30 17:03:16,2024-04-11 11:33:53,1641486258672218123,1134334789,KonstantHacker,0,[],,,
https://twitter.com/1134334789/status/1641457933555847168,https://twitter.com/KonstantHacker,https://pbs.twimg.com/profile_images/1337469588720799749/aEOmnHTF_normal.jpg,,,Konstantinos Karagiannis,I heard they're discussing AI and GPT on The View so I had to tune in. Hilarious stuff. A Tesla car is sentient because it can drive itself?,原创,en,0,0,0,0,2023-03-30 15:10:42,2024-04-11 11:33:53,1641457933555847168,1134334789,KonstantHacker,0,[],,,
https://twitter.com/1134334789/status/1638955746997174273,https://twitter.com/KonstantHacker,https://pbs.twimg.com/profile_images/1337469588720799749/aEOmnHTF_normal.jpg,,,Konstantinos Karagiannis,"Uhm, I believe this was called into question the exact moment the quantum computing wormhole paper was published https://t.co/OMX38dM0J8",原创,en,0,0,0,2,2023-03-23 17:27:55,2024-04-11 11:34:08,1638955746997174273,1134334789,KonstantHacker,0,[],,,
https://twitter.com/1134334789/status/1636502256982925312,https://twitter.com/KonstantHacker,https://pbs.twimg.com/profile_images/1337469588720799749/aEOmnHTF_normal.jpg,,,Konstantinos Karagiannis,From quantum computing winter to spring https://t.co/OucY30TKGM,原创,en,0,0,0,1,2023-03-16 22:58:37,2024-04-11 11:34:08,1636502256982925312,1134334789,KonstantHacker,0,[],,,
https://twitter.com/1134334789/status/1636059457384853513,https://twitter.com/KonstantHacker,https://pbs.twimg.com/profile_images/1337469588720799749/aEOmnHTF_normal.jpg,,,Konstantinos Karagiannis,"Learn how to get started in a quantum coding career without a PhD! 5 tips (plus one bonus at the end of the video).

#QuantumComputing

https://t.co/HC5obuygAY",原创,en,0,1,0,0,2023-03-15 17:39:05,2024-04-11 11:34:08,1636059457384853513,1134334789,KonstantHacker,0,[],,,
https://twitter.com/1134334789/status/1631035547941576704,https://twitter.com/KonstantHacker,https://pbs.twimg.com/profile_images/1337469588720799749/aEOmnHTF_normal.jpg,,,Konstantinos Karagiannis,Time to start experimenting with Intel's Quantum SDK.   https://t.co/d1EPkkEMCs,原创,en,0,0,0,1,2023-03-01 20:55:52,2024-04-11 11:34:08,1631035547941576704,1134334789,KonstantHacker,0,[],,,
https://twitter.com/1134334789/status/1630619358509629440,https://twitter.com/KonstantHacker,https://pbs.twimg.com/profile_images/1337469588720799749/aEOmnHTF_normal.jpg,,,Konstantinos Karagiannis,"Did an AI really crack post-quantum cryptography finalist CRYSTALS-Kyber?

#QuantumComputing #PostQuantumCrypto #AI #ArtificialIntelligence #encryption 

https://t.co/m0jmbpVqeO",原创,en,1,0,1,4,2023-02-28 17:22:05,2024-04-11 11:34:08,1630619358509629440,1134334789,KonstantHacker,0,[],,,
https://twitter.com/1134334789/status/1630305049904553984,https://twitter.com/KonstantHacker,https://pbs.twimg.com/profile_images/1337469588720799749/aEOmnHTF_normal.jpg,,,Konstantinos Karagiannis,"Google fired him when he said their AI was sentient. He's not only sticking to his view, but claiming Bing's AI might be sentient, too. All without using it yet. Very scientific. https://t.co/e8KMuaNdJl",原创,en,1,0,0,1,2023-02-27 20:33:08,2024-04-11 11:34:08,1630305049904553984,1134334789,KonstantHacker,0,[],,,
https://twitter.com/1134334789/status/1626271327622512646,https://twitter.com/KonstantHacker,https://pbs.twimg.com/profile_images/1337469588720799749/aEOmnHTF_normal.jpg,,,Konstantinos Karagiannis,"Time for another story that will make people think AI is sentient. The Turing Test has always been ridiculous. AI chatbots are very good at chatting, by design. https://t.co/pNOyGO71MR",原创,en,0,0,0,1,2023-02-16 17:24:33,2024-04-11 11:34:08,1626271327622512646,1134334789,KonstantHacker,0,[],,,
https://twitter.com/1134334789/status/1623727118482911232,https://twitter.com/KonstantHacker,https://pbs.twimg.com/profile_images/1337469588720799749/aEOmnHTF_normal.jpg,,,Konstantinos Karagiannis,"For quantum computing to scale to the fault-tolerant level, some type of interconnect will be required. Here's a new successful approach to entangling discrete QPU modules and paving the way to thousands of qubits. https://t.co/mMtdWTdhOb",原创,en,2,2,2,8,2023-02-09 16:54:47,2024-04-11 11:34:08,1623727118482911232,1134334789,KonstantHacker,0,[],,,
https://twitter.com/1134334789/status/1623377408970657810,https://twitter.com/KonstantHacker,https://pbs.twimg.com/profile_images/1337469588720799749/aEOmnHTF_normal.jpg,,,Konstantinos Karagiannis,No balloons in this article on China and the quantum computing arms race. (I'm quoted throughout.) https://t.co/pqjfNT2T97,原创,en,0,0,0,2,2023-02-08 17:45:09,2024-04-11 11:34:08,1623377408970657810,1134334789,KonstantHacker,0,[],,,
https://twitter.com/1134334789/status/1621184301248249857,https://twitter.com/KonstantHacker,https://pbs.twimg.com/profile_images/1337469588720799749/aEOmnHTF_normal.jpg,,,Konstantinos Karagiannis,"It's absolutely time to start worrying about how quantum computing will affect infosec. Full disclosure: I'm quoted throughout.

https://t.co/9xeCvKjZRR",原创,en,0,2,1,12,2023-02-02 16:30:32,2024-04-11 11:34:08,1621184301248249857,1134334789,KonstantHacker,0,[],,,
https://twitter.com/1134334789/status/1618681163949965313,https://twitter.com/KonstantHacker,https://pbs.twimg.com/profile_images/1337469588720799749/aEOmnHTF_normal.jpg,,,Konstantinos Karagiannis,"Time magazine will have quantum computing on the cover. Here's a link to the story. Note it says ""quantum leap,"" which is comical because it is the smallest jump an electron could make in the universe. Please stop using this phrase to mean ""awesome""! https://t.co/aINCfGai5Z",原创,en,0,2,0,8,2023-01-26 18:43:57,2024-04-11 11:34:08,1618681163949965313,1134334789,KonstantHacker,0,[],,,
https://twitter.com/1134334789/status/1618338013192544256,https://twitter.com/KonstantHacker,https://pbs.twimg.com/profile_images/1337469588720799749/aEOmnHTF_normal.jpg,,,Konstantinos Karagiannis,Optical tweezers are not cheap. https://t.co/FQ3BuOUmDK,原创,en,0,0,0,0,2023-01-25 20:00:24,2024-04-11 11:34:08,1618338013192544256,1134334789,KonstantHacker,0,[],,,
https://twitter.com/1134334789/status/1610296602429739011,https://twitter.com/KonstantHacker,https://pbs.twimg.com/profile_images/1337469588720799749/aEOmnHTF_normal.jpg,,,Konstantinos Karagiannis,"Let's start this year of the quantum computing decade with some optimism. Okay, I'm quoted here, but still.
https://t.co/eXVxXNmOK6",原创,en,1,0,0,2,2023-01-03 15:26:42,2024-04-11 11:34:08,1610296602429739011,1134334789,KonstantHacker,0,[],,,
https://twitter.com/1134334789/status/1608887062782173184,https://twitter.com/KonstantHacker,https://pbs.twimg.com/profile_images/1337469588720799749/aEOmnHTF_normal.jpg,,,Konstantinos Karagiannis,"We should use ChatGPT to design a new stock image for use in all the articles discussing AI, then have stable diffusion draw it.",原创,en,0,0,0,0,2022-12-30 18:05:42,2024-04-11 11:34:08,1608887062782173184,1134334789,KonstantHacker,0,[],,,
https://twitter.com/1134334789/status/1602421680248422406,https://twitter.com/KonstantHacker,https://pbs.twimg.com/profile_images/1337469588720799749/aEOmnHTF_normal.jpg,,,Konstantinos Karagiannis,Christopher Nolan managed to make nuclear fission news a day before the DOE is expected to make nuclear fusion news.,原创,en,0,0,0,0,2022-12-12 21:54:34,2024-04-11 11:34:25,1602421680248422406,1134334789,KonstantHacker,0,[],,,
https://twitter.com/1134334789/status/1559942046068219906,https://twitter.com/KonstantHacker,https://pbs.twimg.com/profile_images/1337469588720799749/aEOmnHTF_normal.jpg,,,Konstantinos Karagiannis,I think the spirit of Feynman's 1981 Quantum Simulator was to make certain simulations possible at all. This article seems to only care about speedup with quantum computing. https://t.co/rKFZsCK9Wy,原创,en,0,0,0,0,2022-08-17 16:35:40,2024-04-11 11:34:25,1559942046068219906,1134334789,KonstantHacker,0,[],,,
https://twitter.com/1134334789/status/1559413313884135425,https://twitter.com/KonstantHacker,https://pbs.twimg.com/profile_images/1337469588720799749/aEOmnHTF_normal.jpg,,,Konstantinos Karagiannis,"Saul talked about time machines and Walt mentioned quantum physics, so I guess I'm okay with the #BetterCallSaulFinale",原创,en,0,0,0,1,2022-08-16 05:34:41,2024-04-11 11:34:25,1559413313884135425,1134334789,KonstantHacker,0,[],,,
https://twitter.com/1134334789/status/1559245224215560194,https://twitter.com/KonstantHacker,https://pbs.twimg.com/profile_images/1337469588720799749/aEOmnHTF_normal.jpg,,,Konstantinos Karagiannis,This is a sick burn. You're so dumb you could be simulated with 6 qubits in a quantum computer. https://t.co/TnOWtBGLTa,原创,en,1,0,0,0,2022-08-15 18:26:45,2024-04-11 11:34:25,1559245224215560194,1134334789,KonstantHacker,0,[],,,
https://twitter.com/1134334789/status/1551665249253736448,https://twitter.com/KonstantHacker,https://pbs.twimg.com/profile_images/1337469588720799749/aEOmnHTF_normal.jpg,,,Konstantinos Karagiannis,We've been talking about qutrits and qudits as alternatives to qubits for quite some time in hopes of exponentially expanding the power of quantum computing. It may be time to make these a reality. https://t.co/nHpxlkYvTe,原创,en,0,2,1,3,2022-07-25 20:26:38,2024-04-11 11:34:26,1551665249253736448,1134334789,KonstantHacker,0,[],,,
https://twitter.com/1134334789/status/1546567583465357312,https://twitter.com/KonstantHacker,https://pbs.twimg.com/profile_images/1337469588720799749/aEOmnHTF_normal.jpg,,,Konstantinos Karagiannis,What does quantum advantage even mean anymore? https://t.co/ysDhIDOLNV,原创,en,0,0,0,2,2022-07-11 18:50:20,2024-04-11 11:34:26,1546567583465357312,1134334789,KonstantHacker,0,[],,,
https://twitter.com/1134334789/status/1543700228272017409,https://twitter.com/KonstantHacker,https://pbs.twimg.com/profile_images/1337469588720799749/aEOmnHTF_normal.jpg,,,Konstantinos Karagiannis,"This week NIST may start a Y2Q remediation rush. ""NIST to Announce PQC Algorithm Selections on July 5, 2022 - Quantum Computing Report"" https://t.co/8r0CUrvsPk",原创,en,0,1,0,2,2022-07-03 20:56:29,2024-04-11 11:34:26,1543700228272017409,1134334789,KonstantHacker,0,[],,,
https://twitter.com/1134334789/status/1542189691474219008,https://twitter.com/KonstantHacker,https://pbs.twimg.com/profile_images/1337469588720799749/aEOmnHTF_normal.jpg,,,Konstantinos Karagiannis,Some fresh reporting and quotes on what the Biden administration is up to in quantum computing https://t.co/sUMF81d6b7,原创,en,0,0,0,0,2022-06-29 16:54:09,2024-04-11 11:34:26,1542189691474219008,1134334789,KonstantHacker,0,[],,,
https://twitter.com/1134334789/status/1539983044437762049,https://twitter.com/KonstantHacker,https://pbs.twimg.com/profile_images/1337469588720799749/aEOmnHTF_normal.jpg,,,Konstantinos Karagiannis,I think we've established that just adding artificial neurons does not lead to AGI artificial intelligence. Strong Emergence eludes us. https://t.co/ge3D9ibZlR,原创,en,0,0,0,0,2022-06-23 14:45:43,2024-04-11 11:34:26,1539983044437762049,1134334789,KonstantHacker,0,[],,,
https://twitter.com/1134334789/status/1536707754047459330,https://twitter.com/KonstantHacker,https://pbs.twimg.com/profile_images/1337469588720799749/aEOmnHTF_normal.jpg,,,Konstantinos Karagiannis,NY High Court ruled Happy the elephant at Bronx Zoo is not a person. And so soon after we learned Google's AI chatbot is not sentient. Tough week.,原创,en,0,1,0,1,2022-06-14 13:50:53,2024-04-11 11:34:26,1536707754047459330,1134334789,KonstantHacker,0,[],,,
