tweet_url,author_url,avatar_url,avatar_binary,topic,author_name,content,tweet_type,tweet_language,comment_count,retweet_count,quote_count,praise_count,publish_time,fetch_time,tweet_id,screen_id,screen_name,tourist_crawl_status,video_urls,original_author,tweet_img_url,tweet_img_binary
https://twitter.com/14090906/status/1703159411500335175,https://twitter.com/WeldPond,https://pbs.twimg.com/profile_images/1732479699748519937/5NQhmNOG_normal.jpg,,,Weld Pond | Chris Wysopal,Some people have scale models of their favorite planes. ⁦@caseyjohnellis⁩ https://t.co/H46A8oZyOJ,原创,en,3,2,0,22,2023-09-16 21:30:21,2024-04-10 19:38:48,1703159411500335175,14090906,WeldPond,0,[],,['https://pbs.twimg.com/media/F6LWdR6XQAE5JHX.jpg'],
https://twitter.com/14090906/status/1701690536954822713,https://twitter.com/WeldPond,https://pbs.twimg.com/profile_images/1732479699748519937/5NQhmNOG_normal.jpg,,,Weld Pond | Chris Wysopal,"Veracode named a leader in Software Supply Chain Security! One of my original visions for the company was to help enterprises manage their SW supply chain risk from their SDLC, outsourcers &amp; OSS. I'm proud that we've been recognized as 1 of 3 leaders https://t.co/LGgsjAoia0",原创,en,0,1,0,9,2023-09-12 20:13:34,2024-04-10 19:38:48,1701690536954822713,14090906,WeldPond,0,[],,,
https://twitter.com/14090906/status/1701596143896162676,https://twitter.com/WeldPond,https://pbs.twimg.com/profile_images/1732479699748519937/5NQhmNOG_normal.jpg,,,Weld Pond | Chris Wysopal,"If AI generated content isn't copyrightable, isn't a simple solution to the AI watermarking problem is to put a copyright notice on everything human generated? No notice, then we can assume it is AI generated. 1/2",原创,en,2,0,1,2,2023-09-12 13:58:29,2024-04-10 19:38:48,1701596143896162676,14090906,WeldPond,0,[],,,
https://twitter.com/14090906/status/1701310568009793560,https://twitter.com/WeldPond,https://pbs.twimg.com/profile_images/1732479699748519937/5NQhmNOG_normal.jpg,,,Weld Pond | Chris Wysopal,"Not During DEFCON. 

ATMs &amp; slot machines at MGM’s Las Vegas casinos down, hotel restaurants accept only cash. 

Guests also report that they cannot charge anything to their rooms and are unable to use their digital room keys https://t.co/R8VwEEjzD8",原创,en,5,23,4,64,2023-09-11 19:03:42,2024-04-10 19:38:48,1701310568009793560,14090906,WeldPond,0,[],,,
https://twitter.com/14090906/status/1700144408929120360,https://twitter.com/WeldPond,https://pbs.twimg.com/profile_images/1732479699748519937/5NQhmNOG_normal.jpg,,,Weld Pond | Chris Wysopal,"Tired: Script Kiddie
Wired: GenAI Trickster",原创,en,1,0,1,6,2023-09-08 13:49:48,2024-04-10 19:38:48,1700144408929120360,14090906,WeldPond,0,[],,,
https://twitter.com/14090906/status/1724838194766909928,https://twitter.com/WeldPond,https://pbs.twimg.com/profile_images/1732479699748519937/5NQhmNOG_normal.jpg,,,Weld Pond | Chris Wysopal,Thrilled to be named a Cybersecurity Visionary by @CyberScoopNews! It's an honor to stand among such distinguished leaders and innovators in public sector cybersecurity. This award is a testament to our collective commitment to securing our digital world. https://t.co/hU2TOAkddu,原创,en,4,8,0,41,2023-11-15 17:14:06,2024-04-10 19:39:04,1724838194766909928,14090906,WeldPond,0,[],,['https://pbs.twimg.com/media/F-_bL6fbAAAm8aU.jpg'],
https://twitter.com/14090906/status/1699850890599928118,https://twitter.com/WeldPond,https://pbs.twimg.com/profile_images/1732479699748519937/5NQhmNOG_normal.jpg,,,Weld Pond | Chris Wysopal,"Ukraine Lessons Learned Protecting Critical Cyber Infrastructure
￼
Illia Vitiuk
Head of Cyber Security Department
Security Service of Ukraine (SBU) 

At #billington cybersecurity summit https://t.co/fDdXBMYp0g",原创,en,0,0,0,4,2023-09-07 18:23:28,2024-04-10 19:39:04,1699850890599928118,14090906,WeldPond,0,[],,"['https://pbs.twimg.com/media/F5cVX33WEAEAvGX.jpg', 'https://pbs.twimg.com/media/F5cVX34XcAImQ-l.jpg']",
https://twitter.com/14090906/status/1699071265540329799,https://twitter.com/WeldPond,https://pbs.twimg.com/profile_images/1732479699748519937/5NQhmNOG_normal.jpg,,,Weld Pond | Chris Wysopal,"Big moves in the cybersecurity world! Two seasoned pros from AtStake are now shaping national policy: @ollieatnowhere as CTO at @NCSC, and @dotMudge is the new powerhouse at @CISAgov. The future of government cybersecurity is growing stronger🛡️",原创,en,2,12,1,79,2023-09-05 14:45:31,2024-04-10 19:39:04,1699071265540329799,14090906,WeldPond,0,[],,,
https://twitter.com/14090906/status/1696907657863463308,https://twitter.com/WeldPond,https://pbs.twimg.com/profile_images/1732479699748519937/5NQhmNOG_normal.jpg,,,Weld Pond | Chris Wysopal,"The industry is catching up to what @joshcorman &amp; me were speaking about at RSA in 2021 with the shift from AppSec to Product Security

""AppSec’s Future and the Rise of the Chief Product Security Officer"" https://t.co/nW2KBcXzcN

CSO recently published:
 https://t.co/wKPV9fokdT",原创,en,2,4,1,13,2023-08-30 15:28:07,2024-04-10 19:39:04,1696907657863463308,14090906,WeldPond,0,[],,,
https://twitter.com/14090906/status/1696528080314171475,https://twitter.com/WeldPond,https://pbs.twimg.com/profile_images/1732479699748519937/5NQhmNOG_normal.jpg,,,Weld Pond | Chris Wysopal,"US Cyber Trust Mark News: FCC seeking public comment on a proposal to create a voluntary cybersecurity labeling program that would provide consumers with clear infor about the security of their internet-enabled devices, commonly called IoT or smart devices https://t.co/AgWEYFYb77 https://t.co/jx0YI3oawO",原创,en,0,2,1,4,2023-08-29 14:19:48,2024-04-10 19:39:04,1696528080314171475,14090906,WeldPond,0,[],,['https://pbs.twimg.com/media/F4tHLF9bsAAia7C.jpg'],
https://twitter.com/14090906/status/1695149616885268829,https://twitter.com/WeldPond,https://pbs.twimg.com/profile_images/1732479699748519937/5NQhmNOG_normal.jpg,,,Weld Pond | Chris Wysopal,"cybercrime and cyberdeviance is prevalent, survey finds that 69% of EU youth self-report to have committed at least one form of cybercrime or online harm or risk taking, and just under half 48% report to have engaged in criminal behaviour online,  20-21 https://t.co/cIWKYqBsUf",原创,en,2,0,0,2,2023-08-25 19:02:17,2024-04-10 19:39:04,1695149616885268829,14090906,WeldPond,0,[],,,
https://twitter.com/14090906/status/1694316792062111984,https://twitter.com/WeldPond,https://pbs.twimg.com/profile_images/1732479699748519937/5NQhmNOG_normal.jpg,,,Weld Pond | Chris Wysopal,"Wysopal is coming to Riyadh to speak at Black Hat MEA 2023. So we caught up with him ahead of the event, to give you a quick glimpse at his perspective on security and hacking.
 https://t.co/1ia0mqtdGT",原创,en,1,0,0,4,2023-08-23 11:52:56,2024-04-10 19:39:04,1694316792062111984,14090906,WeldPond,0,[],,,
https://twitter.com/14090906/status/1724838194766909928,https://twitter.com/WeldPond,https://pbs.twimg.com/profile_images/1732479699748519937/5NQhmNOG_normal.jpg,,,Weld Pond | Chris Wysopal,Thrilled to be named a Cybersecurity Visionary by @CyberScoopNews! It's an honor to stand among such distinguished leaders and innovators in public sector cybersecurity. This award is a testament to our collective commitment to securing our digital world. https://t.co/hU2TOAkddu,原创,en,4,8,0,41,2023-11-15 17:14:06,2024-04-10 19:42:47,1724838194766909928,14090906,WeldPond,0,[],,['https://pbs.twimg.com/media/F-_bL6fbAAAm8aU.jpg'],
https://twitter.com/14090906/status/1694316792062111984,https://twitter.com/WeldPond,https://pbs.twimg.com/profile_images/1732479699748519937/5NQhmNOG_normal.jpg,,,Weld Pond | Chris Wysopal,"Wysopal is coming to Riyadh to speak at Black Hat MEA 2023. So we caught up with him ahead of the event, to give you a quick glimpse at his perspective on security and hacking.
 https://t.co/1ia0mqtdGT",原创,en,1,0,0,4,2023-08-23 11:52:56,2024-04-10 19:42:47,1694316792062111984,14090906,WeldPond,0,[],,,
https://twitter.com/14090906/status/1694299029008486729,https://twitter.com/WeldPond,https://pbs.twimg.com/profile_images/1732479699748519937/5NQhmNOG_normal.jpg,,,Weld Pond | Chris Wysopal,"Named SREN, the bill ostensibly aims to fight online fraud, but its approach has sparked alarm. The concerns centre on a requirement for web browsers to block sites listed on a government-provided list. https://t.co/Cw1OXcS9cg",原创,en,1,3,0,5,2023-08-23 10:42:21,2024-04-10 19:42:47,1694299029008486729,14090906,WeldPond,0,[],,,
https://twitter.com/14090906/status/1694290995850952949,https://twitter.com/WeldPond,https://pbs.twimg.com/profile_images/1732479699748519937/5NQhmNOG_normal.jpg,,,Weld Pond | Chris Wysopal,"Device makers would likely have to notify the govt before making available important security updates that fix known vulns &amp; keep devices secure. Sec of State, upon receiving such an notice, could now request operators to abstain from patching https://t.co/vXaz63LqkF",原创,en,1,4,2,10,2023-08-23 10:10:26,2024-04-10 19:42:47,1694290995850952949,14090906,WeldPond,0,[],,,
https://twitter.com/14090906/status/1694178316549226773,https://twitter.com/WeldPond,https://pbs.twimg.com/profile_images/1732479699748519937/5NQhmNOG_normal.jpg,,,Weld Pond | Chris Wysopal,"I maintain that the most powerful security tools are gray, able to be used by black hats and white hats. Appsec tools are an example. https://t.co/GItut0SmE5",原创,en,1,2,1,17,2023-08-23 02:42:41,2024-04-10 19:42:47,1694178316549226773,14090906,WeldPond,0,[],,,
https://twitter.com/14090906/status/1694012306638655893,https://twitter.com/WeldPond,https://pbs.twimg.com/profile_images/1732479699748519937/5NQhmNOG_normal.jpg,,,Weld Pond | Chris Wysopal,"Frustrated by Meta’s slow response, victims are paying individuals who call themselves “hackers éticos” (ethical hackers) to recover their accounts. https://t.co/Wo7pGWZDCq",原创,en,1,5,3,10,2023-08-22 15:43:01,2024-04-10 19:42:47,1694012306638655893,14090906,WeldPond,0,[],,,
https://twitter.com/14090906/status/1692689913685127657,https://twitter.com/WeldPond,https://pbs.twimg.com/profile_images/1732479699748519937/5NQhmNOG_normal.jpg,,,Weld Pond | Chris Wysopal,When it’s time to head to the ⁦@VeilidNetwork⁩ release party. ⁦@debkav⁩ wearing one of ⁦@medus4_cdc⁩’s custom art badges. https://t.co/pj3Cv03Qrq,原创,en,3,2,0,29,2023-08-19 00:08:18,2024-04-10 19:42:47,1692689913685127657,14090906,WeldPond,0,[],,['https://pbs.twimg.com/media/F32kgOWWwAAANJw.jpg'],
https://twitter.com/14090906/status/1692560411365630254,https://twitter.com/WeldPond,https://pbs.twimg.com/profile_images/1732479699748519937/5NQhmNOG_normal.jpg,,,Weld Pond | Chris Wysopal,"According to cybersecurity professionals in Western countries, threats have become increasingly tangible. Computer engineers hired by companies to combat hacking groups are now becoming targets.

https://t.co/I0DzRCymwm",原创,en,1,4,0,8,2023-08-18 15:33:42,2024-04-10 19:42:47,1692560411365630254,14090906,WeldPond,0,[],,,
https://twitter.com/14090906/status/1692330258639315225,https://twitter.com/WeldPond,https://pbs.twimg.com/profile_images/1732479699748519937/5NQhmNOG_normal.jpg,,,Weld Pond | Chris Wysopal,Got some great photos at #hackersummercamp. This is my fav photo from the @VeilidNetwork launch party by @cDc_Pulpit at @defcon https://t.co/IGkkq5geFe,原创,en,5,11,1,74,2023-08-18 00:19:10,2024-04-10 19:42:47,1692330258639315225,14090906,WeldPond,0,[],,['https://pbs.twimg.com/media/F3xdGnIW8AAVfsh.jpg'],
https://twitter.com/14090906/status/1691836247155642754,https://twitter.com/WeldPond,https://pbs.twimg.com/profile_images/1732479699748519937/5NQhmNOG_normal.jpg,,,Weld Pond | Chris Wysopal,Why aren’t all IoT devices considered botnet and intrusion friendly until shown otherwise? (Just back from DEFCON thoughts),原创,en,4,1,0,13,2023-08-16 15:36:08,2024-04-10 19:42:47,1691836247155642754,14090906,WeldPond,0,[],,,
https://twitter.com/14090906/status/1724838194766909928,https://twitter.com/WeldPond,https://pbs.twimg.com/profile_images/1732479699748519937/5NQhmNOG_normal.jpg,,,Weld Pond | Chris Wysopal,Thrilled to be named a Cybersecurity Visionary by @CyberScoopNews! It's an honor to stand among such distinguished leaders and innovators in public sector cybersecurity. This award is a testament to our collective commitment to securing our digital world. https://t.co/hU2TOAkddu,原创,en,4,8,0,41,2023-11-15 17:14:06,2024-04-10 19:42:59,1724838194766909928,14090906,WeldPond,0,[],,['https://pbs.twimg.com/media/F-_bL6fbAAAm8aU.jpg'],
https://twitter.com/14090906/status/1691397522579656704,https://twitter.com/WeldPond,https://pbs.twimg.com/profile_images/1732479699748519937/5NQhmNOG_normal.jpg,,,Weld Pond | Chris Wysopal,"Protect yourself from iOS Bluetooth attacks by turning it off.

There is a difference to disconnecting Bluetooth in the Control Center and turning it off in settings (To turn off Bluetooth, go to Settings &gt; Bluetooth and turn off Bluetooth.) https://t.co/jPuesxNTfC",原创,en,4,1,2,8,2023-08-15 10:32:48,2024-04-10 19:42:59,1691397522579656704,14090906,WeldPond,0,[],,,
https://twitter.com/14090906/status/1691193707607810050,https://twitter.com/WeldPond,https://pbs.twimg.com/profile_images/1732479699748519937/5NQhmNOG_normal.jpg,,,Weld Pond | Chris Wysopal,.@0xmchow  and I are on a mission to get cybersecurity incorporated into traditional computer science classes. Developers need to understand the cybersecurity risk of their code and how to mitigate it. Please vote for us! https://t.co/y8zVPRZt9q,原创,en,0,2,0,10,2023-08-14 21:02:55,2024-04-10 19:42:59,1691193707607810050,14090906,WeldPond,0,[],,,
https://twitter.com/14090906/status/1690938932576305152,https://twitter.com/WeldPond,https://pbs.twimg.com/profile_images/1732479699748519937/5NQhmNOG_normal.jpg,,,Weld Pond | Chris Wysopal,"Findings won’t be made public until about February. And even then, fixing flaws in these digital constructs — whose inner workings are neither wholly trustworthy nor fully fathomed even by their creators — will take time and millions of dollars. #defcon https://t.co/JMKxykWmcE",原创,en,1,46,9,98,2023-08-14 04:10:32,2024-04-10 19:42:59,1690938932576305152,14090906,WeldPond,0,[],,,
https://twitter.com/14090906/status/1690238280393265153,https://twitter.com/WeldPond,https://pbs.twimg.com/profile_images/1732479699748519937/5NQhmNOG_normal.jpg,,,Weld Pond | Chris Wysopal,The @defcon ⁦@VeilidNetwork⁩ launch party was lit. This software is going places. It could change the world. https://t.co/tETeueGL6r,原创,en,5,19,1,145,2023-08-12 05:46:23,2024-04-10 19:42:59,1690238280393265153,14090906,WeldPond,0,[],,['https://pbs.twimg.com/media/F3TuwPJaUAE2pwG.jpg'],
https://twitter.com/14090906/status/1724838194766909928,https://twitter.com/WeldPond,https://pbs.twimg.com/profile_images/1732479699748519937/5NQhmNOG_normal.jpg,,,Weld Pond | Chris Wysopal,Thrilled to be named a Cybersecurity Visionary by @CyberScoopNews! It's an honor to stand among such distinguished leaders and innovators in public sector cybersecurity. This award is a testament to our collective commitment to securing our digital world. https://t.co/hU2TOAkddu,原创,en,4,8,0,41,2023-11-15 17:14:06,2024-04-10 19:48:13,1724838194766909928,14090906,WeldPond,0,[],,['https://pbs.twimg.com/media/F-_bL6fbAAAm8aU.jpg'],
https://twitter.com/14090906/status/1690074772594655233,https://twitter.com/WeldPond,https://pbs.twimg.com/profile_images/1732479699748519937/5NQhmNOG_normal.jpg,,,Weld Pond | Chris Wysopal,My advice: “The problem is getting critical attack surface components rewritten in memory-safe languages. Microsoft rewrote their SMTP gateway for exchange in C#. There are IoT toolkits that have libs for auto-update &amp; remote mgmt written in Rust.”  https://t.co/lvl6B4W0MM,原创,en,0,4,0,13,2023-08-11 18:56:40,2024-04-10 19:48:13,1690074772594655233,14090906,WeldPond,0,[],,,
https://twitter.com/14090906/status/1689695558242549763,https://twitter.com/WeldPond,https://pbs.twimg.com/profile_images/1732479699748519937/5NQhmNOG_normal.jpg,,,Weld Pond | Chris Wysopal,ONCD RFI on Open Source Software Security and memory safe languages https://t.co/3xQ9cHrBeG,原创,en,2,3,0,9,2023-08-10 17:49:48,2024-04-10 19:48:13,1689695558242549763,14090906,WeldPond,0,[],,,
https://twitter.com/14090906/status/1689691448537763840,https://twitter.com/WeldPond,https://pbs.twimg.com/profile_images/1732479699748519937/5NQhmNOG_normal.jpg,,,Weld Pond | Chris Wysopal,BoB Lord and Jack Cable are talking about @CISAgov principles for secure by design at #BlackHat https://t.co/06RB4CbU46,原创,en,1,1,1,6,2023-08-10 17:33:28,2024-04-10 19:48:13,1689691448537763840,14090906,WeldPond,0,[],,"['https://pbs.twimg.com/media/F3L9agDbYAAPCBG.jpg', 'https://pbs.twimg.com/media/F3L9agHbIAAFBE2.jpg']",
https://twitter.com/14090906/status/1689080564945387520,https://twitter.com/WeldPond,https://pbs.twimg.com/profile_images/1732479699748519937/5NQhmNOG_normal.jpg,,,Weld Pond | Chris Wysopal,"🎛️ Got a modular synth? Mine's portable! 🎶 Let's make some electronic magic this Saturday, noon at @defcon. Big shoutout to @HDA_DEFCON for sponsoring the vibes! 🎚️🎚️🎚️ #SynthJam #HackerBeats

https://t.co/qdPIAFb9kw https://t.co/h9RjCHzth1",原创,en,10,13,0,94,2023-08-09 01:06:02,2024-04-10 19:48:13,1689080564945387520,14090906,WeldPond,0,[],,['https://pbs.twimg.com/media/F3DR0k2XsAAG9Cu.jpg'],
https://twitter.com/14090906/status/1688964656709111809,https://twitter.com/WeldPond,https://pbs.twimg.com/profile_images/1732479699748519937/5NQhmNOG_normal.jpg,,,Weld Pond | Chris Wysopal,"The 2023 State of Cybersecurity for Medical Devices and Healthcare Systems is out 

- 993 vulns found in 2023 (a 59% increase from 2022) spanning 966 healthcare products. 

- 160 vulns have a working PoC, and 101 are trending in the wild. 1/",原创,en,2,4,1,6,2023-08-08 17:25:28,2024-04-10 19:48:13,1688964656709111809,14090906,WeldPond,0,[],,,
https://twitter.com/14090906/status/1688519918839283712,https://twitter.com/WeldPond,https://pbs.twimg.com/profile_images/1732479699748519937/5NQhmNOG_normal.jpg,,,Weld Pond | Chris Wysopal,It seems unlikely the victims will get notified in this breach case. Are there any regulations of spyware? https://t.co/SlwILGGVbH,原创,en,1,0,0,1,2023-08-07 11:58:14,2024-04-10 19:48:13,1688519918839283712,14090906,WeldPond,0,[],,,
https://twitter.com/14090906/status/1724838194766909928,https://twitter.com/WeldPond,https://pbs.twimg.com/profile_images/1732479699748519937/5NQhmNOG_normal.jpg,,,Weld Pond | Chris Wysopal,Thrilled to be named a Cybersecurity Visionary by @CyberScoopNews! It's an honor to stand among such distinguished leaders and innovators in public sector cybersecurity. This award is a testament to our collective commitment to securing our digital world. https://t.co/hU2TOAkddu,原创,en,4,8,0,41,2023-11-15 17:14:06,2024-04-10 19:48:27,1724838194766909928,14090906,WeldPond,0,[],,['https://pbs.twimg.com/media/F-_bL6fbAAAm8aU.jpg'],
https://twitter.com/14090906/status/1687507768045924352,https://twitter.com/WeldPond,https://pbs.twimg.com/profile_images/1732479699748519937/5NQhmNOG_normal.jpg,,,Weld Pond | Chris Wysopal,"A cyberattack has disrupted hospital computer systems in several states, forcing some emergency rooms to close and ambulances to be diverted, https://t.co/tagTX4ZHDJ",原创,en,1,27,3,18,2023-08-04 16:56:18,2024-04-10 19:48:27,1687507768045924352,14090906,WeldPond,0,[],,,
https://twitter.com/14090906/status/1687503824842366992,https://twitter.com/WeldPond,https://pbs.twimg.com/profile_images/1732479699748519937/5NQhmNOG_normal.jpg,,,Weld Pond | Chris Wysopal,"Cautionary tale for US nat. security

“We can’t hit their military infrastructure because it’s isolated and well protected. But we can hit the industries the military uses. When we attack their railways, it affects both their civilian and military trains”

https://t.co/TLqSREFtVj",原创,en,4,3,1,7,2023-08-04 16:40:38,2024-04-10 19:48:27,1687503824842366992,14090906,WeldPond,0,[],,,
https://twitter.com/14090906/status/1687490102241443842,https://twitter.com/WeldPond,https://pbs.twimg.com/profile_images/1732479699748519937/5NQhmNOG_normal.jpg,,,Weld Pond | Chris Wysopal,"Discover the extraordinary journey of @window, a trailblazing cybersecurity pioneer! Her genius was fortifying crucial software and devices we rely on daily, making our digital world safer.  https://t.co/4A42O3BWlD",原创,en,0,13,2,36,2023-08-04 15:46:07,2024-04-10 19:48:27,1687490102241443842,14090906,WeldPond,0,[],,,
https://twitter.com/14090906/status/1687107351202172929,https://twitter.com/WeldPond,https://pbs.twimg.com/profile_images/1732479699748519937/5NQhmNOG_normal.jpg,,,Weld Pond | Chris Wysopal,Don't fear the tool. Fear the vulns. Police are alerting on @flipper_zero's potential for bypassing access control systems. I wouldn't call it a bypass. These are systems *missing* access control and relying on solely security by obscurity. https://t.co/53nFcdIIfS,原创,en,12,78,17,242,2023-08-03 14:25:12,2024-04-10 19:48:27,1687107351202172929,14090906,WeldPond,0,[],,['https://pbs.twimg.com/media/F2nONbcbsAAL2Jg.jpg'],
https://twitter.com/14090906/status/1686083214694400000,https://twitter.com/WeldPond,https://pbs.twimg.com/profile_images/1732479699748519937/5NQhmNOG_normal.jpg,,,Weld Pond | Chris Wysopal,"Nat. Cyber Workforce &amp; Education Strategy unveiled today

It includes integrating security by design, threat modeling, memory safe languages, privacy, standards, ethics, &amp; other elements of cybersecurity into computer science, SW engineering, &amp; operational technology courses!🙌",原创,en,2,2,0,7,2023-07-31 18:35:38,2024-04-10 19:48:27,1686083214694400000,14090906,WeldPond,0,[],,,
https://twitter.com/14090906/status/1685322955020992513,https://twitter.com/WeldPond,https://pbs.twimg.com/profile_images/1732479699748519937/5NQhmNOG_normal.jpg,,,Weld Pond | Chris Wysopal,"The Chinese code, the officials say, appears directed at ordinary utilities that serve both civilian populations and nearby military bases.  https://t.co/mtWM9ewWfK",原创,en,0,0,0,4,2023-07-29 16:14:38,2024-04-10 19:48:27,1685322955020992513,14090906,WeldPond,0,[],,,
https://twitter.com/14090906/status/1684652101647859713,https://twitter.com/WeldPond,https://pbs.twimg.com/profile_images/1732479699748519937/5NQhmNOG_normal.jpg,,,Weld Pond | Chris Wysopal,"StackOverflow announced Overflow AI. They said ""ensuring that trust &amp; attribution are at the core of what we build &amp; that people who contribute their knowledge are recognized for their efforts.""
Will we see a backlash against AI products built off the backs of content creators?",原创,en,1,0,0,5,2023-07-27 19:48:55,2024-04-10 19:48:27,1684652101647859713,14090906,WeldPond,0,[],,,
https://twitter.com/14090906/status/1684646566714392577,https://twitter.com/WeldPond,https://pbs.twimg.com/profile_images/1732479699748519937/5NQhmNOG_normal.jpg,,,Weld Pond | Chris Wysopal,What is the biggest AppSec/ProdSec pain point for developers?,原创,en,0,1,0,2,2023-07-27 19:26:55,2024-04-10 19:48:27,1684646566714392577,14090906,WeldPond,0,[],,,
https://twitter.com/14090906/status/1684576574438543361,https://twitter.com/WeldPond,https://pbs.twimg.com/profile_images/1732479699748519937/5NQhmNOG_normal.jpg,,,Weld Pond | Chris Wysopal,"Reminiscing about our community's unmatched journey with Kelly @aloria Lum, a dear infosec colleague, friend &amp; mentor who left an indelible mark. View this memorial video, a beautiful tribute to her vibrant spirit, recently showcased at @SummerC0n https://t.co/c6KX5LvBPS",原创,en,1,16,0,42,2023-07-27 14:48:47,2024-04-10 19:48:27,1684576574438543361,14090906,WeldPond,0,[],,,
https://twitter.com/14090906/status/1684233827793637377,https://twitter.com/WeldPond,https://pbs.twimg.com/profile_images/1732479699748519937/5NQhmNOG_normal.jpg,,,Weld Pond | Chris Wysopal,"SEC has adopted new regulations today which require public companies to disclose ""material breaches"" within 4 days. They can apply to the Attorney General for an extension if the disclosure would affect national security or public safety.",原创,en,6,61,7,87,2023-07-26 16:06:50,2024-04-10 19:48:27,1684233827793637377,14090906,WeldPond,0,[],,,
https://twitter.com/14090906/status/1724838194766909928,https://twitter.com/WeldPond,https://pbs.twimg.com/profile_images/1732479699748519937/5NQhmNOG_normal.jpg,,,Weld Pond | Chris Wysopal,Thrilled to be named a Cybersecurity Visionary by @CyberScoopNews! It's an honor to stand among such distinguished leaders and innovators in public sector cybersecurity. This award is a testament to our collective commitment to securing our digital world. https://t.co/hU2TOAkddu,原创,en,4,8,0,41,2023-11-15 17:14:06,2024-04-10 19:48:42,1724838194766909928,14090906,WeldPond,0,[],,['https://pbs.twimg.com/media/F-_bL6fbAAAm8aU.jpg'],
https://twitter.com/14090906/status/1684233827793637377,https://twitter.com/WeldPond,https://pbs.twimg.com/profile_images/1732479699748519937/5NQhmNOG_normal.jpg,,,Weld Pond | Chris Wysopal,"SEC has adopted new regulations today which require public companies to disclose ""material breaches"" within 4 days. They can apply to the Attorney General for an extension if the disclosure would affect national security or public safety.",原创,en,6,61,7,87,2023-07-26 16:06:50,2024-04-10 19:48:42,1684233827793637377,14090906,WeldPond,0,[],,,
