tweet_url,author_url,avatar_url,avatar_binary,topic,author_name,content,tweet_type,tweet_language,comment_count,retweet_count,quote_count,praise_count,publish_time,fetch_time,tweet_id,screen_id,screen_name,tourist_crawl_status,video_urls,original_author,tweet_img_url,tweet_img_binary
https://twitter.com/30757382/status/1448701621387603973,https://twitter.com/jtrevorhughes,https://pbs.twimg.com/profile_images/1037836434504380420/860WLhs-_normal.jpg,,,J Trevor Hughes,"The IAPP's Westin Fellowship program has helped to launch the careers of many #privacy leaders.  Here is some great stuff from Taylor Kay Lively, one of this year's fellows.  

Vaccine credential systems: Considerations for US employers https://t.co/j81geumY0D via @DailyDashboard",原创,en,0,4,1,8,2021-10-14 17:25:56,2024-04-10 22:02:27,1448701621387603973,30757382,jtrevorhughes,0,[],,,
https://twitter.com/30757382/status/1654234277754843137,https://twitter.com/jtrevorhughes,https://pbs.twimg.com/profile_images/1037836434504380420/860WLhs-_normal.jpg,,,J Trevor Hughes,"Canadian, Irish, Italian and Kiwi #privacy leaders hanging out in Auckland. The global reach and camaraderie of our profession is a special thing indeed. @PrivacyPros https://t.co/f6Gs8cIYBs",原创,en,1,5,1,23,2023-05-04 21:19:20,2024-04-10 22:02:43,1654234277754843137,30757382,jtrevorhughes,0,[],,['https://pbs.twimg.com/media/FvUFThQaYAEerp-.jpg'],
https://twitter.com/30757382/status/1448072751412092936,https://twitter.com/jtrevorhughes,https://pbs.twimg.com/profile_images/1037836434504380420/860WLhs-_normal.jpg,,,J Trevor Hughes,"Looking forward to participating next week at the 43rd Global Privacy Assembly!

Hosted by @INAImexico and @PrivacyAssembly

Register at 👉 https://t.co/UVcYMdcX3X",原创,en,0,0,0,4,2021-10-12 23:47:02,2024-04-10 22:02:43,1448072751412092936,30757382,jtrevorhughes,0,[],,,
https://twitter.com/30757382/status/1446509395312095244,https://twitter.com/jtrevorhughes,https://pbs.twimg.com/profile_images/1037836434504380420/860WLhs-_normal.jpg,,,J Trevor Hughes,"Team @PrivacyPros having some fun today with an in-house Top Chef competition.  Such a talented crew, and they bring amazing creativity to everything they do... https://t.co/nIPcjm8Ixx",原创,en,0,0,0,6,2021-10-08 16:14:49,2024-04-10 22:02:43,1446509395312095244,30757382,jtrevorhughes,0,[],,['https://pbs.twimg.com/media/FBMIj9BXsAA3c7m.jpg'],
https://twitter.com/30757382/status/1446473409601355782,https://twitter.com/jtrevorhughes,https://pbs.twimg.com/profile_images/1037836434504380420/860WLhs-_normal.jpg,,,J Trevor Hughes,"Just in case you were wondering...

PSR is a casual dress event in San Diego.  Jeans are in.  Wear a suit at your own peril.  

@JulesPolonetsky will be bringing some amazing shoe couture though...",原创,en,2,1,0,31,2021-10-08 13:51:49,2024-04-10 22:02:43,1446473409601355782,30757382,jtrevorhughes,0,[],,,
https://twitter.com/30757382/status/1446130037250408461,https://twitter.com/jtrevorhughes,https://pbs.twimg.com/profile_images/1037836434504380420/860WLhs-_normal.jpg,,,J Trevor Hughes,"""full-tilt hiring boogie""

We only use very precise legal terms in our articles for the IAPP.

https://t.co/iDyHEAOlXU",原创,en,0,0,1,4,2021-10-07 15:07:23,2024-04-10 22:02:43,1446130037250408461,30757382,jtrevorhughes,0,[],,,
https://twitter.com/30757382/status/1445410969690198017,https://twitter.com/jtrevorhughes,https://pbs.twimg.com/profile_images/1037836434504380420/860WLhs-_normal.jpg,,,J Trevor Hughes,"Backstage at yet another successful virtual offering from the IAPP.  Our members see and hear so many great thought leaders on our stages, but the team behind the scenes deserves recognition too.  Well done, Jamie!  @PrivacyPros @DailyDashboard https://t.co/FyPyUT856N",原创,en,0,1,0,22,2021-10-05 15:30:04,2024-04-10 22:02:43,1445410969690198017,30757382,jtrevorhughes,0,[],,['https://pbs.twimg.com/media/FA8hMchWUAcOIn_.jpg'],
https://twitter.com/30757382/status/1445083064330342401,https://twitter.com/jtrevorhughes,https://pbs.twimg.com/profile_images/1037836434504380420/860WLhs-_normal.jpg,,,J Trevor Hughes,"Very happy to announce that @cdfen is the IAPP's new Chief Knowledge Officer!  Congrats Caitlin!

Caitlin Fennessy to lead as IAPP VP, chief knowledge officer https://t.co/NaMjC8VD9d via @DailyDashboard",原创,en,1,6,1,34,2021-10-04 17:47:05,2024-04-10 22:02:43,1445083064330342401,30757382,jtrevorhughes,0,[],,,
https://twitter.com/30757382/status/1443973401509601300,https://twitter.com/jtrevorhughes,https://pbs.twimg.com/profile_images/1037836434504380420/860WLhs-_normal.jpg,,,J Trevor Hughes,"Many members don't know the amazing people inside the IAPP who make our org run every day. Let me share someone very special on the 1st day of retirement.  For 16 years, Margie Lesage has been the beating heart of our team.  Best wishes for huge adventures ahead! https://t.co/nMGsjVXKGl",原创,en,0,0,0,17,2021-10-01 16:17:41,2024-04-10 22:02:43,1443973401509601300,30757382,jtrevorhughes,0,[],,['https://pbs.twimg.com/media/FAoE_N1XoBgebqS.jpg'],
https://twitter.com/30757382/status/1443356379843072003,https://twitter.com/jtrevorhughes,https://pbs.twimg.com/profile_images/1037836434504380420/860WLhs-_normal.jpg,,,J Trevor Hughes,"And there's the IAPP's @cdfen, talking about our research and being brilliant in the WSJ!

Companies say legal certainty around surveillance and privacy are key to closer U.S.-EU economic ties  https://t.co/94hrymKRW7 via @WSJ",原创,en,0,3,1,12,2021-09-29 23:25:51,2024-04-10 22:02:43,1443356379843072003,30757382,jtrevorhughes,0,[],,,
https://twitter.com/30757382/status/1654234277754843137,https://twitter.com/jtrevorhughes,https://pbs.twimg.com/profile_images/1037836434504380420/860WLhs-_normal.jpg,,,J Trevor Hughes,"Canadian, Irish, Italian and Kiwi #privacy leaders hanging out in Auckland. The global reach and camaraderie of our profession is a special thing indeed. @PrivacyPros https://t.co/f6Gs8cIYBs",原创,en,1,5,1,23,2023-05-04 21:19:20,2024-04-10 22:02:57,1654234277754843137,30757382,jtrevorhughes,0,[],,['https://pbs.twimg.com/media/FvUFThQaYAEerp-.jpg'],
https://twitter.com/30757382/status/1440747119237730304,https://twitter.com/jtrevorhughes,https://pbs.twimg.com/profile_images/1037836434504380420/860WLhs-_normal.jpg,,,J Trevor Hughes,"The Chief Privacy Officers for @google (Keith Enright) @apple (@JaneCHorvath) and @Microsoft (@JulieSBrill) will be on our keynote stage at PSR in San Diego.  I'm moderating.  

What should I ask them?  

https://t.co/taZxIQEEOg",原创,en,6,4,2,23,2021-09-22 18:37:35,2024-04-10 22:02:57,1440747119237730304,30757382,jtrevorhughes,0,[],,,
https://twitter.com/30757382/status/1438072395399667714,https://twitter.com/jtrevorhughes,https://pbs.twimg.com/profile_images/1037836434504380420/860WLhs-_normal.jpg,,,J Trevor Hughes,Hey @OneTrust!  Your support of the @PrivacyPros Munich conference is hugely appreciated!  Thanks for being a gold sponsor. https://t.co/wmAIJwfN5d,原创,en,0,0,0,6,2021-09-15 09:29:11,2024-04-10 22:02:57,1438072395399667714,30757382,jtrevorhughes,0,[],,['https://pbs.twimg.com/media/E_UPOA5WUAQ3l-L.jpg'],
https://twitter.com/30757382/status/1438071784776081411,https://twitter.com/jtrevorhughes,https://pbs.twimg.com/profile_images/1037836434504380420/860WLhs-_normal.jpg,,,J Trevor Hughes,"Thanks to @bigidsecure and @dimitrisirota, a gold sponsor of our first event since the start of the pandemic.  Supporting the IAPP and our members! https://t.co/cqaSPxGi6e",原创,en,0,2,0,7,2021-09-15 09:26:46,2024-04-10 22:02:57,1438071784776081411,30757382,jtrevorhughes,0,[],,['https://pbs.twimg.com/media/E_UOqh4XMAY88rY.jpg'],
https://twitter.com/30757382/status/1438067796936740867,https://twitter.com/jtrevorhughes,https://pbs.twimg.com/profile_images/1037836434504380420/860WLhs-_normal.jpg,,,J Trevor Hughes,Day 2 in Munich. Lots of discussion on privacy management technology and how to handle the surge in work for #privacy pros. https://t.co/Zt28hmnhh3,原创,en,0,0,0,7,2021-09-15 09:10:55,2024-04-10 22:02:57,1438067796936740867,30757382,jtrevorhughes,0,[],,['https://pbs.twimg.com/media/E_ULCYLXoAMKvry.jpg'],
https://twitter.com/30757382/status/1654234277754843137,https://twitter.com/jtrevorhughes,https://pbs.twimg.com/profile_images/1037836434504380420/860WLhs-_normal.jpg,,,J Trevor Hughes,"Canadian, Irish, Italian and Kiwi #privacy leaders hanging out in Auckland. The global reach and camaraderie of our profession is a special thing indeed. @PrivacyPros https://t.co/f6Gs8cIYBs",原创,en,1,5,1,23,2023-05-04 21:19:20,2024-04-10 22:03:14,1654234277754843137,30757382,jtrevorhughes,0,[],,['https://pbs.twimg.com/media/FvUFThQaYAEerp-.jpg'],
https://twitter.com/30757382/status/1437684999168405513,https://twitter.com/jtrevorhughes,https://pbs.twimg.com/profile_images/1037836434504380420/860WLhs-_normal.jpg,,,J Trevor Hughes,"Heard at the IAPP event in Munich:  DPA enforcement activity top three countries: (1) Germany, (2) Ireland, (3) Netherlands.  

Many here are reporting huge increases in smaller fines/complaints.  

Workload for #privacy teams becoming an issue.  Hiring is still a challenge.",原创,en,1,0,0,5,2021-09-14 07:49:49,2024-04-10 22:03:14,1437684999168405513,30757382,jtrevorhughes,0,[],,,
https://twitter.com/30757382/status/1437677330902700036,https://twitter.com/jtrevorhughes,https://pbs.twimg.com/profile_images/1037836434504380420/860WLhs-_normal.jpg,,,J Trevor Hughes,"IAPP Data Protection Intensive in Munich!  Suits!  Name Badges!  Colleagues!  Coffee and jet lag!

The band is back together and we are on the road!

#privacy #gdpr @PrivacyPros https://t.co/F6u4ZxPe2c",原创,en,1,0,0,26,2021-09-14 07:19:21,2024-04-10 22:03:14,1437677330902700036,30757382,jtrevorhughes,0,[],,"['https://pbs.twimg.com/media/E_OnSDUXMAYLEZa.jpg', 'https://pbs.twimg.com/media/E_OnSDNXoAAoUtJ.jpg', 'https://pbs.twimg.com/media/E_OnSDSWQAMpDu9.jpg', 'https://pbs.twimg.com/media/E_OnbhrXoAMcaMK.jpg']",
https://twitter.com/30757382/status/1436738211208998920,https://twitter.com/jtrevorhughes,https://pbs.twimg.com/profile_images/1037836434504380420/860WLhs-_normal.jpg,,,J Trevor Hughes,"I am thinking today of Elise Berkower, a good friend and amazing privacy pro.  Her apartment was adjacent to the WTC buildings.  Months later, when she could finally return, she found everything covered in ash and dust.

Elise passed away 4 years ago.  I miss her still.",原创,en,0,1,1,19,2021-09-11 17:07:37,2024-04-10 22:03:14,1436738211208998920,30757382,jtrevorhughes,0,[],,,
https://twitter.com/30757382/status/1436362241541029892,https://twitter.com/jtrevorhughes,https://pbs.twimg.com/profile_images/1037836434504380420/860WLhs-_normal.jpg,,,J Trevor Hughes,"The IAPP's Editorial Director, @JedBracy, on the legacy of 9/11 and intersections with privacy and our shared humanity.  Worth a read for all #privacy pros.

Privacy and our humanity: Reflections on 9/11 after 20 years https://t.co/8E72vAZqPc via @DailyDashboard",原创,en,0,3,0,4,2021-09-10 16:13:39,2024-04-10 22:03:14,1436362241541029892,30757382,jtrevorhughes,0,[],,,
https://twitter.com/30757382/status/1435706852705177603,https://twitter.com/jtrevorhughes,https://pbs.twimg.com/profile_images/1037836434504380420/860WLhs-_normal.jpg,,,J Trevor Hughes,An IAPP staff meeting!  In our offices!  With real people!   @PrivacyPros https://t.co/52pPRkh46Y,原创,en,3,4,0,35,2021-09-08 20:49:22,2024-04-10 22:03:14,1435706852705177603,30757382,jtrevorhughes,0,[],,['https://pbs.twimg.com/media/E-ynoW3WUAgovPW.jpg'],
https://twitter.com/30757382/status/1435250525935702019,https://twitter.com/jtrevorhughes,https://pbs.twimg.com/profile_images/1037836434504380420/860WLhs-_normal.jpg,,,J Trevor Hughes,"Gotta love the @nytimes seeing the value in the work of the @PrivacyPros -- our state law tracker on the big stage!

The State of Consumer Data Privacy Laws in the US (And Why It Matters) | Wirecutter https://t.co/ypduNngy9O via @wirecutter",原创,en,2,31,1,87,2021-09-07 14:36:05,2024-04-10 22:03:14,1435250525935702019,30757382,jtrevorhughes,0,[],,,
https://twitter.com/30757382/status/1654234277754843137,https://twitter.com/jtrevorhughes,https://pbs.twimg.com/profile_images/1037836434504380420/860WLhs-_normal.jpg,,,J Trevor Hughes,"Canadian, Irish, Italian and Kiwi #privacy leaders hanging out in Auckland. The global reach and camaraderie of our profession is a special thing indeed. @PrivacyPros https://t.co/f6Gs8cIYBs",原创,en,1,5,1,23,2023-05-04 21:19:20,2024-04-10 22:03:28,1654234277754843137,30757382,jtrevorhughes,0,[],,['https://pbs.twimg.com/media/FvUFThQaYAEerp-.jpg'],
https://twitter.com/30757382/status/1427945682023952387,https://twitter.com/jtrevorhughes,https://pbs.twimg.com/profile_images/1037836434504380420/860WLhs-_normal.jpg,,,J Trevor Hughes,"This could be the week for a new #privacy law in China.

Chinese regulators are tightening rules on protecting personal data, as the world’s largest internet population awakens to privacy concerns  https://t.co/mAx7hLbjHr via @WSJ",原创,en,1,7,0,8,2021-08-18 10:49:15,2024-04-10 22:03:28,1427945682023952387,30757382,jtrevorhughes,0,[],,,
https://twitter.com/30757382/status/1425814246823276544,https://twitter.com/jtrevorhughes,https://pbs.twimg.com/profile_images/1037836434504380420/860WLhs-_normal.jpg,,,J Trevor Hughes,"A great weekend read for #privacy pros.  @PrivacyPros 

But, she added, “you must also have the right not to know.”

Piecing Together the History of Stasi Spying 
https://t.co/JTM1ksXrkk",原创,en,0,1,0,4,2021-08-12 13:39:41,2024-04-10 22:03:28,1425814246823276544,30757382,jtrevorhughes,0,[],,,
https://twitter.com/30757382/status/1425157840025657347,https://twitter.com/jtrevorhughes,https://pbs.twimg.com/profile_images/1037836434504380420/860WLhs-_normal.jpg,,,J Trevor Hughes,"SCC transfer templates for IAPP members.  The stuff you need to get stuff done in #privacy.

https://t.co/xYB2EEWBsY",原创,en,0,1,0,11,2021-08-10 18:11:21,2024-04-10 22:03:28,1425157840025657347,30757382,jtrevorhughes,0,[],,,
https://twitter.com/30757382/status/1654234277754843137,https://twitter.com/jtrevorhughes,https://pbs.twimg.com/profile_images/1037836434504380420/860WLhs-_normal.jpg,,,J Trevor Hughes,"Canadian, Irish, Italian and Kiwi #privacy leaders hanging out in Auckland. The global reach and camaraderie of our profession is a special thing indeed. @PrivacyPros https://t.co/f6Gs8cIYBs",原创,en,1,5,1,23,2023-05-04 21:19:20,2024-04-10 22:03:43,1654234277754843137,30757382,jtrevorhughes,0,[],,['https://pbs.twimg.com/media/FvUFThQaYAEerp-.jpg'],
https://twitter.com/30757382/status/1424778344885886979,https://twitter.com/jtrevorhughes,https://pbs.twimg.com/profile_images/1037836434504380420/860WLhs-_normal.jpg,,,J Trevor Hughes,"Assessing the private right of action in the CCPA.  More great content from the IAPP.

https://t.co/bgCLx3liPT",原创,en,0,3,0,4,2021-08-09 17:03:23,2024-04-10 22:03:43,1424778344885886979,30757382,jtrevorhughes,0,[],,,
https://twitter.com/30757382/status/1417462068043735041,https://twitter.com/jtrevorhughes,https://pbs.twimg.com/profile_images/1037836434504380420/860WLhs-_normal.jpg,,,J Trevor Hughes,"Very excited that @codedbias director, Shalini Kantayya, will be keynoting at #PSR21 in San Diego!

https://t.co/czxkjGkQd1",原创,en,0,6,0,7,2021-07-20 12:31:06,2024-04-10 22:03:43,1417462068043735041,30757382,jtrevorhughes,0,[],,,
https://twitter.com/30757382/status/1654234277754843137,https://twitter.com/jtrevorhughes,https://pbs.twimg.com/profile_images/1037836434504380420/860WLhs-_normal.jpg,,,J Trevor Hughes,"Canadian, Irish, Italian and Kiwi #privacy leaders hanging out in Auckland. The global reach and camaraderie of our profession is a special thing indeed. @PrivacyPros https://t.co/f6Gs8cIYBs",原创,en,1,5,1,23,2023-05-04 21:19:20,2024-04-10 22:03:57,1654234277754843137,30757382,jtrevorhughes,0,[],,['https://pbs.twimg.com/media/FvUFThQaYAEerp-.jpg'],
https://twitter.com/30757382/status/1415343826894573571,https://twitter.com/jtrevorhughes,https://pbs.twimg.com/profile_images/1037836434504380420/860WLhs-_normal.jpg,,,J Trevor Hughes,"Hey #privacy pros:  buy some popcorn, bring a pencil and notebook, and join us for a fascinating conversation tomorrow.  @cdfen @maxschrems @EUstaran discussing Schrems II, one year on.

https://t.co/h0SE72lvOP",原创,en,0,2,0,1,2021-07-14 16:13:58,2024-04-10 22:03:57,1415343826894573571,30757382,jtrevorhughes,0,[],,,
https://twitter.com/30757382/status/1413182788682059781,https://twitter.com/jtrevorhughes,https://pbs.twimg.com/profile_images/1037836434504380420/860WLhs-_normal.jpg,,,J Trevor Hughes,"Senator Blumenthal: “The rest of the world is leaving us behind.”  

‘Deeply alarmed’: China now ahead of U.S. on privacy law https://t.co/hWqP87p0ni via @politico",原创,en,2,1,0,1,2021-07-08 17:06:47,2024-04-10 22:03:57,1413182788682059781,30757382,jtrevorhughes,0,[],,,
https://twitter.com/30757382/status/1654234277754843137,https://twitter.com/jtrevorhughes,https://pbs.twimg.com/profile_images/1037836434504380420/860WLhs-_normal.jpg,,,J Trevor Hughes,"Canadian, Irish, Italian and Kiwi #privacy leaders hanging out in Auckland. The global reach and camaraderie of our profession is a special thing indeed. @PrivacyPros https://t.co/f6Gs8cIYBs",原创,en,1,5,1,23,2023-05-04 21:19:20,2024-04-10 22:04:13,1654234277754843137,30757382,jtrevorhughes,0,[],,['https://pbs.twimg.com/media/FvUFThQaYAEerp-.jpg'],
https://twitter.com/30757382/status/1407679344869269510,https://twitter.com/jtrevorhughes,https://pbs.twimg.com/profile_images/1037836434504380420/860WLhs-_normal.jpg,,,J Trevor Hughes,"Hey #privacy pros!  Registration for #PSR21, an actual, in-person, live-not-virtual, event is NOW OPEN!  

We cannot wait to see you all again!

https://t.co/Sgm3Z06ZE0",原创,en,0,2,1,9,2021-06-23 12:38:03,2024-04-10 22:04:13,1407679344869269510,30757382,jtrevorhughes,0,[],,,
https://twitter.com/30757382/status/1407463744121212932,https://twitter.com/jtrevorhughes,https://pbs.twimg.com/profile_images/1037836434504380420/860WLhs-_normal.jpg,,,J Trevor Hughes,"""a risk-based approach with teeth""

Yikes.

EDPB's data transfer recommendations adopt a risk-based approach with teeth https://t.co/jdEPNMKiy4 via @DailyDashboard",原创,en,1,3,0,7,2021-06-22 22:21:20,2024-04-10 22:04:13,1407463744121212932,30757382,jtrevorhughes,0,[],,,
https://twitter.com/30757382/status/1404849680261996544,https://twitter.com/jtrevorhughes,https://pbs.twimg.com/profile_images/1037836434504380420/860WLhs-_normal.jpg,,,J Trevor Hughes,"#Privacy pro salary survey now out!  Great research, led by @mugefz.  @PrivacyPros 

https://t.co/D3oTNSw8VR",原创,en,1,1,0,7,2021-06-15 17:13:59,2024-04-10 22:04:13,1404849680261996544,30757382,jtrevorhughes,0,[],,,
https://twitter.com/30757382/status/1654234277754843137,https://twitter.com/jtrevorhughes,https://pbs.twimg.com/profile_images/1037836434504380420/860WLhs-_normal.jpg,,,J Trevor Hughes,"Canadian, Irish, Italian and Kiwi #privacy leaders hanging out in Auckland. The global reach and camaraderie of our profession is a special thing indeed. @PrivacyPros https://t.co/f6Gs8cIYBs",原创,en,1,5,1,23,2023-05-04 21:19:20,2024-04-10 22:04:29,1654234277754843137,30757382,jtrevorhughes,0,[],,['https://pbs.twimg.com/media/FvUFThQaYAEerp-.jpg'],
https://twitter.com/30757382/status/1404814945234083841,https://twitter.com/jtrevorhughes,https://pbs.twimg.com/profile_images/1037836434504380420/860WLhs-_normal.jpg,,,J Trevor Hughes,"""the incident emitted an unexpected ray of light on the integral role privacy plays in our humanity""

The human truth of #privacy was on display this weekend.  Take the time to read this thoughtful essay by the IAPP's @JedBracy 

https://t.co/NoQWtDTsum via @DailyDashboard",原创,en,0,1,0,2,2021-06-15 14:55:57,2024-04-10 22:04:29,1404814945234083841,30757382,jtrevorhughes,0,[],,,
https://twitter.com/30757382/status/1404502832456376328,https://twitter.com/jtrevorhughes,https://pbs.twimg.com/profile_images/1037836434504380420/860WLhs-_normal.jpg,,,J Trevor Hughes,"A great profile of IAPP board chair, Patrice Ettinger, on her CPO role at @pfizer and how the pandemic changed her perspective on her job.  Also, a nice shout out to @HilaryDataLaw 

'You really feel the enormity of what we are doing' 

https://t.co/klyzNZmOnF",原创,en,0,4,0,5,2021-06-14 18:15:44,2024-04-10 22:04:29,1404502832456376328,30757382,jtrevorhughes,0,[],,,
https://twitter.com/30757382/status/1404392456116916228,https://twitter.com/jtrevorhughes,https://pbs.twimg.com/profile_images/1037836434504380420/860WLhs-_normal.jpg,,,J Trevor Hughes,"23 events on the IAPP Calendar this week.  SCCs, leadership development, Profile in Privacy with @pfizer CPO, ... and so much more.  Join us!

https://t.co/qyV8DzZgEQ",原创,en,0,1,0,6,2021-06-14 10:57:08,2024-04-10 22:04:29,1404392456116916228,30757382,jtrevorhughes,0,[],,,
https://twitter.com/30757382/status/1403065087674421249,https://twitter.com/jtrevorhughes,https://pbs.twimg.com/profile_images/1037836434504380420/860WLhs-_normal.jpg,,,J Trevor Hughes,"To recap the last week in #privacy:  new SCCs, new Colorado law, major announcements from @Apple, $425mm proposed fine for @amazon, new security law in China, US and EU working on tech policy, EU taking legal action against Belgium for DPA independence.

Gasp.",原创,en,2,26,4,57,2021-06-10 19:02:39,2024-04-10 22:04:29,1403065087674421249,30757382,jtrevorhughes,0,[],,,
https://twitter.com/30757382/status/1402997288314675207,https://twitter.com/jtrevorhughes,https://pbs.twimg.com/profile_images/1037836434504380420/860WLhs-_normal.jpg,,,J Trevor Hughes,"#GDPR fines are no joke.

A European Union privacy regulator has proposed a fine of more than $425 million against Amazon, part of a process that could yield the biggest-yet penalty under the bloc’s privacy law https://t.co/ADzTXsI0oB via @WSJ",原创,en,1,3,1,3,2021-06-10 14:33:14,2024-04-10 22:04:29,1402997288314675207,30757382,jtrevorhughes,0,[],,,
https://twitter.com/30757382/status/1402625556533977088,https://twitter.com/jtrevorhughes,https://pbs.twimg.com/profile_images/1037836434504380420/860WLhs-_normal.jpg,,,J Trevor Hughes,"The IAPP's @omertene on the effect of the #GDPR on global orgs and the US marketplace (hint: it has been massive).

The EU privacy law's track record https://t.co/6ASNmfHYDZ",原创,en,0,4,1,17,2021-06-09 13:56:06,2024-04-10 22:04:29,1402625556533977088,30757382,jtrevorhughes,0,[],,,
https://twitter.com/30757382/status/1654234277754843137,https://twitter.com/jtrevorhughes,https://pbs.twimg.com/profile_images/1037836434504380420/860WLhs-_normal.jpg,,,J Trevor Hughes,"Canadian, Irish, Italian and Kiwi #privacy leaders hanging out in Auckland. The global reach and camaraderie of our profession is a special thing indeed. @PrivacyPros https://t.co/f6Gs8cIYBs",原创,en,1,5,1,23,2023-05-04 21:19:20,2024-04-10 22:06:07,1654234277754843137,30757382,jtrevorhughes,0,[],,['https://pbs.twimg.com/media/FvUFThQaYAEerp-.jpg'],
https://twitter.com/30757382/status/1402350716933509120,https://twitter.com/jtrevorhughes,https://pbs.twimg.com/profile_images/1037836434504380420/860WLhs-_normal.jpg,,,J Trevor Hughes,"Hey privacy pros!  PSR registration is opening on June 21st.  An actual, in-person, #privacy conference!  San Diego better get ready...

https://t.co/taZxIQn3WI",原创,en,1,4,2,22,2021-06-08 19:43:59,2024-04-10 22:06:07,1402350716933509120,30757382,jtrevorhughes,0,[],,,
https://twitter.com/30757382/status/1402317801155706883,https://twitter.com/jtrevorhughes,https://pbs.twimg.com/profile_images/1037836434504380420/860WLhs-_normal.jpg,,,J Trevor Hughes,"#Privacy is hiring! 

But how do you get on the path to your dream #privacy job?  Education.  Education.  Education.

To help, the IAPP has launched the Global Guide to Privacy in Academia.  NOTE that this is just a start!  We welcome additions and edits.

https://t.co/6Ma6oZs9I5",原创,en,0,4,0,6,2021-06-08 17:33:12,2024-04-10 22:06:07,1402317801155706883,30757382,jtrevorhughes,0,[],,,
https://twitter.com/30757382/status/1402014071667499014,https://twitter.com/jtrevorhughes,https://pbs.twimg.com/profile_images/1037836434504380420/860WLhs-_normal.jpg,,,J Trevor Hughes,"#Privacy pros: New SCCs are calling. US state law is boiling over. Enforcement is escalating daily...

... but watch platforms closely. They will shape the future of privacy as much as any policy maker, advocate, or plaintiff's lawyer.

 https://t.co/2JSZx70xER",原创,en,0,1,0,3,2021-06-07 21:26:17,2024-04-10 22:06:07,1402014071667499014,30757382,jtrevorhughes,0,[],,,
https://twitter.com/30757382/status/1400425148608618506,https://twitter.com/jtrevorhughes,https://pbs.twimg.com/profile_images/1037836434504380420/860WLhs-_normal.jpg,,,J Trevor Hughes,"""He said the goal was to avoid ""Schrems III"".""

More safeguards in revamped EU data transfer tools, EU justice chief says https://t.co/jlT9xsm8PT",原创,en,0,1,0,3,2021-06-03 12:12:28,2024-04-10 22:06:07,1400425148608618506,30757382,jtrevorhughes,0,[],,,
https://twitter.com/30757382/status/1654234277754843137,https://twitter.com/jtrevorhughes,https://pbs.twimg.com/profile_images/1037836434504380420/860WLhs-_normal.jpg,,,J Trevor Hughes,"Canadian, Irish, Italian and Kiwi #privacy leaders hanging out in Auckland. The global reach and camaraderie of our profession is a special thing indeed. @PrivacyPros https://t.co/f6Gs8cIYBs",原创,en,1,5,1,23,2023-05-04 21:19:20,2024-04-10 22:06:22,1654234277754843137,30757382,jtrevorhughes,0,[],,['https://pbs.twimg.com/media/FvUFThQaYAEerp-.jpg'],
