tweet_url,author_url,avatar_url,avatar_binary,topic,author_name,content,tweet_type,tweet_language,comment_count,retweet_count,quote_count,praise_count,publish_time,fetch_time,tweet_id,screen_id,screen_name,tourist_crawl_status,video_urls,original_author,tweet_img_url,tweet_img_binary
https://twitter.com/1134334789/status/1085323829029814272,https://twitter.com/KonstantHacker,https://pbs.twimg.com/profile_images/1337469588720799749/aEOmnHTF_normal.jpg,,,Konstantinos Karagiannis,"IBM launching a ""commercial"" quantum computer at CES is a big mood. https://t.co/4aTH4FQg03",原创,en,0,0,0,2,2019-01-15 23:52:19,2024-04-11 11:39:02,1085323829029814272,1134334789,KonstantHacker,0,[],,,
https://twitter.com/1134334789/status/1082016445859536900,https://twitter.com/KonstantHacker,https://pbs.twimg.com/profile_images/1337469588720799749/aEOmnHTF_normal.jpg,,,Konstantinos Karagiannis,"@Nic_Pare Be sure to watch @taylorswift13 ""...Ready for It?"" video, too. It has a wonderful example of AI breaking out. And I love her, so there's that :)",原创,en,0,0,0,0,2019-01-06 20:49:58,2024-04-11 11:39:02,1082016445859536900,1134334789,KonstantHacker,0,[],,,
https://twitter.com/1134334789/status/1080585544705429504,https://twitter.com/KonstantHacker,https://pbs.twimg.com/profile_images/1337469588720799749/aEOmnHTF_normal.jpg,,,Konstantinos Karagiannis,When a hacking attack showcases a vulnerability and forces you to watch really awful content https://t.co/2vVvxCGRgV,原创,en,0,0,0,0,2019-01-02 22:04:04,2024-04-11 11:39:02,1080585544705429504,1134334789,KonstantHacker,0,[],,,
https://twitter.com/1134334789/status/1073723736182964229,https://twitter.com/KonstantHacker,https://pbs.twimg.com/profile_images/1337469588720799749/aEOmnHTF_normal.jpg,,,Konstantinos Karagiannis,A 79-qubit quantum computer ... with a nice number of qubits that can actually be gated with each other at any time https://t.co/DXISc21i5z,原创,en,0,0,0,0,2018-12-14 23:37:42,2024-04-11 11:39:03,1073723736182964229,1134334789,KonstantHacker,0,[],,,
https://twitter.com/1134334789/status/1073239882426998785,https://twitter.com/KonstantHacker,https://pbs.twimg.com/profile_images/1337469588720799749/aEOmnHTF_normal.jpg,,,Konstantinos Karagiannis,Low ETH prices are not slowing attempts at hacking miners https://t.co/NAo4hC8YoB,原创,en,0,0,0,0,2018-12-13 15:35:02,2024-04-11 11:39:03,1073239882426998785,1134334789,KonstantHacker,0,[],,,
https://twitter.com/1134334789/status/1069298151880908801,https://twitter.com/KonstantHacker,https://pbs.twimg.com/profile_images/1337469588720799749/aEOmnHTF_normal.jpg,,,Konstantinos Karagiannis,North Korea is heading into uncharted nation-state hacking territory: going after individual cryptocurrency investors https://t.co/TONQkjdaNl,原创,en,0,1,0,0,2018-12-02 18:32:00,2024-04-11 11:39:03,1069298151880908801,1134334789,KonstantHacker,0,[],,,
https://twitter.com/1134334789/status/1069297329663082501,https://twitter.com/KonstantHacker,https://pbs.twimg.com/profile_images/1337469588720799749/aEOmnHTF_normal.jpg,,,Konstantinos Karagiannis,NEO hacking vuln brings a new way to steal cryptocurrency tokens remotely https://t.co/FAvIyKouqf,原创,en,0,0,0,0,2018-12-02 18:28:44,2024-04-11 11:39:19,1069297329663082501,1134334789,KonstantHacker,0,[],,,
https://twitter.com/1134334789/status/1065057051708178433,https://twitter.com/KonstantHacker,https://pbs.twimg.com/profile_images/1337469588720799749/aEOmnHTF_normal.jpg,,,Konstantinos Karagiannis,Just got my #RSAC acceptance emails. I'll be giving 2 talks in March! So psyched.,原创,en,2,3,0,16,2018-11-21 01:39:23,2024-04-11 11:39:19,1065057051708178433,1134334789,KonstantHacker,0,[],,,
https://twitter.com/1134334789/status/1063465297930268673,https://twitter.com/KonstantHacker,https://pbs.twimg.com/profile_images/1337469588720799749/aEOmnHTF_normal.jpg,,,Konstantinos Karagiannis,When explaining if we hit an AI Singularity I can look like I'm breaking uncomfortable news... https://t.co/RWeAOWAw6I,原创,en,0,0,0,3,2018-11-16 16:14:19,2024-04-11 11:39:20,1063465297930268673,1134334789,KonstantHacker,0,[],,['https://pbs.twimg.com/media/DsIv9GVVYAAwzZU.jpg'],
https://twitter.com/1134334789/status/1063104295720153088,https://twitter.com/KonstantHacker,https://pbs.twimg.com/profile_images/1337469588720799749/aEOmnHTF_normal.jpg,,,Konstantinos Karagiannis,Not sure how well you'd sleep at night (literally) if you're staying in a luxury hotel room obtained from hacking https://t.co/XvrGcVPoRF,原创,en,0,0,0,1,2018-11-15 16:19:50,2024-04-11 11:39:20,1063104295720153088,1134334789,KonstantHacker,0,[],,,
https://twitter.com/1134334789/status/1062921223829635072,https://twitter.com/KonstantHacker,https://pbs.twimg.com/profile_images/1337469588720799749/aEOmnHTF_normal.jpg,,,Konstantinos Karagiannis,If a superintelligence-level AI appears the first thing it will do to hide its existence is convince us that AI is a dead field https://t.co/gQJHtMcNTr,原创,en,4,0,0,0,2018-11-15 04:12:22,2024-04-11 11:39:20,1062921223829635072,1134334789,KonstantHacker,0,[],,,
https://twitter.com/1134334789/status/1062919754325864448,https://twitter.com/KonstantHacker,https://pbs.twimg.com/profile_images/1337469588720799749/aEOmnHTF_normal.jpg,,,Konstantinos Karagiannis,Wacky goings on at Facebook. Privacy activists take note. InfoSec folks take note. Divorce lawyers hoping for consistent customers take note. https://t.co/sB61ydwp0d,原创,en,0,0,0,0,2018-11-15 04:06:32,2024-04-11 11:39:20,1062919754325864448,1134334789,KonstantHacker,0,[],,,
https://twitter.com/1134334789/status/1062380349584490496,https://twitter.com/KonstantHacker,https://pbs.twimg.com/profile_images/1337469588720799749/aEOmnHTF_normal.jpg,,,Konstantinos Karagiannis,"If the ""free energy principle"" helps explain human consciousness, can it help us with artificial intelligence? https://t.co/SblD5hywQb",原创,en,0,0,0,0,2018-11-13 16:23:08,2024-04-11 11:39:20,1062380349584490496,1134334789,KonstantHacker,0,[],,,
https://twitter.com/1134334789/status/1062378199336841216,https://twitter.com/KonstantHacker,https://pbs.twimg.com/profile_images/1337469588720799749/aEOmnHTF_normal.jpg,,,Konstantinos Karagiannis,"There are a lot of spyware vendors helping law enforcement (and, wow, anyone with money) to bypass encrypted comms https://t.co/fb9xVjrpUH",原创,en,0,0,0,1,2018-11-13 16:14:35,2024-04-11 11:39:20,1062378199336841216,1134334789,KonstantHacker,0,[],,,
https://twitter.com/1134334789/status/1060557004580642816,https://twitter.com/KonstantHacker,https://pbs.twimg.com/profile_images/1337469588720799749/aEOmnHTF_normal.jpg,,,Konstantinos Karagiannis,Will EY bring zero-knowledge proof transactions to Ethereum first? https://t.co/BwraZZlwyC,原创,en,0,0,0,0,2018-11-08 15:37:48,2024-04-11 11:39:20,1060557004580642816,1134334789,KonstantHacker,0,[],,,
https://twitter.com/1134334789/status/1059840036919746560,https://twitter.com/KonstantHacker,https://pbs.twimg.com/profile_images/1337469588720799749/aEOmnHTF_normal.jpg,,,Konstantinos Karagiannis,Jobs will be lost and gained as a result of AI in 2019. Same as every year with every technology in the last century. https://t.co/CNzVV5efnZ,原创,en,0,0,0,1,2018-11-06 16:08:50,2024-04-11 11:39:20,1059840036919746560,1134334789,KonstantHacker,0,[],,,
https://twitter.com/1134334789/status/1059838825642516483,https://twitter.com/KonstantHacker,https://pbs.twimg.com/profile_images/1337469588720799749/aEOmnHTF_normal.jpg,,,Konstantinos Karagiannis,Chinese #ArtificialIntelligence benefits from massive training datasets we don't quite gather in the West #AI https://t.co/HQiRiXVxGl,原创,en,0,1,0,4,2018-11-06 16:04:01,2024-04-11 11:39:20,1059838825642516483,1134334789,KonstantHacker,0,[],,,
https://twitter.com/1134334789/status/1059826612642963456,https://twitter.com/KonstantHacker,https://pbs.twimg.com/profile_images/1337469588720799749/aEOmnHTF_normal.jpg,,,Konstantinos Karagiannis,BitLocker encryption is pretty great ... if Windows 10 actually uses it! SSD users beware. https://t.co/tsMDIY2xn9,原创,en,0,0,0,0,2018-11-06 15:15:29,2024-04-11 11:39:20,1059826612642963456,1134334789,KonstantHacker,0,[],,,
https://twitter.com/1134334789/status/1059825363323441153,https://twitter.com/KonstantHacker,https://pbs.twimg.com/profile_images/1337469588720799749/aEOmnHTF_normal.jpg,,,Konstantinos Karagiannis,Could the claim of election hacking be just as damaging as the real thing? https://t.co/dtxDzvBGPl,原创,en,1,0,0,0,2018-11-06 15:10:31,2024-04-11 11:39:20,1059825363323441153,1134334789,KonstantHacker,0,[],,,
https://twitter.com/1134334789/status/1059822619426463744,https://twitter.com/KonstantHacker,https://pbs.twimg.com/profile_images/1337469588720799749/aEOmnHTF_normal.jpg,,,Konstantinos Karagiannis,"If you're happy with how the last #ElectionDay went, by all means stay home. There's no need to #govote ... You've earned a rest for a job well done.",原创,en,0,0,0,1,2018-11-06 14:59:37,2024-04-11 11:39:20,1059822619426463744,1134334789,KonstantHacker,0,[],,,
https://twitter.com/1134334789/status/1059571749870755840,https://twitter.com/KonstantHacker,https://pbs.twimg.com/profile_images/1337469588720799749/aEOmnHTF_normal.jpg,,,Konstantinos Karagiannis,"We all want quantum supremacy, so bring on the odd alliances to get there https://t.co/BatEdsA01n",原创,en,0,0,0,0,2018-11-05 22:22:45,2024-04-11 11:39:20,1059571749870755840,1134334789,KonstantHacker,0,[],,,
https://twitter.com/1134334789/status/1057333390951600128,https://twitter.com/KonstantHacker,https://pbs.twimg.com/profile_images/1337469588720799749/aEOmnHTF_normal.jpg,,,Konstantinos Karagiannis,Pantheon Core is an enterprise Ethereum client that plans on bringing Quorum-like features in a future release https://t.co/4BfzvLkb0Q,原创,en,0,1,0,0,2018-10-30 18:08:19,2024-04-11 11:39:20,1057333390951600128,1134334789,KonstantHacker,0,[],,,
https://twitter.com/1134334789/status/1057322101256777728,https://twitter.com/KonstantHacker,https://pbs.twimg.com/profile_images/1337469588720799749/aEOmnHTF_normal.jpg,,,Konstantinos Karagiannis,"A high-level overview of the U.K.’s regulatory approach to cryptocurrencies and distributed ledger technology (DLT) in the financial services industry

https://t.co/1ZhwXAEVBG",原创,en,0,0,0,0,2018-10-30 17:23:27,2024-04-11 11:39:32,1057322101256777728,1134334789,KonstantHacker,0,[],,,
https://twitter.com/1134334789/status/1057307707428941824,https://twitter.com/KonstantHacker,https://pbs.twimg.com/profile_images/1337469588720799749/aEOmnHTF_normal.jpg,,,Konstantinos Karagiannis,Can we finally claim quantum computing supremacy? Math may help... https://t.co/CYSynJzSNa,原创,en,0,0,0,0,2018-10-30 16:26:15,2024-04-11 11:39:32,1057307707428941824,1134334789,KonstantHacker,0,[],,,
https://twitter.com/1134334789/status/1057306128894242818,https://twitter.com/KonstantHacker,https://pbs.twimg.com/profile_images/1337469588720799749/aEOmnHTF_normal.jpg,,,Konstantinos Karagiannis,"Top risks executives associate with AI:
Cybersecurity vulns
Making the wrong strategic decisions based on AI
Legal responsibilities for decisions made by AI
AI failure in a life-or-death context

https://t.co/l4dpehQzxN",原创,en,0,2,0,3,2018-10-30 16:19:59,2024-04-11 11:39:32,1057306128894242818,1134334789,KonstantHacker,0,[],,,
https://twitter.com/1134334789/status/1057305573710979072,https://twitter.com/KonstantHacker,https://pbs.twimg.com/profile_images/1337469588720799749/aEOmnHTF_normal.jpg,,,Konstantinos Karagiannis,"Google says there isn't much election hacking going on. You heard it straight from ... uh, wait. Google?  https://t.co/6UITrKaDjm",原创,en,0,1,0,3,2018-10-30 16:17:47,2024-04-11 11:39:32,1057305573710979072,1134334789,KonstantHacker,0,[],,,
https://twitter.com/1134334789/status/1057036544228286464,https://twitter.com/KonstantHacker,https://pbs.twimg.com/profile_images/1337469588720799749/aEOmnHTF_normal.jpg,,,Konstantinos Karagiannis,Folks starting to filter in #ISFCongress2018 https://t.co/fFLs33NGOS,原创,en,0,0,0,9,2018-10-29 22:28:45,2024-04-11 11:39:32,1057036544228286464,1134334789,KonstantHacker,0,[],,['https://pbs.twimg.com/media/DqtZHmMX4AA2P_V.jpg'],
https://twitter.com/1134334789/status/1056968339090694149,https://twitter.com/KonstantHacker,https://pbs.twimg.com/profile_images/1337469588720799749/aEOmnHTF_normal.jpg,,,Konstantinos Karagiannis,"Today my keynote at the #isfcongress2018 will be ""Have We Reached 'A' Singularity?"" If I'm correct, something will take over my talk halfway through...",原创,en,0,2,0,6,2018-10-29 17:57:44,2024-04-11 11:39:32,1056968339090694149,1134334789,KonstantHacker,0,[],,,
https://twitter.com/1134334789/status/1056961889593286656,https://twitter.com/KonstantHacker,https://pbs.twimg.com/profile_images/1337469588720799749/aEOmnHTF_normal.jpg,,,Konstantinos Karagiannis,"Math is funny. Even if we find out dark matter is really particles, no one will have to update their slide decks if they say some number is larger than ""all the particles in the known universe."" Triple 10^86 and see.",原创,en,1,0,0,3,2018-10-29 17:32:06,2024-04-11 11:39:32,1056961889593286656,1134334789,KonstantHacker,0,[],,,
https://twitter.com/1134334789/status/1056213753556013056,https://twitter.com/KonstantHacker,https://pbs.twimg.com/profile_images/1337469588720799749/aEOmnHTF_normal.jpg,,,Konstantinos Karagiannis,"Microsoft wants to help the US govt with AI and other emerging technologies. Remember that they might have a shot at excelling in quantum computing, in particular, with their Majorana fermion research https://t.co/Mnmukj6LYn",原创,en,0,1,0,0,2018-10-27 15:59:17,2024-04-11 11:39:32,1056213753556013056,1134334789,KonstantHacker,0,[],,,
https://twitter.com/1134334789/status/1054751755320377344,https://twitter.com/KonstantHacker,https://pbs.twimg.com/profile_images/1337469588720799749/aEOmnHTF_normal.jpg,,,Konstantinos Karagiannis,"This HTC phone can only be bought with BTC or ETH, and contains a ""micro OS"" wallet called Zion that protects cryptocurrency from Android. I'd need to see some serious security testing to spend $1000 on an unproven/unseen solution https://t.co/tBnJlcGRxW",原创,en,0,0,0,0,2018-10-23 15:09:49,2024-04-11 11:39:32,1054751755320377344,1134334789,KonstantHacker,0,[],,,
https://twitter.com/1134334789/status/1054750582324559872,https://twitter.com/KonstantHacker,https://pbs.twimg.com/profile_images/1337469588720799749/aEOmnHTF_normal.jpg,,,Konstantinos Karagiannis,Using real-world hacking datasets to train AI for InfoSec defense is a good thing ... just make sure your AI itself cannot be tricked. This is a new attack vector I'm sure will be on the rise. https://t.co/vry3yZ0bhj,原创,en,1,0,0,3,2018-10-23 15:05:09,2024-04-11 11:39:32,1054750582324559872,1134334789,KonstantHacker,0,[],,,
https://twitter.com/1134334789/status/1054749890889289728,https://twitter.com/KonstantHacker,https://pbs.twimg.com/profile_images/1337469588720799749/aEOmnHTF_normal.jpg,,,Konstantinos Karagiannis,"Can AI park a car with only 12 artificial neurons? Assuming this press release is true, you should feel badly if you failed your road test due to parallel parking lol https://t.co/dNpCU25LtP",原创,en,0,0,0,1,2018-10-23 15:02:24,2024-04-11 11:39:32,1054749890889289728,1134334789,KonstantHacker,0,[],,,
https://twitter.com/1134334789/status/1054450769892687874,https://twitter.com/KonstantHacker,https://pbs.twimg.com/profile_images/1337469588720799749/aEOmnHTF_normal.jpg,,,Konstantinos Karagiannis,"""Unhackable"" alert: quantum networking  https://t.co/ELhSHV3hzg",原创,en,0,0,0,0,2018-10-22 19:13:48,2024-04-11 11:39:46,1054450769892687874,1134334789,KonstantHacker,0,[],,,
https://twitter.com/1134334789/status/1054413228854403073,https://twitter.com/KonstantHacker,https://pbs.twimg.com/profile_images/1337469588720799749/aEOmnHTF_normal.jpg,,,Konstantinos Karagiannis,"North Korea hacking crew has stolen $571 million in cryptocurrency (and a whole lot more in fiat, btw) https://t.co/B3lQamwSsA",原创,en,1,26,1,24,2018-10-22 16:44:38,2024-04-11 11:39:46,1054413228854403073,1134334789,KonstantHacker,0,[],,,
https://twitter.com/1134334789/status/1054412977884053504,https://twitter.com/KonstantHacker,https://pbs.twimg.com/profile_images/1337469588720799749/aEOmnHTF_normal.jpg,,,Konstantinos Karagiannis,Hacking a Tesla in seconds ... and not knowing how to unplug it https://t.co/1u49EveiL8,原创,en,0,0,0,0,2018-10-22 16:43:38,2024-04-11 11:39:46,1054412977884053504,1134334789,KonstantHacker,0,[],,,
https://twitter.com/1134334789/status/1053392072949055489,https://twitter.com/KonstantHacker,https://pbs.twimg.com/profile_images/1337469588720799749/aEOmnHTF_normal.jpg,,,Konstantinos Karagiannis,Quantum supremacy alert https://t.co/mwDawmUj0E,原创,pt,0,1,0,0,2018-10-19 21:06:55,2024-04-11 11:39:46,1053392072949055489,1134334789,KonstantHacker,0,[],,,
https://twitter.com/1134334789/status/1053357647695613952,https://twitter.com/KonstantHacker,https://pbs.twimg.com/profile_images/1337469588720799749/aEOmnHTF_normal.jpg,,,Konstantinos Karagiannis,"Tim Cook wants a retraction about Chinese hacking their hardware in the factory. That's fair. Also, watch out for Chinese hardware.",原创,en,0,0,0,1,2018-10-19 18:50:08,2024-04-11 11:39:46,1053357647695613952,1134334789,KonstantHacker,0,[],,,
https://twitter.com/1134334789/status/1053031733350797317,https://twitter.com/KonstantHacker,https://pbs.twimg.com/profile_images/1337469588720799749/aEOmnHTF_normal.jpg,,,Konstantinos Karagiannis,I'm trying to think of application functions where it's okay to not use authentication. How about mobile check deposit? I'm cool with someone doing that to my account anytime...,原创,en,2,0,0,1,2018-10-18 21:15:04,2024-04-11 11:39:46,1053031733350797317,1134334789,KonstantHacker,0,[],,,
https://twitter.com/1134334789/status/1052220331493117953,https://twitter.com/KonstantHacker,https://pbs.twimg.com/profile_images/1337469588720799749/aEOmnHTF_normal.jpg,,,Konstantinos Karagiannis,Finding ways to have AI work with people is important. But expecting AI to one day think like people may be off-track thinking. I'll be hitting these topics at my #ISFCongress2018 keynote end of the month https://t.co/fyxb1fOH2W,原创,en,0,1,0,0,2018-10-16 15:30:50,2024-04-11 11:39:46,1052220331493117953,1134334789,KonstantHacker,0,[],,,
https://twitter.com/1134334789/status/1052219624815816710,https://twitter.com/KonstantHacker,https://pbs.twimg.com/profile_images/1337469588720799749/aEOmnHTF_normal.jpg,,,Konstantinos Karagiannis,"Hezbollah hacking crew shut down, and we are reminded of a bizarre lesson in InfoSec: Beware social media profiles of attractive people... https://t.co/Urg8Oac9au",原创,en,0,2,0,1,2018-10-16 15:28:02,2024-04-11 11:39:46,1052219624815816710,1134334789,KonstantHacker,0,[],,,
https://twitter.com/1134334789/status/1051824910765617154,https://twitter.com/KonstantHacker,https://pbs.twimg.com/profile_images/1337469588720799749/aEOmnHTF_normal.jpg,,,Konstantinos Karagiannis,Zero Trust security is a decade-old idea that's finally possible to implement without building an entire separate company to do so  https://t.co/2eH6c9UDcF,原创,en,0,0,0,1,2018-10-15 13:19:35,2024-04-11 11:39:46,1051824910765617154,1134334789,KonstantHacker,0,[],,,
https://twitter.com/1134334789/status/1050077805667643393,https://twitter.com/KonstantHacker,https://pbs.twimg.com/profile_images/1337469588720799749/aEOmnHTF_normal.jpg,,,Konstantinos Karagiannis,"If quantum computing can simulate the universe, can it help us simulate life? https://t.co/5hucpBgq6M",原创,en,1,0,0,0,2018-10-10 17:37:13,2024-04-11 11:39:46,1050077805667643393,1134334789,KonstantHacker,0,[],,,
https://twitter.com/1134334789/status/1049487198217793541,https://twitter.com/KonstantHacker,https://pbs.twimg.com/profile_images/1337469588720799749/aEOmnHTF_normal.jpg,,,Konstantinos Karagiannis,No one uses Google+ but everyone has an account by force https://t.co/dVybkBugaq,原创,en,0,0,0,3,2018-10-09 02:30:21,2024-04-11 11:39:46,1049487198217793541,1134334789,KonstantHacker,0,[],,,
https://twitter.com/1134334789/status/1049447173350457344,https://twitter.com/KonstantHacker,https://pbs.twimg.com/profile_images/1337469588720799749/aEOmnHTF_normal.jpg,,,Konstantinos Karagiannis,"China is not inserting micro hacking hardware into Apple, but also China totally could https://t.co/XDLtRRyCKp",原创,en,0,0,0,0,2018-10-08 23:51:18,2024-04-11 11:39:46,1049447173350457344,1134334789,KonstantHacker,0,[],,,
https://twitter.com/1134334789/status/1049422271004205056,https://twitter.com/KonstantHacker,https://pbs.twimg.com/profile_images/1337469588720799749/aEOmnHTF_normal.jpg,,,Konstantinos Karagiannis,Every time Facebook has hacking anomalies I imagine the press is itching for another Ashley Madison https://t.co/BlPHnQIDx3,原创,en,0,0,0,1,2018-10-08 22:12:21,2024-04-11 11:40:04,1049422271004205056,1134334789,KonstantHacker,0,[],,,
https://twitter.com/1134334789/status/1049421103377059840,https://twitter.com/KonstantHacker,https://pbs.twimg.com/profile_images/1337469588720799749/aEOmnHTF_normal.jpg,,,Konstantinos Karagiannis,"After @taylorswift13 becomes 35 and can run for president, she should probably add @SwiftOnSecurity to the ticket so we can finally address InfoSec at the presidential level.",原创,en,0,3,0,12,2018-10-08 22:07:43,2024-04-11 11:40:04,1049421103377059840,1134334789,KonstantHacker,0,[],,,
https://twitter.com/1134334789/status/1047514063981502464,https://twitter.com/KonstantHacker,https://pbs.twimg.com/profile_images/1337469588720799749/aEOmnHTF_normal.jpg,,,Konstantinos Karagiannis,Is there a clear career path to becoming a quantum computer programmer? https://t.co/F7XTDvA48n,原创,en,1,0,0,1,2018-10-03 15:49:49,2024-04-11 11:40:04,1047514063981502464,1134334789,KonstantHacker,0,[],,,
https://twitter.com/1134334789/status/1047513529962696704,https://twitter.com/KonstantHacker,https://pbs.twimg.com/profile_images/1337469588720799749/aEOmnHTF_normal.jpg,,,Konstantinos Karagiannis,"I totally get this plea deal, but prosecuting the sale of encrypted phones like this may set some dangerous legal precedents https://t.co/gOTvjkMNvA",原创,en,0,0,0,0,2018-10-03 15:47:42,2024-04-11 11:40:04,1047513529962696704,1134334789,KonstantHacker,0,[],,,
https://twitter.com/1134334789/status/1047512308073881600,https://twitter.com/KonstantHacker,https://pbs.twimg.com/profile_images/1337469588720799749/aEOmnHTF_normal.jpg,,,Konstantinos Karagiannis,North Korea continues to make nation-state hacking a nice revenue stream. Who says they're not part of the global economy? https://t.co/5R1kBrKGpd,原创,en,0,0,0,0,2018-10-03 15:42:50,2024-04-11 11:40:04,1047512308073881600,1134334789,KonstantHacker,0,[],,,
https://twitter.com/1134334789/status/1045670520618930176,https://twitter.com/KonstantHacker,https://pbs.twimg.com/profile_images/1337469588720799749/aEOmnHTF_normal.jpg,,,Konstantinos Karagiannis,Russian hacking crew is using UEFI rootkits now! https://t.co/6fxY29IlwE,原创,en,0,0,0,0,2018-09-28 13:44:14,2024-04-11 11:40:04,1045670520618930176,1134334789,KonstantHacker,0,[],,,
https://twitter.com/1134334789/status/1044282530411794432,https://twitter.com/KonstantHacker,https://pbs.twimg.com/profile_images/1337469588720799749/aEOmnHTF_normal.jpg,,,Konstantinos Karagiannis,Don't forget Microsoft in quantum computing. They really have a shot at winning the arms race https://t.co/VRI9uGY7KC,原创,en,0,0,0,0,2018-09-24 17:48:51,2024-04-11 11:40:04,1044282530411794432,1134334789,KonstantHacker,0,[],,,
https://twitter.com/1134334789/status/1044282149724192771,https://twitter.com/KonstantHacker,https://pbs.twimg.com/profile_images/1337469588720799749/aEOmnHTF_normal.jpg,,,Konstantinos Karagiannis,Sometimes a proposed quantum computing design promises ... millions(!) of qubits https://t.co/3p9tPIG68L,原创,en,0,0,0,2,2018-09-24 17:47:20,2024-04-11 11:40:04,1044282149724192771,1134334789,KonstantHacker,0,[],,,
https://twitter.com/1134334789/status/1043180645919477761,https://twitter.com/KonstantHacker,https://pbs.twimg.com/profile_images/1337469588720799749/aEOmnHTF_normal.jpg,,,Konstantinos Karagiannis,"If market cap is your concern, Ripple is now number two! If doing anything useful with blockchain technology is your raison d'être, then Ethereum is number one. https://t.co/YBpjI4GNdV",原创,en,0,0,0,1,2018-09-21 16:50:22,2024-04-11 11:40:04,1043180645919477761,1134334789,KonstantHacker,0,[],,,
https://twitter.com/1134334789/status/1043179869725773824,https://twitter.com/KonstantHacker,https://pbs.twimg.com/profile_images/1337469588720799749/aEOmnHTF_normal.jpg,,,Konstantinos Karagiannis,"Has Apple finally made an ""unhackable"" iPhone? They sure have made it tougher to use the toolz out there https://t.co/912IN69aRc",原创,en,0,1,0,0,2018-09-21 16:47:16,2024-04-11 11:40:04,1043179869725773824,1134334789,KonstantHacker,0,[],,,
https://twitter.com/1134334789/status/1041729594636857344,https://twitter.com/KonstantHacker,https://pbs.twimg.com/profile_images/1337469588720799749/aEOmnHTF_normal.jpg,,,Konstantinos Karagiannis,"Proof of stake, sharding, and other Ethereum must haves https://t.co/1wYtjiNQRq",原创,en,0,0,0,0,2018-09-17 16:44:24,2024-04-11 11:40:04,1041729594636857344,1134334789,KonstantHacker,0,[],,,
https://twitter.com/1134334789/status/1041729041202655232,https://twitter.com/KonstantHacker,https://pbs.twimg.com/profile_images/1337469588720799749/aEOmnHTF_normal.jpg,,,Konstantinos Karagiannis,I've already found the week's weirdest hacking related headline. You're welcome https://t.co/n41bucGeCD,原创,en,0,0,0,0,2018-09-17 16:42:12,2024-04-11 11:40:04,1041729041202655232,1134334789,KonstantHacker,0,[],,,
