tweet_url,author_url,avatar_url,avatar_binary,topic,author_name,content,tweet_type,tweet_language,comment_count,retweet_count,quote_count,praise_count,publish_time,fetch_time,tweet_id,screen_id,screen_name,tourist_crawl_status,video_urls,original_author,tweet_img_url,tweet_img_binary
https://twitter.com/38956896/status/1780336262890615026,https://twitter.com/drericcole,https://pbs.twimg.com/profile_images/1745159303554637824/gjxJMm1M_normal.jpg,,,Dr. Eric Cole,"It's astonishing how many of us, myself included, simply accept life as it unfolds without pausing to reflect on whether the path we're on aligns with our true desires. Take a moment to step back and ensure that the life you're living is the one you've always dreamed of. https://t.co/xPxAYyopi1",原创,en,1,0,0,0,2024-04-16 20:43:36,2024-04-17 08:11:36,1780336262890615026,38956896,drericcole,0,['https://video.twimg.com/ext_tw_video/1780336234474180608/pu/vid/avc1/720x1280/zqsRc7OKtgq3khfM.mp4?tag=12'],,['https://pbs.twimg.com/ext_tw_video_thumb/1780336234474180608/pu/img/0Ud2JO0aMoLanO7F.jpg'],
https://twitter.com/38956896/status/1780242281796128869,https://twitter.com/drericcole,https://pbs.twimg.com/profile_images/1745159303554637824/gjxJMm1M_normal.jpg,,,Dr. Eric Cole,"🎧 Ready to level up your life? Join Dr. Eric Cole on Bulletproof Cyber as he dives deep into the concept of creating a blueprint for your life. Discover how to align your priorities, maximize your time, and design the life you truly desire. 

Listen now! https://t.co/8SfNKa1CCc https://t.co/C1GLIsWGJw",原创,en,0,0,0,0,2024-04-16 14:30:09,2024-04-17 08:11:36,1780242281796128869,38956896,drericcole,0,[],,['https://pbs.twimg.com/media/GLSw6WXXgAAEhcX.jpg'],
https://twitter.com/38956896/status/1780234979114471795,https://twitter.com/drericcole,https://pbs.twimg.com/profile_images/1745159303554637824/gjxJMm1M_normal.jpg,,,Dr. Eric Cole,"Let us each do our part, one smile, one compliment, and one hug at a time. For it is through these gestures of love that we can truly make a difference and heal our nation's wounds. 

#lifecoach #lifecoaching  #selfcare #personaldevelopment  #mentalhealth #selfdevelopment https://t.co/CnZ6rz9hEB",原创,en,0,0,0,0,2024-04-16 14:01:08,2024-04-17 08:11:36,1780234979114471795,38956896,drericcole,0,[],,['https://pbs.twimg.com/media/GLSqRsnXIAACuO5.jpg'],
https://twitter.com/38956896/status/1780204669672821063,https://twitter.com/drericcole,https://pbs.twimg.com/profile_images/1745159303554637824/gjxJMm1M_normal.jpg,,,Dr. Eric Cole,"The power of a hug is immeasurable. It's a selfless, selfish gift that energizes both the giver and the receiver.

#lifecoach #lifecoaching #lifecoachformen #selfcare #personaldevelopment #motivationalquotes #lifecoachingtips #mentalhealth #selfdevelopment #nlp #transformation https://t.co/XRfLFDT9kN",原创,en,2,0,0,2,2024-04-16 12:00:42,2024-04-17 08:11:36,1780204669672821063,38956896,drericcole,0,[],,['https://pbs.twimg.com/media/GLSOtmWWoAEWPLf.jpg'],
https://twitter.com/38956896/status/1779962959487193300,https://twitter.com/drericcole,https://pbs.twimg.com/profile_images/1745159303554637824/gjxJMm1M_normal.jpg,,,Dr. Eric Cole,"Embrace the pain, for it is the fuel of growth. Like a child's growing pains or the soreness after a heavy workout, pain is simply feedback from progress. Remember, pain is inevitable, but suffering is optional. https://t.co/gMLyvdxWOc",原创,en,1,0,0,1,2024-04-15 20:00:14,2024-04-17 08:11:36,1779962959487193300,38956896,drericcole,0,['https://video.twimg.com/ext_tw_video/1779962913593212928/pu/vid/avc1/720x1280/Y4FQ5omgVFE9KUu3.mp4?tag=12'],,['https://pbs.twimg.com/ext_tw_video_thumb/1779962913593212928/pu/img/OjwR7eU-BX732Aob.jpg'],
https://twitter.com/38956896/status/1779872603286450485,https://twitter.com/drericcole,https://pbs.twimg.com/profile_images/1745159303554637824/gjxJMm1M_normal.jpg,,,Dr. Eric Cole,"It's about preemptively identifying potential threats and vulnerabilities and implementing measures to mitigate them. By doing so, you're not merely responding to emergencies as they occur but actively preventing them from occurring in the first place. https://t.co/RAuOGUjLwn",原创,en,0,1,0,3,2024-04-15 14:01:11,2024-04-17 08:11:36,1779872603286450485,38956896,drericcole,0,[],,['https://pbs.twimg.com/media/GLNgstGXgAAVawi.jpg'],
https://twitter.com/38956896/status/1779844629359174130,https://twitter.com/drericcole,https://pbs.twimg.com/profile_images/1745159303554637824/gjxJMm1M_normal.jpg,,,Dr. Eric Cole,"Consider this: when we view life as hostile, every obstacle becomes a battle, every setback a defeat. But when we choose to see the world as friendly, challenges take on new meaning—they become opportunities for growth, resilience, and self-discovery. https://t.co/pykyBLXcfu",原创,en,0,0,0,2,2024-04-15 12:10:02,2024-04-17 08:11:36,1779844629359174130,38956896,drericcole,0,[],,['https://pbs.twimg.com/media/GLNHQgZWcAAeIVO.jpg'],
https://twitter.com/38956896/status/1779600607579402473,https://twitter.com/drericcole,https://pbs.twimg.com/profile_images/1745159303554637824/gjxJMm1M_normal.jpg,,,Dr. Eric Cole,"As we journey through the seasons of life, let's embrace each moment with open arms. Let's welcome the growth of spring, the warmth of summer, the abundance of fall, and the restorative peace of winter. #EmbraceChange #LifeSeasons #Motivation https://t.co/dWlQ5GhkrA",原创,en,0,1,0,2,2024-04-14 20:00:22,2024-04-17 08:11:36,1779600607579402473,38956896,drericcole,0,['https://video.twimg.com/ext_tw_video/1779600578865147904/pu/vid/avc1/720x1280/33mZRMzZYevgqZPF.mp4?tag=12'],,['https://pbs.twimg.com/ext_tw_video_thumb/1779600578865147904/pu/img/LWbw457r5davaTHS.jpg'],
https://twitter.com/38956896/status/1779238161392054312,https://twitter.com/drericcole,https://pbs.twimg.com/profile_images/1745159303554637824/gjxJMm1M_normal.jpg,,,Dr. Eric Cole,"So the next time change comes knocking at your door, don't push back. Embrace it. Embrace the possibilities, the challenges, and the growth that come with it. Because when we embrace change, we open ourselves up to a world of endless opportunities. 💫 #EmbraceChange #Motivation https://t.co/wSSvcKIRHq",原创,en,0,0,0,3,2024-04-13 20:00:08,2024-04-17 08:11:36,1779238161392054312,38956896,drericcole,0,['https://video.twimg.com/ext_tw_video/1779238130043797504/pu/vid/avc1/720x1280/LJ-OP4adGxQaufy4.mp4?tag=12'],,['https://pbs.twimg.com/ext_tw_video_thumb/1779238130043797504/pu/img/4-JY3fA7Dw7F2IcP.jpg'],
https://twitter.com/38956896/status/1779147563905552772,https://twitter.com/drericcole,https://pbs.twimg.com/profile_images/1745159303554637824/gjxJMm1M_normal.jpg,,,Dr. Eric Cole,"By honing these abilities, you not only equip yourself to navigate the complexities of the digital landscape but also to steer your organization towards sustainable growth and resilience. 

#business #entrepreneur #motivation #marketing #success #smallbusiness https://t.co/LBgixe3p8P",原创,en,0,0,0,3,2024-04-13 14:00:08,2024-04-17 08:11:36,1779147563905552772,38956896,drericcole,0,[],,['https://pbs.twimg.com/media/GLDNR46W0AAaPdd.jpg'],
https://twitter.com/38956896/status/1779117376501428461,https://twitter.com/drericcole,https://pbs.twimg.com/profile_images/1745159303554637824/gjxJMm1M_normal.jpg,,,Dr. Eric Cole,"The ability to pivot, innovate, and thrive in the face of change is essential for navigating life's ever-shifting landscape. Rather than clinging to the familiar or resisting the unknown, we can choose to embrace change as an opportunity for growth and renewal. https://t.co/vFHXzSeP5p",原创,en,0,0,0,3,2024-04-13 12:00:11,2024-04-17 08:11:36,1779117376501428461,38956896,drericcole,0,[],,['https://pbs.twimg.com/media/GLCx0xOW4AAUsGP.jpg'],
https://twitter.com/38956896/status/1778875786948198891,https://twitter.com/drericcole,https://pbs.twimg.com/profile_images/1745159303554637824/gjxJMm1M_normal.jpg,,,Dr. Eric Cole,"Instead of battling against our struggles, let's embrace them as opportunities for growth. Let's channel our energy into resilience, into perseverance, into finding the strength to rise above. Because it's not the absence of challenges that defines us, but how we respond to them. https://t.co/H13ZWXMK2Q",原创,en,0,0,0,2,2024-04-12 20:00:12,2024-04-17 08:11:36,1778875786948198891,38956896,drericcole,0,['https://video.twimg.com/ext_tw_video/1778875754786263040/pu/vid/avc1/720x1280/P5IrQM8Una4mMAzq.mp4?tag=17'],,['https://pbs.twimg.com/ext_tw_video_thumb/1778875754786263040/pu/img/lKYM69nwOJWQMupW.jpg'],
https://twitter.com/38956896/status/1778785464742232394,https://twitter.com/drericcole,https://pbs.twimg.com/profile_images/1745159303554637824/gjxJMm1M_normal.jpg,,,Dr. Eric Cole,"Focus on building a business model that prioritizes profitability and valuation, as these are the metrics that truly define long-term success and sustainability. By aligning your efforts with these goals, you pave a future where your business achieves its fullest potential. https://t.co/c3MnbFH1d1",原创,en,0,0,0,2,2024-04-12 14:01:17,2024-04-17 08:11:36,1778785464742232394,38956896,drericcole,0,[],,['https://pbs.twimg.com/media/GK-D88xWwAE6GeW.jpg'],
https://twitter.com/38956896/status/1778755077940940948,https://twitter.com/drericcole,https://pbs.twimg.com/profile_images/1745159303554637824/gjxJMm1M_normal.jpg,,,Dr. Eric Cole,"By reframing adversity as a catalyst for growth and embracing the discomfort it brings, we can transform setbacks into springboards for personal and professional development. With resilience as our ally, we can rise above any obstacle and emerge victorious.",原创,en,0,0,0,1,2024-04-12 12:00:32,2024-04-17 08:11:36,1778755077940940948,38956896,drericcole,0,[],,,
https://twitter.com/38956896/status/1778513470440259668,https://twitter.com/drericcole,https://pbs.twimg.com/profile_images/1745159303554637824/gjxJMm1M_normal.jpg,,,Dr. Eric Cole,"Sure, it might not always be easy. But every ending brings with it the promise of a fresh start. So let's choose to greet change with open arms and a positive mindset. Because when we embrace change, we embrace growth. And that's where the magic happens. ✨ #EmbraceChange https://t.co/vnUVnVTMN3",原创,en,0,1,0,5,2024-04-11 20:00:29,2024-04-17 08:11:36,1778513470440259668,38956896,drericcole,0,['https://video.twimg.com/ext_tw_video/1778513425192148992/pu/vid/avc1/720x1280/67knbQnmJ3Na_HgR.mp4?tag=12'],,['https://pbs.twimg.com/ext_tw_video_thumb/1778513425192148992/pu/img/Vo3iGHGodPHl1dAt.jpg'],
https://twitter.com/38956896/status/1778422861696250303,https://twitter.com/drericcole,https://pbs.twimg.com/profile_images/1745159303554637824/gjxJMm1M_normal.jpg,,,Dr. Eric Cole,"While endings may evoke a sense of loss or discomfort, they also herald the dawn of new beginnings and opportunities. By embracing the cyclical nature of existence, we can release attachments to the past and embrace the unfolding of new chapters in our lives. https://t.co/IsufwWEoQK",原创,en,0,0,0,1,2024-04-11 14:00:26,2024-04-17 08:11:36,1778422861696250303,38956896,drericcole,0,[],,['https://pbs.twimg.com/media/GK46KpLWcAAFDK1.jpg'],
https://twitter.com/38956896/status/1778392693787226612,https://twitter.com/drericcole,https://pbs.twimg.com/profile_images/1745159303554637824/gjxJMm1M_normal.jpg,,,Dr. Eric Cole,"At the core of my personal philosophy lies the belief that every individual holds the key to their own happiness and fulfillment. Rather than seeking validation or fulfillment from external sources, we can tap into our inner strength and chart our own course of life with purpose. https://t.co/OJN8IaXOi6",原创,en,0,1,0,5,2024-04-11 12:00:33,2024-04-17 08:11:36,1778392693787226612,38956896,drericcole,0,[],,['https://pbs.twimg.com/media/GK4euriXoAEIDzi.jpg'],
https://twitter.com/38956896/status/1778166206479921173,https://twitter.com/drericcole,https://pbs.twimg.com/profile_images/1745159303554637824/gjxJMm1M_normal.jpg,,,Dr. Eric Cole,"🎉 Get ready to dive into the thrilling world of cybersecurity! Excitement awaits as a new episode of 'Life of a CISO' premieres tomorrow on YouTube at 9AM EST! 

LINK: https://t.co/BF1OL8Oa4D 

#LifeOfACISO #Cybersecurity #Premiere #podcast #podcasting #podcastersofinstagram",原创,en,0,0,0,1,2024-04-10 21:00:35,2024-04-17 08:11:36,1778166206479921173,38956896,drericcole,0,[],,,
https://twitter.com/38956896/status/1778151041113973067,https://twitter.com/drericcole,https://pbs.twimg.com/profile_images/1745159303554637824/gjxJMm1M_normal.jpg,,,Dr. Eric Cole,"The cornerstone of resilience lies in accepting life's twists and turns without resistance. 
When we acknowledge what has transpired, we pave the way for growth and empowerment. 
Let go of the past's grip and embrace the present moment with unwavering acceptance. https://t.co/9pmjxcr9PS",原创,en,0,1,0,1,2024-04-10 20:00:19,2024-04-17 08:11:53,1778151041113973067,38956896,drericcole,0,['https://video.twimg.com/ext_tw_video/1778151011367989248/pu/vid/avc1/720x1280/xGn-69102l0WlpLO.mp4?tag=12'],,['https://pbs.twimg.com/ext_tw_video_thumb/1778151011367989248/pu/img/YKuqG7DJa-y_Fakg.jpg'],
https://twitter.com/38956896/status/1778060399109103778,https://twitter.com/drericcole,https://pbs.twimg.com/profile_images/1745159303554637824/gjxJMm1M_normal.jpg,,,Dr. Eric Cole,"Within the crucible of growth, pain emerges as the alchemical catalyst, forging our character and expanding our capabilities. 

Yet, amidst the crucible's flames, we must remember that suffering is a choice—a choice to be eschewed in favor of resilience and fortitude. https://t.co/H5CVJHX5F7",原创,en,0,0,0,1,2024-04-10 14:00:08,2024-04-17 08:11:53,1778060399109103778,38956896,drericcole,0,[],,['https://pbs.twimg.com/media/GKzwgkHXIAEK-1a.jpg'],
https://twitter.com/38956896/status/1778030235100832219,https://twitter.com/drericcole,https://pbs.twimg.com/profile_images/1745159303554637824/gjxJMm1M_normal.jpg,,,Dr. Eric Cole,"Acceptance is the gateway to empowerment. Embrace life's constants and craft your code for resilience. By acknowledging life's immutable truths, we lay the groundwork for crafting our personal code—a code that fortifies us against adversity and propels us toward our goals.",原创,en,0,0,0,1,2024-04-10 12:00:16,2024-04-17 08:11:53,1778030235100832219,38956896,drericcole,0,[],,,
https://twitter.com/38956896/status/1777805529349325299,https://twitter.com/drericcole,https://pbs.twimg.com/profile_images/1745159303554637824/gjxJMm1M_normal.jpg,,,Dr. Eric Cole,"Tune in to discover how to craft your personal code for navigating life's challenges. 

LINK: https://t.co/8SfNKa1CCc 

#BulletproofCybeRr #podcast #podcasting #podcastersofinstagram #podcasts #spotify #podcastlife #podcaster #music #youtube #radio #comedy #hiphop #applepodcasts https://t.co/J5s6rxaTfH",原创,en,0,0,0,1,2024-04-09 21:07:22,2024-04-17 08:11:53,1777805529349325299,38956896,drericcole,0,['https://video.twimg.com/ext_tw_video/1777805501411000320/pu/vid/avc1/720x1280/tBtM3ojpzk5Et9_J.mp4?tag=12'],,['https://pbs.twimg.com/ext_tw_video_thumb/1777805501411000320/pu/img/bIiFqopeQ1dY6Z2w.jpg'],
https://twitter.com/38956896/status/1777686484218191992,https://twitter.com/drericcole,https://pbs.twimg.com/profile_images/1745159303554637824/gjxJMm1M_normal.jpg,,,Dr. Eric Cole,"📣 New Podcast! ""Codes of Resilience"" on @Spreaker #advice #challenges #empowerment #mindset #personal #podcast #resilience #self_reliance #success #transformative https://t.co/pBXJIhO5Cu",原创,en,0,0,0,1,2024-04-09 13:14:20,2024-04-17 08:11:53,1777686484218191992,38956896,drericcole,0,[],,,
https://twitter.com/38956896/status/1777667888754597952,https://twitter.com/drericcole,https://pbs.twimg.com/profile_images/1745159303554637824/gjxJMm1M_normal.jpg,,,Dr. Eric Cole,"My mission, my purpose, is to awaken the world to this stark reality. I am not here to sell you products or peddle fear; I am here to sound the alarm, to ignite a flame of awareness in the hearts and minds of every citizen, every executive, and every policymaker. #cyberwar #ww3",原创,en,0,1,0,2,2024-04-09 12:00:26,2024-04-17 08:11:53,1777667888754597952,38956896,drericcole,0,[],,,
https://twitter.com/38956896/status/1777344406175072669,https://twitter.com/drericcole,https://pbs.twimg.com/profile_images/1745159303554637824/gjxJMm1M_normal.jpg,,,Dr. Eric Cole,"When you align your actions with your purpose, magic happens. It's a journey of transformation where every step forward brings you closer to the life you've always dreamed of. 

#PurposeDriven #TransformationalJourney #LifeChangingMoments #EmbraceYourCalling https://t.co/mv3oHO0tBv",原创,en,0,0,0,3,2024-04-08 14:35:02,2024-04-17 08:11:53,1777344406175072669,38956896,drericcole,0,[],,['https://pbs.twimg.com/media/GKplUYNWIAASB7r.jpg'],
https://twitter.com/38956896/status/1777305572209045715,https://twitter.com/drericcole,https://pbs.twimg.com/profile_images/1745159303554637824/gjxJMm1M_normal.jpg,,,Dr. Eric Cole,"Make the gym your priority not only for building physical strength but for cultivating a mindset geared towards success. 💪 🤯

Leave behind any frustrations within the gym walls, shifting your focus to self-improvement, collaboration, and mutual respect. https://t.co/PT0wkLYAWX",原创,en,0,0,0,3,2024-04-08 12:00:43,2024-04-17 08:11:53,1777305572209045715,38956896,drericcole,0,[],,['https://pbs.twimg.com/media/GKpB_5RW0AApjMl.jpg'],
https://twitter.com/38956896/status/1777063873444462783,https://twitter.com/drericcole,https://pbs.twimg.com/profile_images/1745159303554637824/gjxJMm1M_normal.jpg,,,Dr. Eric Cole,"Unlock the potential of your perfect day by taking action today. Often, the things we desire are within reach, waiting for us to seize them. It's time to let go of excuses and embrace the possibilities that surround us. Start making your dreams a reality now. 🌟 https://t.co/kVw3RYe4Nk",原创,en,0,0,0,1,2024-04-07 20:00:18,2024-04-17 08:11:53,1777063873444462783,38956896,drericcole,0,['https://video.twimg.com/ext_tw_video/1777063840108220416/pu/vid/avc1/720x1280/E6U65mFzJzJFugj6.mp4?tag=12'],,['https://pbs.twimg.com/ext_tw_video_thumb/1777063840108220416/pu/img/6Nzk8dCKg_P6Rvv1.jpg'],
https://twitter.com/38956896/status/1776943026415272119,https://twitter.com/drericcole,https://pbs.twimg.com/profile_images/1745159303554637824/gjxJMm1M_normal.jpg,,,Dr. Eric Cole,"Sometimes, amidst the throes of pain and adversity, we fail to recognize the hidden blessings that lie beneath the surface. It is easy to view suffering as nothing more than a cruel twist of fate, an unwelcome intrusion into our lives. Embrace the challenges that come your way.",原创,en,0,0,0,1,2024-04-07 12:00:06,2024-04-17 08:11:53,1776943026415272119,38956896,drericcole,0,[],,,
https://twitter.com/38956896/status/1776701519116505567,https://twitter.com/drericcole,https://pbs.twimg.com/profile_images/1745159303554637824/gjxJMm1M_normal.jpg,,,Dr. Eric Cole,"Challenge your obstacles: as we dream of our perfect days, obstacles inevitably arise. 

But are they truly insurmountable, or simply stories we've convinced ourselves are real? 

Question the narratives holding you back and pave the way for your ideal future. https://t.co/JfW7qeXAOP",原创,en,0,0,0,1,2024-04-06 20:00:26,2024-04-17 08:11:53,1776701519116505567,38956896,drericcole,0,['https://video.twimg.com/ext_tw_video/1776701489915781121/pu/vid/avc1/720x1280/zf89kgkf6k_rYABm.mp4?tag=12'],,['https://pbs.twimg.com/ext_tw_video_thumb/1776701489915781121/pu/img/VHQ8ksrX9Pb97gCc.jpg'],
https://twitter.com/38956896/status/1776612832236257320,https://twitter.com/drericcole,https://pbs.twimg.com/profile_images/1745159303554637824/gjxJMm1M_normal.jpg,,,Dr. Eric Cole,"The Power of Narrative: Your life is a story, and you are the author. Identify the limiting beliefs and stories that hold you back, and rewrite them into tales of empowerment and success. By changing the script, you change the outcome. #ChangeYourStory #Empowerment https://t.co/tVDJykUkpq",原创,en,0,0,0,0,2024-04-06 14:08:01,2024-04-17 08:11:53,1776612832236257320,38956896,drericcole,0,[],,['https://pbs.twimg.com/media/GKfL9I7WoAAPrBM.jpg'],
https://twitter.com/38956896/status/1776580615346729450,https://twitter.com/drericcole,https://pbs.twimg.com/profile_images/1745159303554637824/gjxJMm1M_normal.jpg,,,Dr. Eric Cole,"Embrace Your Power: You are the architect of your own reality. Every circumstance, every outcome, is shaped by your thoughts, actions, and beliefs. Own your role as the creator of your life, and watch as the world bends to your will.",原创,en,0,1,0,3,2024-04-06 12:00:00,2024-04-17 08:11:53,1776580615346729450,38956896,drericcole,0,[],,,
https://twitter.com/38956896/status/1776233505531269369,https://twitter.com/drericcole,https://pbs.twimg.com/profile_images/1745159303554637824/gjxJMm1M_normal.jpg,,,Dr. Eric Cole,What makes us great in cybersecurity can make us unhappy in other areas of life. Recognize when to use your superpowers for work and when to let them rest. Balance the analytical mind of a cybersecurity professional with the ability to find beauty and value in every moment.,原创,en,0,1,0,3,2024-04-05 13:00:43,2024-04-17 08:11:53,1776233505531269369,38956896,drericcole,0,[],,,
https://twitter.com/38956896/status/1776218371891077625,https://twitter.com/drericcole,https://pbs.twimg.com/profile_images/1745159303554637824/gjxJMm1M_normal.jpg,,,Dr. Eric Cole,"Dive deep into the power of authenticity and unlock the abundance that awaits you. Challenge yourself daily to question old beliefs, find beauty in moments of pain, and release the shackles of suffering. Your journey towards abundance begins with embracing your true self.",原创,en,0,0,0,4,2024-04-05 12:00:35,2024-04-17 08:11:53,1776218371891077625,38956896,drericcole,0,[],,,
https://twitter.com/38956896/status/1775991741201444966,https://twitter.com/drericcole,https://pbs.twimg.com/profile_images/1745159303554637824/gjxJMm1M_normal.jpg,,,Dr. Eric Cole,"🎙️ Tune in to the latest episode of ""Life of a CISO"" with Dr. Eric Cole, diving deep into the intriguing world of cybersecurity with a focus on the ""CISO Paradox."" Don't miss it! 

LINK: https://t.co/trn0OE0nj9 

#CISOParadox #Cybersecurity #DrEricCole #podcast #podcasting https://t.co/GVH3W1AUxN",原创,en,0,0,0,1,2024-04-04 21:00:02,2024-04-17 08:11:53,1775991741201444966,38956896,drericcole,0,[],,['https://pbs.twimg.com/media/GKWXEt8XgAA39sK.jpg'],
https://twitter.com/38956896/status/1775871003840667817,https://twitter.com/drericcole,https://pbs.twimg.com/profile_images/1745159303554637824/gjxJMm1M_normal.jpg,,,Dr. Eric Cole,"In this episode, we delve into the CISO paradox and how to navigate it. From conflicting responsibilities to shifting mindsets, Dr. E shares invaluable insights to help you stay ahead in the cybersecurity game. #podcast

LINK: https://t.co/rAf7T5Chuq https://t.co/Tnz8kQHua5",原创,en,0,0,0,1,2024-04-04 13:00:16,2024-04-17 08:11:53,1775871003840667817,38956896,drericcole,0,[],,['https://pbs.twimg.com/media/GKUpQ4iWIAAM24D.jpg'],
https://twitter.com/38956896/status/1775858436472774832,https://twitter.com/drericcole,https://pbs.twimg.com/profile_images/1745159303554637824/gjxJMm1M_normal.jpg,,,Dr. Eric Cole,"Embrace the paradox, for within it lies the opportunity to redefine norms and carve your path to greatness. In a world where responsibility outweighs authority, it's not about the hand you're dealt, but how you play it.",原创,en,0,0,0,0,2024-04-04 12:10:19,2024-04-17 08:11:53,1775858436472774832,38956896,drericcole,0,[],,,
https://twitter.com/38956896/status/1775614417935143031,https://twitter.com/drericcole,https://pbs.twimg.com/profile_images/1745159303554637824/gjxJMm1M_normal.jpg,,,Dr. Eric Cole,Are you living life by default or by design? It's time to break the cycle and start living with purpose. 🌟 #LifeGoals #PurposeDriven #mindset #millionairemindset #growthmindset #successmindset #entrepreneurmindset #positivemindset #mindsetiseverything #mindsetcoach https://t.co/eJ6tansTRe,原创,en,0,0,0,1,2024-04-03 20:00:41,2024-04-17 08:12:09,1775614417935143031,38956896,drericcole,0,['https://video.twimg.com/ext_tw_video/1775614385316048897/pu/vid/avc1/720x1280/1qzrgeC3WyoRlELl.mp4?tag=12'],,['https://pbs.twimg.com/ext_tw_video_thumb/1775614385316048897/pu/img/5mxejl7ORKaSkvYY.jpg'],
https://twitter.com/38956896/status/1775523901776224728,https://twitter.com/drericcole,https://pbs.twimg.com/profile_images/1745159303554637824/gjxJMm1M_normal.jpg,,,Dr. Eric Cole,"Recognize that you are the creator of your life. Every circumstance, every outcome, you've had a hand in shaping. Embrace the power of 100% responsibility. It's not about fault, but about ownership. Your thoughts, your beliefs, they shape your reality. https://t.co/XKEqfjBPLp",原创,en,0,0,1,1,2024-04-03 14:01:00,2024-04-17 08:12:09,1775523901776224728,38956896,drericcole,0,[],,['https://pbs.twimg.com/media/GKPtlCpWUAAxdDt.jpg'],
https://twitter.com/38956896/status/1775493655756722623,https://twitter.com/drericcole,https://pbs.twimg.com/profile_images/1745159303554637824/gjxJMm1M_normal.jpg,,,Dr. Eric Cole,"Success isn't about finding an easy path, it's about embracing the mundane and putting in the reps day after day. Whether it's cybersecurity, marksmanship, or mastering a new sport, greatness is earned through relentless practice. Embrace the boredom, push through the mundane.",原创,en,0,0,0,3,2024-04-03 12:00:49,2024-04-17 08:12:09,1775493655756722623,38956896,drericcole,0,[],,,
